Sheet: 产品列表
A1: 大分类 | B1: 子分类 | C1: 品名 | D1: 规格与简介 | E1: 采购价 | F1: 加价率 | G1: 批发价 | H1: 加价率 | I1: 零售价 | J1: 重量 | K1: 批发单位 | L1: 零售单位 | M1: 条码 | N1: 称码 | O1: 状态 | P1: 批发市场 | Q1: 供货商
C2: 补差 | D2: 补差 | G2: 0.0000 | I2: 0.0 | J2: 500.00000000 | K2: 斤 | L2: 份 | O2: 1
A3: 蔬菜 | B3: 叶菜类 | C3: 鸡心莲花白 | E3: 1 | F3: 0.1 | G3: =RC[-2]+RC[-1] -> 1.1000000000000001 | H3: 0.1 | I3: =RC[-2]+RC[-1] -> 1.2000000000000002 | J3: 500.00000000 | K3: 斤 | L3: 斤 | M3: 200000100000 | N3: 68 | O3: 1
A4: 蔬菜 | B4: 叶菜类 | C4: 香菜 | E4: 5 | F4: 0.5 | G4: =RC[-2]+RC[-1] -> 5.5 | H4: 1 | I4: =RC[-2]+RC[-1] -> 6.5 | J4: 500.00000000 | K4: 斤 | L4: 斤 | N4: 60 | O4: 1
A5: 蔬菜 | B5: 叶菜类 | C5: 韭黄 | D5: 长短均匀 | E5: 4.5 | F5: 0.4 | G5: =RC[-2]+RC[-1] -> 4.9000000000000004 | H5: 0.5 | I5: =RC[-2]+RC[-1] -> 5.4 | J5: 500.00000000 | K5: 斤 | L5: 斤 | N5: 21 | O5: 1
A6: 蔬菜 | B6: 叶菜类 | C6: 韭菜（短）/香韭菜 | D6: 长短均匀35-40cm，少量带泥 | E6: 1.6 | F6: 0.3 | G6: =RC[-2]+RC[-1] -> 1.9000000000000001 | H6: 0.6 | I6: =RC[-2]+RC[-1] -> 2.5 | J6: 500.00000000 | K6: 斤 | L6: 斤 | N6: 9 | O6: 1
A7: 蔬菜 | B7: 叶菜类 | C7: 韭菜（长） | D7: 长短均匀60-70cm，少量带泥 | E7: 2 | F7: 0.2 | G7: =RC[-2]+RC[-1] -> 2.2000000000000002 | H7: 0.5 | I7: =RC[-2]+RC[-1] -> 2.7 | J7: 500.00000000 | K7: 斤 | L7: 斤 | O7: 1
A8: 蔬菜 | B8: 叶菜类 | C8: 青笋尖 | E8: 0.7 | F8: 0.25 | G8: =RC[-2]+RC[-1] -> 0.95 | H8: 0.55000000000000004 | I8: =RC[-2]+RC[-1] -> 1.5 | J8: 500.00000000 | K8: 斤 | L8: 斤 | N8: 31 | O8: 1
A9: 蔬菜 | B9: 叶菜类 | C9: 青油菜 | G9: =RC[-2]+RC[-1] -> 0 | I9: =RC[-2]+RC[-1] -> 0 | J9: 500.00000000 | K9: 斤 | L9: 斤 | N9: 23 | O9: 0
A10: 蔬菜 | B10: 叶菜类 | C10: 软浆叶 | E10: 1.2 | F10: 0.35 | G10: =RC[-2]+RC[-1] -> 1.5499999999999998 | H10: 0.35 | I10: =RC[-2]+RC[-1] -> 1.9 | J10: 500.00000000 | K10: 斤 | L10: 斤 | N10: 75 | O10: 1
A11: 蔬菜 | B11: 叶菜类 | C11: 豌豆尖 | G11: =RC[-2]+RC[-1] -> 0 | I11: =RC[-2]+RC[-1] -> 0 | J11: 500.00000000 | K11: 斤 | L11: 斤 | N11: 7 | O11: 1
A12: 蔬菜 | B12: 叶菜类 | C12: 西芹 | G12: =RC[-2]+RC[-1] -> 0 | I12: =RC[-2]+RC[-1] -> 0 | J12: 500.00000000 | K12: 斤 | L12: 斤 | N12: 50 | O12: 1
A13: 蔬菜 | B13: 叶菜类 | C13: 西兰花 | D13: 约1斤/颗，根茎5-10cm | E13: 2.8 | F13: 0.5 | G13: =RC[-2]+RC[-1] -> 3.3 | H13: 0.5 | I13: =RC[-2]+RC[-1] -> 3.8 | J13: 500.00000000 | K13: 斤 | L13: 斤 | N13: 6 | O13: 1
A14: 蔬菜 | B14: 叶菜类 | C14: 菠菜 | D14: 带根，少量泥 | E14: 4 | F14: 0.3 | G14: =RC[-2]+RC[-1] -> 4.3 | H14: 0.4 | I14: =RC[-2]+RC[-1] -> 4.7 | J14: 500.00000000 | K14: 斤 | L14: 斤 | N14: 5 | O14: 1
A15: 蔬菜 | B15: 叶菜类 | C15: 菜头 | G15: =RC[-2]+RC[-1] -> 0 | I15: =RC[-2]+RC[-1] -> 0 | J15: 500.00000000 | K15: 斤 | L15: 斤 | N15: 48 | O15: 1
A16: 蔬菜 | B16: 叶菜类 | C16: 莲花白/甘蓝/卷心菜/包菜/椰菜 | D16: 椭圆，约2斤/个 | E16: 0.8 | F16: 0.15 | G16: =RC[-2]+RC[-1] -> 0.95000000000000007 | H16: 0.15 | I16: =RC[-2]+RC[-1] -> 1.1000000000000001 | J16: 1000.00000000 | K16: 斤 | L16: 斤 | N16: 32 | O16: 1
A17: 蔬菜 | B17: 叶菜类 | C17: 苋菜 | G17: =RC[-2]+RC[-1] -> 0 | I17: =RC[-2]+RC[-1] -> 0 | J17: 500.00000000 | K17: 斤 | L17: 斤 | N17: 80 | O17: 1
A18: 蔬菜 | B18: 叶菜类 | C18: 芹菜 | E18: 1.3 | F18: 0.2 | G18: =RC[-2]+RC[-1] -> 1.5 | H18: 0.3 | I18: =RC[-2]+RC[-1] -> 1.8 | J18: 500.00000000 | K18: 斤 | L18: 斤 | N18: 4 | O18: 1
A19: 蔬菜 | B19: 叶菜类 | C19: 花菜 | D19: 约1.5斤/个 | E19: 2 | F19: 0.4 | G19: =RC[-2]+RC[-1] -> 2.4 | H19: 0.4 | I19: =RC[-2]+RC[-1] -> 2.8 | J19: 500.00000000 | K19: 斤 | L19: 斤 | N19: 22 | O19: 1
A20: 蔬菜 | B20: 叶菜类 | C20: 红苕尖 | E20: 1.5 | F20: 0.35 | G20: =RC[-2]+RC[-1] -> 1.85 | H20: 0.65 | I20: =RC[-2]+RC[-1] -> 2.5 | J20: 500.00000000 | K20: 斤 | L20: 斤 | N20: 82 | O20: 1
A21: 蔬菜 | B21: 叶菜类 | C21: 红油菜 | G21: =RC[-2]+RC[-1] -> 0 | I21: =RC[-2]+RC[-1] -> 0 | J21: 500.00000000 | K21: 斤 | L21: 斤 | N21: 49 | O21: 1
A22: 蔬菜 | B22: 叶菜类 | C22: 紫色莲花白/紫甘蓝/紫包菜 | D22: 球形，约1斤/个 | E22: 2 | F22: 0.15 | G22: =RC[-2]+RC[-1] -> 2.15 | H22: 0.15 | I22: =RC[-2]+RC[-1] -> 2.2999999999999998 | J22: 500.00000000 | K22: 斤 | L22: 斤 | N22: 39 | O22: 1
A23: 蔬菜 | B23: 叶菜类 | C23: 空心菜 | E23: 1.2 | F23: 0.15 | G23: =RC[-2]+RC[-1] -> 1.3499999999999999 | H23: 0.3 | I23: =RC[-2]+RC[-1] -> 1.65 | J23: 500.00000000 | K23: 斤 | L23: 斤 | N23: 24 | O23: 1
A24: 蔬菜 | B24: 叶菜类 | C24: 生菜（散叶，大叶） | D24: 约0.5斤/颗 | E24: 2.5 | F24: 0.3 | G24: =RC[-2]+RC[-1] -> 2.8 | H24: 0.3 | I24: =RC[-2]+RC[-1] -> 3.0999999999999996 | J24: 500.00000000 | K24: 斤 | L24: 斤 | N24: 1 | O24: 1
A25: 蔬菜 | B25: 叶菜类 | C25: 瓢儿白 | E25: 1.25 | F25: 0.2 | G25: =RC[-2]+RC[-1] -> 1.45 | H25: 0.3 | I25: =RC[-2]+RC[-1] -> 1.75 | J25: 500.00000000 | K25: 斤 | L25: 斤 | N25: 16 | O25: 1
A26: 蔬菜 | B26: 叶菜类 | C26: 油麦菜 | E26: 1.2 | F26: 0.1 | G26: =RC[-2]+RC[-1] -> 1.3 | H26: 0.1 | I26: =RC[-2]+RC[-1] -> 1.4000000000000001 | J26: 500.00000000 | K26: 斤 | L26: 斤 | N26: 61 | O26: 1
A27: 蔬菜 | B27: 叶菜类 | C27: 小白菜 | E27: 1.4 | F27: 0.25 | G27: =RC[-2]+RC[-1] -> 1.65 | H27: 0.35 | I27: =RC[-2]+RC[-1] -> 2 | J27: 500.00000000 | K27: 斤 | L27: 斤 | N27: 55 | O27: 1
A28: 蔬菜 | B28: 叶菜类 | C28: 娃娃菜 | D28: 娃娃菜一袋 | G28: =RC[-2]+RC[-1] -> 0 | I28: =RC[-2]+RC[-1] -> 0 | J28: 750.00000000 | K28: 袋 | L28: 袋 | N28: 200 | O28: 0
A29: 蔬菜 | B29: 叶菜类 | C29: 大白菜（不带皮） | D29: 约2斤/颗 | E29: 0.8 | F29: 0.1 | G29: =RC[-2]+RC[-1] -> 0.9 | H29: 0.2 | I29: =RC[-2]+RC[-1] -> 1.1000000000000001 | J29: 500.00000000 | K29: 斤 | L29: 斤 | N29: 2 | O29: 1
A30: 蔬菜 | B30: 叶菜类 | C30: 大白菜（带皮） | E30: 0.35 | F30: 0.1 | G30: =RC[-2]+RC[-1] -> 0.44999999999999996 | H30: 0.2 | I30: =RC[-2]+RC[-1] -> 0.64999999999999991 | O30: 1
A31: 蔬菜 | B31: 叶菜类 | C31: 冬寒菜 | G31: =RC[-2]+RC[-1] -> 0 | I31: =RC[-2]+RC[-1] -> 0 | J31: 500.00000000 | K31: 斤 | L31: 斤 | N31: 45 | O31: 1
A32: 蔬菜 | B32: 叶菜类 | C32: 儿菜 | D32: 约2斤/个 | G32: =RC[-2]+RC[-1] -> 0 | I32: =RC[-2]+RC[-1] -> 0 | J32: 500.00000000 | K32: 斤 | L32: 斤 | N32: 54 | O32: 1
A33: 蔬菜 | B33: 叶菜类 | C33: 下锅耙 | E33: 1.2 | F33: 0.15 | G33: =RC[-2]+RC[-1] -> 1.3499999999999999 | H33: 0.2 | I33: =RC[-2]+RC[-1] -> 1.5499999999999998 | J33: 500.00000000 | K33: 斤 | L33: 斤 | N33: 53 | O33: 1
A34: 蔬菜 | B34: 根茎类 | C34: 黄豆芽 | E34: 0.9 | F34: 0.2 | G34: =RC[-2]+RC[-1] -> 1.1000000000000001 | H34: 0.4 | I34: =RC[-2]+RC[-1] -> 1.5 | J34: 500.00000000 | K34: 斤 | L34: 斤 | N34: 84 | O34: 1
A35: 蔬菜 | B35: 根茎类 | C35: 高笋 | E35: 3.5 | F35: 0.5 | G35: =RC[-2]+RC[-1] -> 4 | H35: 0.6 | I35: =RC[-2]+RC[-1] -> 4.5999999999999996 | J35: 500.00000000 | K35: 斤 | L35: 斤 | N35: 81 | O35: 1
A36: 蔬菜 | B36: 根茎类 | C36: 韭菜花 | E36: 3.5 | F36: 0.4 | G36: =RC[-2]+RC[-1] -> 3.9 | H36: 0.4 | I36: =RC[-2]+RC[-1] -> 4.3 | J36: 500.00000000 | K36: 斤 | L36: 斤 | N36: 83 | O36: 1
A37: 蔬菜 | B37: 根茎类 | C37: 青笋头 | D37: 约1斤/根 | G37: =RC[-2]+RC[-1] -> 0 | I37: =RC[-2]+RC[-1] -> 0 | J37: 500.00000000 | K37: 斤 | L37: 斤 | N37: 71 | O37: 1
A38: 蔬菜 | B38: 根茎类 | C38: 青笋/莴笋 | D38: 约1.5斤/根 | E38: 0.6 | F38: 0.2 | G38: =RC[-2]+RC[-1] -> 0.8 | H38: 0.4 | I38: =RC[-2]+RC[-1] -> 1.2000000000000002 | J38: 500.00000000 | K38: 斤 | L38: 斤 | N38: 90 | O38: 1
A39: 蔬菜 | B39: 根茎类 | C39: 藕/莲藕 | E39: 3.5 | F39: 0.5 | G39: =RC[-2]+RC[-1] -> 4 | H39: 0.5 | I39: =RC[-2]+RC[-1] -> 4.5 | J39: 500.00000000 | K39: 斤 | L39: 斤 | N39: 37 | O39: 1
A40: 蔬菜 | B40: 根茎类 | C40: 蒜苗/青蒜 | E40: 1.5 | F40: 0.5 | G40: =RC[-2]+RC[-1] -> 2 | H40: 0.5 | I40: =RC[-2]+RC[-1] -> 2.5 | J40: 500.00000000 | K40: 斤 | L40: 斤 | N40: 41 | O40: 1
A41: 蔬菜 | B41: 根茎类 | C41: 蒜台（老蒜台） | E41: 3.5 | F41: 0.35 | G41: =RC[-2]+RC[-1] -> 3.85 | H41: 0.35 | I41: =RC[-2]+RC[-1] -> 4.2 | J41: 500.00000000 | K41: 斤 | L41: 斤 | N41: 40 | O41: 1
A42: 蔬菜 | B42: 根茎类 | C42: 蒜台（新蒜台） | D42: 每份约重250克 | G42: =RC[-2]+RC[-1] -> 0 | I42: =RC[-2]+RC[-1] -> 0 | J42: 500.00000000 | K42: 斤 | L42: 斤 | N42: 67 | O42: 1
A43: 蔬菜 | B43: 根茎类 | C43: 芋头 | E43: 3 | F43: 0.3 | G43: =RC[-2]+RC[-1] -> 3.3 | H43: 0.5 | I43: =RC[-2]+RC[-1] -> 3.8 | J43: 500.00000000 | K43: 斤 | L43: 斤 | N43: 17 | O43: 1
A44: 蔬菜 | B44: 根茎类 | C44: 胡萝卜（细长）/ | D44: 色泽偏红，细长 | E44: 1.2 | F44: 0.2 | G44: =RC[-2]+RC[-1] -> 1.4 | H44: 0.3 | I44: =RC[-2]+RC[-1] -> 1.7 | J44: 500.00000000 | K44: 斤 | L44: 斤 | N44: 11 | O44: 1
A45: 蔬菜 | B45: 根茎类 | C45: 胡萝卜（中粗） | D45: 色泽金黄，中粗 | E45: 1.4 | F45: 0.3 | G45: =RC[-2]+RC[-1] -> 1.7 | H45: 0.3 | I45: =RC[-2]+RC[-1] -> 2 | J45: 500.00000000 | K45: 斤 | L45: 斤 | N45: 46 | O45: 1
A46: 蔬菜 | B46: 根茎类 | C46: 绿豆芽 | E46: 1 | F46: 0.2 | G46: =RC[-2]+RC[-1] -> 1.2 | H46: 0.3 | I46: =RC[-2]+RC[-1] -> 1.5 | J46: 500.00000000 | K46: 斤 | L46: 斤 | N46: 85 | O46: 1
A47: 蔬菜 | B47: 根茎类 | C47: 红薯 | E47: 1.5 | F47: 0.1 | G47: =RC[-2]+RC[-1] -> 1.6 | H47: 0.2 | I47: =RC[-2]+RC[-1] -> 1.8 | J47: 500.00000000 | K47: 斤 | L47: 斤 | N47: 36 | O47: 1
A48: 蔬菜 | B48: 根茎类 | C48: 红皮萝卜/泡萝卜 | E48: 1.2 | F48: 0.2 | G48: =RC[-2]+RC[-1] -> 1.4 | H48: 0.3 | I48: =RC[-2]+RC[-1] -> 1.7 | J48: 500.00000000 | K48: 斤 | L48: 斤 | N48: 44 | O48: 1
A49: 蔬菜 | B49: 根茎类 | C49: 白萝卜（细长） | D49: 约2斤/个 | E49: 0.9 | F49: 0.25 | G49: =RC[-2]+RC[-1] -> 1.1499999999999999 | H49: 0.35 | I49: =RC[-2]+RC[-1] -> 1.5 | J49: 500.00000000 | K49: 斤 | L49: 斤 | N49: 3 | O49: 1
A50: 蔬菜 | B50: 根茎类 | C50: 玉米（糯，带皮） | D50: 约0.7斤/个 | E50: 1.7 | F50: 0.3 | G50: =RC[-2]+RC[-1] -> 2 | H50: 0.5 | I50: =RC[-2]+RC[-1] -> 2.5 | J50: 500.00000000 | K50: 斤 | L50: 斤 | N50: 88 | O50: 1
A51: 蔬菜 | B51: 根茎类 | C51: 折耳根 | E51: 3.5 | F51: 0.25 | G51: =RC[-2]+RC[-1] -> 3.75 | H51: 0.35 | I51: =RC[-2]+RC[-1] -> 4.0999999999999996 | J51: 500.00000000 | K51: 斤 | L51: 斤 | N51: 66 | O51: 1
A52: 蔬菜 | B52: 根茎类 | C52: 山药（细）/铁棍 | E52: 8 | F52: 1 | G52: =RC[-2]+RC[-1] -> 9 | H52: 1.5 | I52: =RC[-2]+RC[-1] -> 10.5 | J52: 500.00000000 | K52: 斤 | L52: 斤 | N52: 26 | O52: 1
A53: 蔬菜 | B53: 根茎类 | C53: 山药（中粗） | E53: 5.5 | F53: 0.4 | G53: =RC[-2]+RC[-1] -> 5.9 | H53: 0.5 | I53: =RC[-2]+RC[-1] -> 6.4 | J53: 500.00000000 | K53: 斤 | L53: 斤 | O53: 1
A54: 蔬菜 | B54: 根茎类 | C54: 山药（最粗） | E54: 4.5 | F54: 0.3 | G54: =RC[-2]+RC[-1] -> 4.8 | H54: 0.4 | I54: =RC[-2]+RC[-1] -> 5.2 | J54: 500.00000000 | K54: 斤 | L54: 斤 | O54: 1
A55: 蔬菜 | B55: 根茎类 | C55: 土豆（白皮黄心，大） | D55: 个大，大小均匀 | E55: 1.6 | F55: 0.1 | G55: =RC[-2]+RC[-1] -> 1.7000000000000002 | H55: 0.2 | I55: =RC[-2]+RC[-1] -> 1.9000000000000001 | J55: 500.00000000 | K55: 斤 | L55: 斤 | N55: 20 | O55: 1
A56: 蔬菜 | B56: 根茎类 | C56: 土豆（白皮黄心，中小） | D56: 个小，大小不等 | E56: 1.3 | F56: 0.1 | G56: =RC[-2]+RC[-1] -> 1.4000000000000001 | H56: 0.2 | I56: =RC[-2]+RC[-1] -> 1.6 | J56: 500.00000000 | K56: 斤 | L56: 斤 | O56: 1
A57: 蔬菜 | B57: 根茎类 | C57: 土豆（红皮白心，大） | D57: 个大，大小均匀 | E57: 1.2 | F57: 0.1 | G57: =RC[-2]+RC[-1] -> 1.3 | H57: 0.2 | I57: =RC[-2]+RC[-1] -> 1.5 | J57: 500.00000000 | K57: 斤 | L57: 斤 | O57: 1
A58: 蔬菜 | B58: 根茎类 | C58: 土豆（红皮白心，中小） | D58: 个小，大小不等 | E58: 0.95 | F58: 0.1 | G58: =RC[-2]+RC[-1] -> 1.05 | H58: 0.25 | I58: =RC[-2]+RC[-1] -> 1.3 | J58: 500.00000000 | K58: 斤 | L58: 斤 | O58: 1
A59: 蔬菜 | B59: 根茎类 | C59: 圆根萝卜 | D59: 圆形，不空心 | G59: =RC[-2]+RC[-1] -> 0 | I59: =RC[-2]+RC[-1] -> 0 | J59: 500.00000000 | K59: 斤 | L59: 斤 | N59: 70 | O59: 1
A60: 蔬菜 | B60: 茄果类 | C60: 黄瓜（水黄瓜） | D60: 细长，约0.5斤/根 | E60: 0.7 | F60: 0.25 | G60: =RC[-2]+RC[-1] -> 0.95 | H60: 0.55000000000000004 | I60: =RC[-2]+RC[-1] -> 1.5 | J60: 500.00000000 | K60: 斤 | L60: 斤 | N60: 10 | O60: 1
A61: 蔬菜 | B61: 茄果类 | C61: 黄瓜（旱黄瓜） | D61: 短粗，约0.5斤/根 | E61: 1.2 | F61: 0.1 | G61: =RC[-2]+RC[-1] -> 1.3 | H61: 0.1 | I61: =RC[-2]+RC[-1] -> 1.4000000000000001 | J61: 500.00000000 | K61: 斤 | L61: 斤 | N61: 87 | O61: 1
A62: 蔬菜 | B62: 茄果类 | C62: 西葫芦 | D62: 每份大约250克 | E62: 1 | F62: 0.3 | G62: =RC[-2]+RC[-1] -> 1.3 | H62: 0.6 | I62: =RC[-2]+RC[-1] -> 1.9 | J62: 500.00000000 | K62: 斤 | L62: 份 | N62: 62 | O62: 1
A63: 蔬菜 | B63: 茄果类 | C63: 西红柿 | E63: 0.9 | F63: 0.4 | G63: =RC[-2]+RC[-1] -> 1.3 | H63: 0.6 | I63: =RC[-2]+RC[-1] -> 1.9 | J63: 500.00000000 | K63: 斤 | L63: 斤 | N63: 19 | O63: 1
A64: 蔬菜 | B64: 茄果类 | C64: 茄子 | D64: 约0.5斤/根 | E64: 1.2 | F64: 0.1 | G64: =RC[-2]+RC[-1] -> 1.3 | H64: 0.1 | I64: =RC[-2]+RC[-1] -> 1.4000000000000001 | J64: 500.00000000 | K64: 斤 | L64: 斤 | N64: 12 | O64: 1
A65: 蔬菜 | B65: 茄果类 | C65: 苦瓜 | D65: 约0.5斤/根 | E65: 0.6 | F65: 0.3 | G65: =RC[-2]+RC[-1] -> 0.89999999999999991 | H65: 0.6 | I65: =RC[-2]+RC[-1] -> 1.5 | J65: 500.00000000 | K65: 斤 | L65: 斤 | N65: 14 | O65: 1
A66: 蔬菜 | B66: 茄果类 | C66: 美人椒 | E66: 6 | F66: 0.6 | G66: =RC[-2]+RC[-1] -> 6.6 | H66: 0.6 | I66: =RC[-2]+RC[-1] -> 7.1999999999999993 | J66: 500.00000000 | K66: 斤 | L66: 斤 | N66: 78 | O66: 1
A67: 蔬菜 | B67: 茄果类 | C67: 甜椒（红） | D67: 约0.5斤/个 | E67: 3.5 | F67: 0.5 | G67: =RC[-2]+RC[-1] -> 4 | H67: 1 | I67: =RC[-2]+RC[-1] -> 5 | J67: 500.00000000 | K67: 斤 | L67: 斤 | N67: 33 | O67: 1
A68: 蔬菜 | B68: 茄果类 | C68: 玉米（水果，带皮） | D68: 约0.7斤/个 | E68: 1.5 | F68: 0.3 | G68: =RC[-2]+RC[-1] -> 1.8 | H68: 0.6 | I68: =RC[-2]+RC[-1] -> 2.4 | J68: 500.00000000 | K68: 斤 | L68: 斤 | N68: 18 | O68: 1
A69: 蔬菜 | B69: 茄果类 | C69: 尖椒（二荆条） | E69: 1.2 | F69: 0.35 | G69: =RC[-2]+RC[-1] -> 1.5499999999999998 | H69: 0.65 | I69: =RC[-2]+RC[-1] -> 2.1999999999999997 | J69: 500.00000000 | K69: 斤 | L69: 斤 | N69: 8 | O69: 1
A70: 蔬菜 | B70: 茄果类 | C70: 小米椒/小米辣 | E70: 3.5 | F70: 1 | G70: =RC[-2]+RC[-1] -> 4.5 | H70: 1.5 | I70: =RC[-2]+RC[-1] -> 6 | J70: 500.00000000 | K70: 斤 | L70: 斤 | N70: 51 | O70: 1
A71: 蔬菜 | B71: 茄果类 | C71: 嫩南瓜 | D71: 约1斤/个 | E71: 0.6 | F71: 0.3 | G71: =RC[-2]+RC[-1] -> 0.89999999999999991 | H71: 1.1000000000000001 | I71: =RC[-2]+RC[-1] -> 2 | J71: 500.00000000 | K71: 斤 | L71: 斤 | N71: 79 | O71: 1
A72: 蔬菜 | B72: 茄果类 | C72: 大青椒 | E72: 1.3 | F72: 0.4 | G72: =RC[-2]+RC[-1] -> 1.7000000000000002 | H72: 0.7 | I72: =RC[-2]+RC[-1] -> 2.4000000000000004 | J72: 500.00000000 | K72: 斤 | L72: 斤 | N72: 30 | O72: 1
A73: 蔬菜 | B73: 茄果类 | C73: 南瓜 | D73: 约10斤/个 | E73: 0.7 | F73: 0.3 | G73: =RC[-2]+RC[-1] -> 1 | H73: 0.5 | I73: =RC[-2]+RC[-1] -> 1.5 | J73: 500.00000000 | K73: 斤 | L73: 斤 | N73: 15 | O73: 1
A74: 蔬菜 | B74: 茄果类 | C74: 冬瓜 | D74: 约10斤/个 | E74: 0.5 | F74: 0.3 | G74: =RC[-2]+RC[-1] -> 0.8 | H74: 0.4 | I74: =RC[-2]+RC[-1] -> 1.2000000000000002 | J74: 500.00000000 | K74: 斤 | L74: 斤 | N74: 13 | O74: 1
A75: 蔬菜 | B75: 茄果类 | C75: 丝瓜 | D75: 约0.5斤/根 | E75: 1.6 | F75: 0.3 | G75: =RC[-2]+RC[-1] -> 1.9000000000000001 | H75: 0.4 | I75: =RC[-2]+RC[-1] -> 2.3000000000000003 | J75: 500.00000000 | K75: 斤 | L75: 斤 | N75: 72 | O75: 1
A76: 蔬菜 | B76: 菌菇类 | C76: 鸡腿菇 | D76: 5斤/袋 | E76: 45 | F76: 2.5 | G76: =RC[-2]+RC[-1] -> 47.5 | H76: 3 | I76: =RC[-2]+RC[-1] -> 50.5 | J76: 2.5 | K76: 袋 | L76: 袋 | N76: 64 | O76: 1 | P76: 白家 | Q76: 老潘靖平菌业
A77: 蔬菜 | B77: 菌菇类 | C77: 香菇（一级） | E77: 6 | F77: 0.5 | G77: =RC[-2]+RC[-1] -> 6.5 | H77: 0.5 | I77: =RC[-2]+RC[-1] -> 7 | J77: 500.00000000 | K77: 斤 | L77: 斤 | N77: 69 | O77: 1 | P77: 白家 | Q77: 老潘靖平菌业
A78: 蔬菜 | B78: 菌菇类 | C78: 香菇（二级） | E78: 3 | F78: 0.4 | G78: =RC[-2]+RC[-1] -> 3.4 | H78: 0.6 | I78: =RC[-2]+RC[-1] -> 4 | J78: 500.00000000 | K78: 斤 | L78: 斤 | O78: 1 | P78: 白家 | Q78: 老潘靖平菌业
A79: 蔬菜 | B79: 菌菇类 | C79: 银针菇 | D79: 10斤/袋 | E79: 28 | F79: 1 | G79: =RC[-2]+RC[-1] -> 29 | H79: 1 | I79: =RC[-2]+RC[-1] -> 30 | J79: 5000.00000000 | K79: 袋 | L79: 袋 | N79: 52 | O79: 1 | P79: 白家 | Q79: 老潘靖平菌业
A80: 蔬菜 | B80: 菌菇类 | C80: 金针菇（一级） | D80: 10斤/袋 | E80: 45 | F80: 2.5 | G80: =RC[-2]+RC[-1] -> 47.5 | H80: 3 | I80: =RC[-2]+RC[-1] -> 50.5 | J80: 5.0 | K80: 袋 | L80: 袋 | N80: 94 | O80: 1 | P80: 白家 | Q80: 老潘靖平菌业
A81: 蔬菜 | B81: 菌菇类 | C81: 金针菇（二级） | D81: 10斤/袋 | E81: 35 | F81: 1.8 | G81: =RC[-2]+RC[-1] -> 36.799999999999997 | H81: 2.2000000000000002 | I81: =RC[-2]+RC[-1] -> 39 | J81: 5.0 | K81: 袋 | L81: 袋 | N81: 94 | O81: 1 | P81: 白家 | Q81: 老潘靖平菌业
A82: 蔬菜 | B82: 菌菇类 | C82: 白蘑菇 | E82: 6.5 | F82: 0.5 | G82: =RC[-2]+RC[-1] -> 7 | H82: 0.5 | I82: =RC[-2]+RC[-1] -> 7.5 | J82: 500.00000000 | K82: 斤 | L82: 斤 | N82: 86 | O82: 1 | P82: 白家 | Q82: 老潘靖平菌业
A83: 蔬菜 | B83: 菌菇类 | C83: 杏鲍菇 | D83: 5斤/袋 | E83: 18 | F83: 3 | G83: =RC[-2]+RC[-1] -> 21 | H83: 4 | I83: =RC[-2]+RC[-1] -> 25 | J83: 500.00000000 | K83: 斤 | L83: 斤 | N83: 63 | O83: 1 | P83: 白家 | Q83: 老潘靖平菌业
A84: 蔬菜 | B84: 菌菇类 | C84: 平菇（一级） | E84: 4 | F84: 0.25 | G84: =RC[-2]+RC[-1] -> 4.25 | H84: 0.3 | I84: =RC[-2]+RC[-1] -> 4.55 | J84: 500.00000000 | K84: 斤 | L84: 斤 | N84: 65 | O84: 1 | P84: 白家 | Q84: 老潘靖平菌业
A85: 蔬菜 | B85: 菌菇类 | C85: 平菇（二级） | E85: 2.5 | F85: 0.4 | G85: =RC[-2]+RC[-1] -> 2.9 | H85: 0.6 | I85: =RC[-2]+RC[-1] -> 3.5 | J85: 500.00000000 | K85: 斤 | L85: 斤 | O85: 1 | P85: 白家 | Q85: 老潘靖平菌业
A86: 蔬菜 | B86: 菌菇类 | C86: 茶树菇（一级） | D86: 5斤/袋 | E86: 20 | F86: 1 | G86: =RC[-2]+RC[-1] -> 21 | H86: 2 | I86: =RC[-2]+RC[-1] -> 23 | J86: 2.5 | K86: 袋 | L86: 袋 | O86: 1 | P86: 白家 | Q86: 老潘靖平菌业
A87: 蔬菜 | B87: 菌菇类 | C87: 茶树菇（二级） | D87: 5斤/袋 | E87: 15 | F87: 0.8 | G87: =RC[-2]+RC[-1] -> 15.8 | H87: 1.2 | I87: =RC[-2]+RC[-1] -> 17 | J87: 2.5 | K87: 袋 | L87: 袋 | O87: 1 | P87: 白家 | Q87: 老潘靖平菌业
A88: 蔬菜 | B88: 菌菇类 | C88: 白玉菇 | D88: 2-3两/袋 | E88: 2.5 | F88: 0.2 | G88: =RC[-2]+RC[-1] -> 2.7 | H88: 0.3 | I88: =RC[-2]+RC[-1] -> 3 | K88: 袋 | L88: 袋 | O88: 1 | P88: 白家 | Q88: 老潘靖平菌业
A89: 蔬菜 | B89: 菌菇类 | C89: 蟹味菇 | D89: 2-3两/袋 | E89: 2.5 | F89: 0.2 | G89: =RC[-2]+RC[-1] -> 2.7 | H89: 0.3 | I89: =RC[-2]+RC[-1] -> 3 | K89: 袋 | L89: 袋 | O89: 1 | P89: 白家 | Q89: 老潘靖平菌业
A90: 蔬菜 | B90: 菌菇类 | C90: 海鲜菇（一级） | D90: 5斤/袋 | E90: 30 | F90: 1 | G90: =RC[-2]+RC[-1] -> 31 | H90: 2 | I90: =RC[-2]+RC[-1] -> 33 | J90: 2.5 | K90: 袋 | L90: 袋 | O90: 1 | P90: 白家 | Q90: 老潘靖平菌业
A91: 蔬菜 | B91: 菌菇类 | C91: 海鲜菇（二级） | D91: 5斤/袋 | E91: 25 | F91: 1 | G91: =RC[-2]+RC[-1] -> 26 | H91: 2 | I91: =RC[-2]+RC[-1] -> 28 | J91: 2.5 | K91: 袋 | L91: 袋 | O91: 1 | P91: 白家 | Q91: 老潘靖平菌业
A92: 蔬菜 | B92: 菌菇类 | C92: 鲍鱼菇 | D92: 5斤/袋 | E92: 18 | F92: 1.5 | G92: =RC[-2]+RC[-1] -> 19.5 | H92: 2 | I92: =RC[-2]+RC[-1] -> 21.5 | J92: 2.5 | K92: 袋 | L92: 袋 | O92: 1 | P92: 白家 | Q92: 老潘靖平菌业
A93: 蔬菜 | B93: 菌菇类 | C93: 松茸（一级） | E93: 120 | F93: 2 | G93: =RC[-2]+RC[-1] -> 122 | H93: 3 | I93: =RC[-2]+RC[-1] -> 125 | J93: 500.00000000 | K93: 斤 | L93: 斤 | O93: 1 | P93: 白家 | Q93: 老潘靖平菌业
A94: 蔬菜 | B94: 菌菇类 | C94: 松茸（二级） | E94: 90 | F94: 2 | G94: =RC[-2]+RC[-1] -> 92 | H94: 3 | I94: =RC[-2]+RC[-1] -> 95 | J94: 500.00000000 | K94: 斤 | L94: 斤 | O94: 1 | P94: 白家 | Q94: 老潘靖平菌业
A95: 蔬菜 | B95: 菌菇类 | C95: 野生鸡枞菌（一级） | E95: 95 | F95: 2 | G95: =RC[-2]+RC[-1] -> 97 | H95: 3 | I95: =RC[-2]+RC[-1] -> 100 | J95: 500.00000000 | K95: 斤 | L95: 斤 | O95: 1 | P95: 白家 | Q95: 老潘靖平菌业
A96: 蔬菜 | B96: 菌菇类 | C96: 野生鸡枞菌（二级） | E96: 70 | F96: 2 | G96: =RC[-2]+RC[-1] -> 72 | H96: 3 | I96: =RC[-2]+RC[-1] -> 75 | J96: 500.00000000 | K96: 斤 | L96: 斤 | O96: 1 | P96: 白家 | Q96: 老潘靖平菌业
A97: 蔬菜 | B97: 菌菇类 | C97: 鸡菇 | D97: 4.8斤/袋 | E97: 20 | F97: 1 | G97: =RC[-2]+RC[-1] -> 21 | H97: 2 | I97: =RC[-2]+RC[-1] -> 23 | K97: 袋 | L97: 袋 | O97: 1 | P97: 白家 | Q97: 老潘靖平菌业
A98: 蔬菜 | B98: 菌菇类 | C98: 猪肚菌 | D98: 2-3两/袋 | E98: 3 | F98: 0.2 | G98: =RC[-2]+RC[-1] -> 3.2 | H98: 0.3 | I98: =RC[-2]+RC[-1] -> 3.5 | K98: 袋 | L98: 袋 | O98: 1 | P98: 白家 | Q98: 老潘靖平菌业
A99: 蔬菜 | B99: 菌菇类 | C99: 野生牛肝菌 | E99: 35 | F99: 2 | G99: =RC[-2]+RC[-1] -> 37 | H99: 3 | I99: =RC[-2]+RC[-1] -> 40 | J99: 500.00000000 | K99: 斤 | L99: 斤 | O99: 1 | P99: 白家 | Q99: 老潘靖平菌业
A100: 蔬菜 | B100: 葱姜蒜 | C100: 藠头 | E100: 4 | F100: 0.3 | G100: =RC[-2]+RC[-1] -> 4.3 | H100: 0.4 | I100: =RC[-2]+RC[-1] -> 4.7 | J100: 500.00000000 | K100: 斤 | L100: 斤 | M100: 200007700000 | N100: 77 | O100: 1
A101: 蔬菜 | B101: 葱姜蒜 | C101: 蒜米 | E101: 3.2 | F101: 0.3 | G101: =RC[-2]+RC[-1] -> 3.5 | H101: 0.3 | I101: =RC[-2]+RC[-1] -> 3.8 | J101: 500.00000000 | K101: 斤 | L101: 斤 | M101: 200009200000 | N101: 92 | O101: 1
A102: 蔬菜 | B102: 葱姜蒜 | C102: 老姜 | D102: 每份约重100克 | E102: 3.5 | F102: 1 | G102: =RC[-2]+RC[-1] -> 4.5 | H102: 1.5 | I102: =RC[-2]+RC[-1] -> 6 | J102: 100.00000000 | K102: 斤 | L102: 份 | M102: 200002900000 | N102: 29 | O102: 1
A103: 蔬菜 | B103: 葱姜蒜 | C103: 独蒜（小） | D103: 直径2.2-2.8cm | E103: 6.5 | F103: 0.4 | G103: =RC[-2]+RC[-1] -> 6.9 | H103: 0.6 | I103: =RC[-2]+RC[-1] -> 7.5 | J103: 500.00000000 | K103: 斤 | L103: 斤 | M103: 200009300000 | N103: 93 | O103: 1
A104: 蔬菜 | B104: 葱姜蒜 | C104: 独蒜（大） | D104: 直径2.2cm | E104: 8 | F104: 0.5 | G104: =RC[-2]+RC[-1] -> 8.5 | H104: 0.5 | I104: =RC[-2]+RC[-1] -> 9 | J104: 500.00000000 | K104: 斤 | L104: 斤 | M104: 200002800000 | N104: 28 | O104: 1
A105: 蔬菜 | B105: 葱姜蒜 | C105: 洋葱（紫） | D105: 约1斤/个 | E105: 0.9 | F105: 0.25 | G105: =RC[-2]+RC[-1] -> 1.1499999999999999 | H105: 0.35 | I105: =RC[-2]+RC[-1] -> 1.5 | J105: 500.00000000 | K105: 斤 | L105: 斤 | M105: 200002700000 | N105: 27 | O105: 1
A106: 蔬菜 | B106: 葱姜蒜 | C106: 洋葱（白） | D106: 约1斤/个 | E106: 0.9 | F106: 0.25 | G106: =RC[-2]+RC[-1] -> 1.1499999999999999 | H106: 0.35 | I106: =RC[-2]+RC[-1] -> 1.5 | J106: 500.00000000 | K106: 斤 | L106: 斤 | M106: 200008900000 | N106: 89 | O106: 1
A107: 蔬菜 | B107: 葱姜蒜 | C107: 小葱/香葱 | E107: 2.6 | F107: 0.25 | G107: =RC[-2]+RC[-1] -> 2.85 | H107: 0.25 | I107: =RC[-2]+RC[-1] -> 3.1 | J107: 500.00000000 | K107: 斤 | L107: 斤 | M107: 200003400000 | N107: 34 | O107: 1
A108: 蔬菜 | B108: 葱姜蒜 | C108: 子姜 | E108: 4.5 | F108: 0.3 | G108: =RC[-2]+RC[-1] -> 4.8 | H108: 0.3 | I108: =RC[-2]+RC[-1] -> 5.0999999999999996 | J108: 500.00000000 | K108: 斤 | L108: 斤 | M108: 200007600000 | N108: 76 | O108: 1
A109: 蔬菜 | B109: 葱姜蒜 | C109: 大蒜 | E109: 3.5 | F109: 0.35 | G109: =RC[-2]+RC[-1] -> 3.85 | H109: 0.45 | I109: =RC[-2]+RC[-1] -> 4.3 | J109: 500.00000000 | K109: 斤 | L109: 斤 | M109: 200004200000 | N109: 42 | O109: 1
A110: 蔬菜 | B110: 葱姜蒜 | C110: 大葱 | E110: 2.2 | F110: 0.25 | G110: =RC[-2]+RC[-1] -> 2.4500000000000002 | H110: 0.25 | I110: =RC[-2]+RC[-1] -> 2.7 | J110: 500.00000000 | K110: 斤 | L110: 斤 | M110: 200003500000 | N110: 35 | O110: 1
A111: 蔬菜 | B111: 豆品类 | C111: 豌豆子 | E111: 3.3 | G111: =RC[-2]+RC[-1] -> 3.3 | I111: =RC[-2]+RC[-1] -> 3.3 | J111: 500.00000000 | K111: 斤 | L111: 斤 | M111: 200004300000 | N111: 43 | O111: 1
A112: 蔬菜 | B112: 豆品类 | C112: 豇豆 | E112: 1.6 | G112: =RC[-2]+RC[-1] -> 1.6 | I112: =RC[-2]+RC[-1] -> 1.6 | J112: 500.00000000 | K112: 斤 | L112: 斤 | M112: 200002500000 | N112: 25 | O112: 1
A113: 蔬菜 | B113: 豆品类 | C113: 胡豆 | G113: =RC[-2]+RC[-1] -> 0 | I113: =RC[-2]+RC[-1] -> 0 | J113: 500.00000000 | K113: 斤 | L113: 斤 | M113: 200007400000 | N113: 74 | O113: 1
A114: 蔬菜 | B114: 豆品类 | C114: 毛豆子 | G114: =RC[-2]+RC[-1] -> 0 | I114: =RC[-2]+RC[-1] -> 0 | J114: 500.00000000 | K114: 斤 | L114: 斤 | M114: 200007300000 | N114: 73 | O114: 1
A115: 蔬菜 | B115: 豆品类 | C115: 毛豆 | E115: 2 | F115: 0.3 | G115: =RC[-2]+RC[-1] -> 2.2999999999999998 | H115: 0.3 | I115: =RC[-2]+RC[-1] -> 2.5999999999999996 | J115: 500.00000000 | K115: 斤 | L115: 斤 | M115: 200009100000 | N115: 91 | O115: 1
A116: 蔬菜 | B116: 豆品类 | C116: 无筋豆 | G116: =RC[-2]+RC[-1] -> 0 | I116: =RC[-2]+RC[-1] -> 0 | J116: 500.00000000 | K116: 斤 | L116: 斤 | M116: 200004700000 | N116: 47 | O116: 1
A117: 蔬菜 | B117: 豆品类 | C117: 四季豆 | E117: 2 | F117: 0.25 | G117: =RC[-2]+RC[-1] -> 2.25 | H117: 0.3 | I117: =RC[-2]+RC[-1] -> 2.5499999999999998 | J117: 500.00000000 | K117: 斤 | L117: 斤 | M117: 200003800000 | N117: 38 | O117: 1
A118: 冷鲜肉类 | B118: 猪肉 | C118: 带皮一级白条 | E118: 24 | F118: 1.25 | G118: =RC[-2]+RC[-1] -> 25.25 | H118: 1.25 | I118: =RC[-2]+RC[-1] -> 26.5 | K118: kg | P118: 白家 | Q118: 四海肉业
A119: 冷鲜肉类 | B119: 猪肉 | C119: 去皮白条 | E119: 25 | F119: 1.25 | G119: =RC[-2]+RC[-1] -> 26.25 | H119: 1.25 | I119: =RC[-2]+RC[-1] -> 27.5 | K119: kg | P119: 白家 | Q119: 四海肉业
A120: 冷鲜肉类 | B120: 猪肉 | C120: 带皮三级肉 | E120: 15 | F120: 1 | G120: =RC[-2]+RC[-1] -> 16 | H120: 1 | I120: =RC[-2]+RC[-1] -> 17 | K120: kg | P120: 白家 | Q120: 四海肉业
A121: 冷鲜肉类 | B121: 猪肉 | C121: 带皮五花 | E121: 25 | F121: 1 | G121: =RC[-2]+RC[-1] -> 26 | H121: 1 | I121: =RC[-2]+RC[-1] -> 27 | K121: kg | P121: 白家 | Q121: 四海肉业
A122: 冷鲜肉类 | B122: 猪肉 | C122: 带皮精五花 | E122: 32 | F122: 1.5 | G122: =RC[-2]+RC[-1] -> 33.5 | H122: 1.5 | I122: =RC[-2]+RC[-1] -> 35 | K122: kg | P122: 白家 | Q122: 四海肉业
A123: 冷鲜肉类 | B123: 猪肉 | C123: 带皮精三线五花 | E123: 36 | F123: 1.5 | G123: =RC[-2]+RC[-1] -> 37.5 | H123: 1.5 | I123: =RC[-2]+RC[-1] -> 39 | K123: kg | P123: 白家 | Q123: 四海肉业
A124: 冷鲜肉类 | B124: 猪肉 | C124: 带皮前腿 | E124: 24 | F124: 1 | G124: =RC[-2]+RC[-1] -> 25 | H124: 1 | I124: =RC[-2]+RC[-1] -> 26 | K124: kg | P124: 白家 | Q124: 四海肉业
A125: 冷鲜肉类 | B125: 猪肉 | C125: 带皮后腿 | E125: 25 | F125: 1 | G125: =RC[-2]+RC[-1] -> 26 | H125: 1 | I125: =RC[-2]+RC[-1] -> 27 | K125: kg | P125: 白家 | Q125: 四海肉业
A126: 冷鲜肉类 | B126: 猪肉 | C126: 带皮二刀 | E126: 28 | F126: 1 | G126: =RC[-2]+RC[-1] -> 29 | H126: 1 | I126: =RC[-2]+RC[-1] -> 30 | K126: kg | P126: 白家 | Q126: 四海肉业
A127: 冷鲜肉类 | B127: 猪肉 | C127: 带皮精二刀 | E127: 30 | F127: 1.25 | G127: =RC[-2]+RC[-1] -> 31.25 | H127: 1.25 | I127: =RC[-2]+RC[-1] -> 32.5 | K127: kg | P127: 白家 | Q127: 四海肉业
A128: 冷鲜肉类 | B128: 猪肉 | C128: 带皮带骨肘子 | E128: 22 | F128: 1 | G128: =RC[-2]+RC[-1] -> 23 | H128: 1 | I128: =RC[-2]+RC[-1] -> 24 | K128: kg | P128: 白家 | Q128: 四海肉业
A129: 冷鲜肉类 | B129: 猪肉 | C129: 拐皮 | G129: =RC[-2]+RC[-1] -> 0 | I129: =RC[-2]+RC[-1] -> 0 | K129: kg | P129: 白家 | Q129: 四海肉业
A130: 冷鲜肉类 | B130: 猪肉 | C130: 去皮三级肉 | E130: 16 | F130: 1 | G130: =RC[-2]+RC[-1] -> 17 | H130: 1 | I130: =RC[-2]+RC[-1] -> 18 | K130: kg | P130: 白家 | Q130: 四海肉业
A131: 冷鲜肉类 | B131: 猪肉 | C131: 去皮五花 | E131: 26 | F131: 1.25 | G131: =RC[-2]+RC[-1] -> 27.25 | H131: 1.25 | I131: =RC[-2]+RC[-1] -> 28.5 | K131: kg | P131: 白家 | Q131: 四海肉业
A132: 冷鲜肉类 | B132: 猪肉 | C132: 去皮精五花 | E132: 32 | F132: 1.5 | G132: =RC[-2]+RC[-1] -> 33.5 | H132: 1.5 | I132: =RC[-2]+RC[-1] -> 35 | K132: kg | P132: 白家 | Q132: 四海肉业
A133: 冷鲜肉类 | B133: 猪肉 | C133: 去皮前腿 | E133: 25 | F133: 1.25 | G133: =RC[-2]+RC[-1] -> 26.25 | H133: 1.25 | I133: =RC[-2]+RC[-1] -> 27.5 | K133: kg | P133: 白家 | Q133: 四海肉业
A134: 冷鲜肉类 | B134: 猪肉 | C134: 去皮后腿 | E134: 27 | F134: 1.5 | G134: =RC[-2]+RC[-1] -> 28.5 | H134: 1.5 | I134: =RC[-2]+RC[-1] -> 30 | K134: kg | P134: 白家 | Q134: 四海肉业
A135: 冷鲜肉类 | B135: 猪肉 | C135: 精前腿（2#肉） | E135: 28 | F135: 1.5 | G135: =RC[-2]+RC[-1] -> 29.5 | H135: 1.5 | I135: =RC[-2]+RC[-1] -> 31 | K135: kg | P135: 白家 | Q135: 四海肉业
A136: 冷鲜肉类 | B136: 猪肉 | C136: 里脊（3#肉） | E136: 32 | F136: 1.5 | G136: =RC[-2]+RC[-1] -> 33.5 | H136: 1.5 | I136: =RC[-2]+RC[-1] -> 35 | K136: kg | P136: 白家 | Q136: 四海肉业
A137: 冷鲜肉类 | B137: 猪肉 | C137: 精后腿（4#肉） | E137: 29 | F137: 1.5 | G137: =RC[-2]+RC[-1] -> 30.5 | H137: 1.5 | I137: =RC[-2]+RC[-1] -> 32 | K137: kg | P137: 白家 | Q137: 四海肉业
A138: 冷鲜肉类 | B138: 猪肉 | C138: 带皮肥膘 | E138: 11 | F138: 0.7 | G138: =RC[-2]+RC[-1] -> 11.7 | H138: 0.8 | I138: =RC[-2]+RC[-1] -> 12.5 | K138: kg | P138: 白家 | Q138: 四海肉业
A139: 冷鲜肉类 | B139: 猪肉 | C139: 去皮肥膘 | E139: 12 | F139: 0.7 | G139: =RC[-2]+RC[-1] -> 12.7 | H139: 0.8 | I139: =RC[-2]+RC[-1] -> 13.5 | K139: kg | P139: 白家 | Q139: 四海肉业
A140: 冷鲜肉类 | B140: 猪肉 | C140: 去骨肘子 | E140: 25 | F140: 1.25 | G140: =RC[-2]+RC[-1] -> 26.25 | H140: 1.25 | I140: =RC[-2]+RC[-1] -> 27.5 | K140: kg | P140: 白家 | Q140: 四海肉业
A141: 冷鲜肉类 | B141: 猪肉 | C141: 精前腿肉片 | E141: 28 | F141: 1.5 | G141: =RC[-2]+RC[-1] -> 29.5 | H141: 1.5 | I141: =RC[-2]+RC[-1] -> 31 | K141: kg | P141: 白家 | Q141: 四海肉业
A142: 冷鲜肉类 | B142: 猪副 | C142: 精后腿肉丝 | E142: 29 | F142: 1.5 | G142: =RC[-2]+RC[-1] -> 30.5 | H142: 1.5 | I142: =RC[-2]+RC[-1] -> 32 | K142: kg | P142: 白家 | Q142: 四海肉业
A143: 冷鲜肉类 | B143: 猪副 | C143: 精后腿肉片 | E143: 29 | F143: 1.5 | G143: =RC[-2]+RC[-1] -> 30.5 | H143: 1.5 | I143: =RC[-2]+RC[-1] -> 32 | K143: kg | P143: 白家 | Q143: 四海肉业
A144: 冷鲜肉类 | B144: 猪副 | C144: 精后腿肉丁 | E144: 30 | F144: 1.5 | G144: =RC[-2]+RC[-1] -> 31.5 | H144: 1.5 | I144: =RC[-2]+RC[-1] -> 33 | K144: kg | P144: 白家 | Q144: 四海肉业
A145: 冷鲜肉类 | B145: 猪副 | C145: 带皮五花肉片 | E145: 25 | F145: 1.25 | G145: =RC[-2]+RC[-1] -> 26.25 | H145: 1.25 | I145: =RC[-2]+RC[-1] -> 27.5 | K145: 付 | P145: 白家 | Q145: 四海肉业
A146: 冷鲜肉类 | B146: 猪副 | C146: 精前腿肉丝 | E146: 28 | F146: 1.5 | G146: =RC[-2]+RC[-1] -> 29.5 | H146: 1.5 | I146: =RC[-2]+RC[-1] -> 31 | K146: kg | P146: 白家 | Q146: 四海肉业
A147: 冷鲜肉类 | B147: 猪副 | C147: 龙骨 | E147: 17 | F147: 1 | G147: =RC[-2]+RC[-1] -> 18 | H147: 1 | I147: =RC[-2]+RC[-1] -> 19 | K147: kg | P147: 白家 | Q147: 四海肉业
A148: 冷鲜肉类 | B148: 猪副 | C148: 前棒骨 | E148: 14 | F148: 1 | G148: =RC[-2]+RC[-1] -> 15 | H148: 1 | I148: =RC[-2]+RC[-1] -> 16 | K148: kg | P148: 白家 | Q148: 四海肉业
A149: 冷鲜肉类 | B149: 猪副 | C149: 后棒骨 | E149: 16 | F149: 1 | G149: =RC[-2]+RC[-1] -> 17 | H149: 1 | I149: =RC[-2]+RC[-1] -> 18 | K149: kg | P149: 白家 | Q149: 四海肉业
A150: 冷鲜肉类 | B150: 猪副 | C150: 中排 | E150: 34 | F150: 1.5 | G150: =RC[-2]+RC[-1] -> 35.5 | H150: 1.5 | I150: =RC[-2]+RC[-1] -> 37 | K150: kg | P150: 白家 | Q150: 四海肉业
A151: 冷鲜肉类 | B151: 猪副 | C151: 精排 | E151: 44 | F151: 1.5 | G151: =RC[-2]+RC[-1] -> 45.5 | H151: 1.5 | I151: =RC[-2]+RC[-1] -> 47 | K151: kg | P151: 白家 | Q151: 四海肉业
A152: 冷鲜肉类 | B152: 猪副 | C152: 通排 | E152: 29 | F152: 1.5 | G152: =RC[-2]+RC[-1] -> 30.5 | H152: 1.5 | I152: =RC[-2]+RC[-1] -> 32 | K152: kg | P152: 白家 | Q152: 四海肉业
A153: 冷鲜肉类 | B153: 猪副 | C153: 腩排 | E153: 46 | F153: 1.5 | G153: =RC[-2]+RC[-1] -> 47.5 | H153: 1.5 | I153: =RC[-2]+RC[-1] -> 49 | K153: kg | P153: 白家 | Q153: 四海肉业
A154: 冷鲜肉类 | B154: 猪副 | C154: 带肉前棒骨 | E154: 16 | F154: 1 | G154: =RC[-2]+RC[-1] -> 17 | H154: 1 | I154: =RC[-2]+RC[-1] -> 18 | K154: kg | P154: 白家 | Q154: 四海肉业
A155: 冷鲜肉类 | B155: 猪副 | C155: 带肉后棒骨 | E155: 22 | F155: 1.25 | G155: =RC[-2]+RC[-1] -> 23.25 | H155: 1.25 | I155: =RC[-2]+RC[-1] -> 24.5 | K155: kg | P155: 白家 | Q155: 四海肉业
A156: 冷鲜肉类 | B156: 猪副 | C156: 猪心 | E156: 22 | F156: 1.25 | G156: =RC[-2]+RC[-1] -> 23.25 | H156: 1.25 | I156: =RC[-2]+RC[-1] -> 24.5 | K156: kg | P156: 白家 | Q156: 四海肉业
A157: 冷鲜肉类 | B157: 猪副 | C157: 猪肚 | E157: 36 | F157: 1.5 | G157: =RC[-2]+RC[-1] -> 37.5 | H157: 1.5 | I157: =RC[-2]+RC[-1] -> 39 | K157: kg | P157: 白家 | Q157: 四海肉业
A158: 冷鲜肉类 | B158: 猪副 | C158: 猪舌 | E158: 28 | F158: 1.25 | G158: =RC[-2]+RC[-1] -> 29.25 | H158: 1.25 | I158: =RC[-2]+RC[-1] -> 30.5 | K158: kg | P158: 白家 | Q158: 四海肉业
A159: 冷鲜肉类 | B159: 猪副 | C159: 猪肝 | E159: 9 | F159: 0.5 | G159: =RC[-2]+RC[-1] -> 9.5 | H159: 0.5 | I159: =RC[-2]+RC[-1] -> 10 | K159: kg | P159: 白家 | Q159: 四海肉业
A160: 冷鲜肉类 | B160: 猪副 | C160: 猪腰 | E160: 52 | F160: 2 | G160: =RC[-2]+RC[-1] -> 54 | H160: 2 | I160: =RC[-2]+RC[-1] -> 56 | K160: kg | P160: 白家 | Q160: 四海肉业
A161: 冷鲜肉类 | B161: 猪副 | C161: 猪耳 | E161: 39 | F161: 1.5 | G161: =RC[-2]+RC[-1] -> 40.5 | H161: 1.5 | I161: =RC[-2]+RC[-1] -> 42 | K161: kg | P161: 白家 | Q161: 四海肉业
A162: 冷鲜肉类 | B162: 猪副 | C162: 猪尾 | E162: 66 | F162: 3 | G162: =RC[-2]+RC[-1] -> 69 | H162: 3 | I162: =RC[-2]+RC[-1] -> 72 | K162: kg | P162: 白家 | Q162: 四海肉业
A163: 冷鲜肉类 | B163: 猪副 | C163: 猪杂 | E163: 30 | F163: 1.5 | G163: =RC[-2]+RC[-1] -> 31.5 | H163: 1.5 | I163: =RC[-2]+RC[-1] -> 33 | K163: kg | P163: 白家 | Q163: 四海肉业
A164: 冷鲜肉类 | B164: 猪副 | C164: 去筋猪蹄 | E164: 31 | F164: 1.5 | G164: =RC[-2]+RC[-1] -> 32.5 | H164: 1.5 | I164: =RC[-2]+RC[-1] -> 34 | K164: kg | P164: 白家 | Q164: 四海肉业
A165: 冷鲜肉类 | B165: 猪副 | C165: 带筋猪蹄 | E165: 33 | F165: 1.5 | G165: =RC[-2]+RC[-1] -> 34.5 | H165: 1.5 | I165: =RC[-2]+RC[-1] -> 36 | K165: kg | P165: 白家 | Q165: 四海肉业
A166: 冷鲜肉类 | B166: 猪肉 | C166: 过水肥肠 | E166: 30 | F166: 1.5 | G166: =RC[-2]+RC[-1] -> 31.5 | H166: 1.5 | I166: =RC[-2]+RC[-1] -> 33 | K166: kg | P166: 白家 | Q166: 四海肉业
A167: 冷鲜肉类 | B167: 猪肉 | C167: 生肥肠 | E167: 24 | F167: 1.5 | G167: =RC[-2]+RC[-1] -> 25.5 | H167: 1.5 | I167: =RC[-2]+RC[-1] -> 27 | K167: kg | P167: 白家 | Q167: 四海肉业
A168: 冷鲜肉类 | B168: 猪肉 | C168: 猪板油 | E168: 12 | F168: 1 | G168: =RC[-2]+RC[-1] -> 13 | H168: 1 | I168: =RC[-2]+RC[-1] -> 14 | K168: kg | P168: 白家 | Q168: 四海肉业
A169: 冷鲜肉类 | B169: 猪肉 | C169: 猪头肉 | E169: 24 | F169: 1.5 | G169: =RC[-2]+RC[-1] -> 25.5 | H169: 1.5 | I169: =RC[-2]+RC[-1] -> 27 | K169: kg | P169: 白家 | Q169: 四海肉业
A170: 冷鲜肉类 | B170: 猪肉 | C170: 猪脸肉 | E170: 40 | F170: 1.5 | G170: =RC[-2]+RC[-1] -> 41.5 | H170: 1.5 | I170: =RC[-2]+RC[-1] -> 43 | K170: kg | P170: 白家 | Q170: 四海肉业
A171: 冷鲜肉类 | B171: 猪肉 | C171: 过水肥肠（加工） | E171: 29 | F171: 1.5 | G171: =RC[-2]+RC[-1] -> 30.5 | H171: 1.5 | I171: =RC[-2]+RC[-1] -> 32 | K171: kg | P171: 白家 | Q171: 四海肉业
A172: 冷鲜肉类 | B172: 猪肉 | C172: 猪心肺（笼） | E172: 3 | F172: 0.5 | G172: =RC[-2]+RC[-1] -> 3.5 | H172: 0.5 | I172: =RC[-2]+RC[-1] -> 4 | K172: kg | P172: 白家 | Q172: 四海肉业
A173: 冷鲜肉类 | B173: 猪肉 | C173: 去皮五花肉片(加工) | E173: 26 | F173: 1.5 | G173: =RC[-2]+RC[-1] -> 27.5 | H173: 1.5 | I173: =RC[-2]+RC[-1] -> 29 | K173: kg | P173: 白家 | Q173: 四海肉业
A174: 冷鲜肉类 | B174: 猪肉 | C174: 去皮精五花绞肉（加工） | E174: 29 | F174: 1.5 | G174: =RC[-2]+RC[-1] -> 30.5 | H174: 1.5 | I174: =RC[-2]+RC[-1] -> 32 | K174: kg | P174: 白家 | Q174: 四海肉业
A175: 冷鲜肉类 | B175: 猪肉 | C175: 五花粗绞肉 | E175: 17 | F175: 1 | G175: =RC[-2]+RC[-1] -> 18 | H175: 1 | I175: =RC[-2]+RC[-1] -> 19 | K175: kg | P175: 白家 | Q175: 四海肉业
A176: 冷鲜肉类 | B176: 猪副 | C176: 猪心 10kg | E176: 130 | F176: =IF(RC[-1]<50,1.5,IF(RC[-1]<150,2,IF(RC[-1]<250,2.5,IF(RC[-1]<700,3,100)))) -> 2 | G176: =RC[-2]+RC[-1] -> 132 | H176: =IF(RC[-3]<50,1.5,IF(RC[-3]<150,2,IF(RC[-3]<250,2.5,IF(RC[-3]<700,3,100)))) -> 2 | I176: =RC[-2]+RC[-1] -> 134 | J176: 10.00000 | K176: 件 | L176: 件 | O176: 1 | P176: 白家 | Q176: 绿海食品
A177: 冷鲜肉类 | B177: 猪副 | C177: 猪大肚（一级）10kg | E177: 290 | F177: =IF(RC[-1]<50,1.5,IF(RC[-1]<150,2,IF(RC[-1]<250,2.5,IF(RC[-1]<700,3,100)))) -> 3 | G177: =RC[-2]+RC[-1] -> 293 | H177: =IF(RC[-3]<50,1.5,IF(RC[-3]<150,2,IF(RC[-3]<250,2.5,IF(RC[-3]<700,3,100)))) -> 3 | I177: =RC[-2]+RC[-1] -> 296 | J177: 10.00000 | K177: 件 | L177: 件 | O177: 1 | P177: 白家 | Q177: 绿海食品
A178: 冷鲜肉类 | B178: 猪副 | C178: 猪大肚（二级）10kg | E178: 200 | F178: =IF(RC[-1]<50,1.5,IF(RC[-1]<150,2,IF(RC[-1]<250,2.5,IF(RC[-1]<700,3,100)))) -> 2.5 | G178: =RC[-2]+RC[-1] -> 202.5 | H178: =IF(RC[-3]<50,1.5,IF(RC[-3]<150,2,IF(RC[-3]<250,2.5,IF(RC[-3]<700,3,100)))) -> 2.5 | I178: =RC[-2]+RC[-1] -> 205 | J178: 10.00000 | K178: 件 | L178: 件 | O178: 1 | P178: 白家 | Q178: 绿海食品
A179: 冷鲜肉类 | B179: 猪副 | C179: 猪耳朵（一级）10kg | E179: 330 | F179: =IF(RC[-1]<50,1.5,IF(RC[-1]<150,2,IF(RC[-1]<250,2.5,IF(RC[-1]<700,3,100)))) -> 3 | G179: =RC[-2]+RC[-1] -> 333 | H179: =IF(RC[-3]<50,1.5,IF(RC[-3]<150,2,IF(RC[-3]<250,2.5,IF(RC[-3]<700,3,100)))) -> 3 | I179: =RC[-2]+RC[-1] -> 336 | J179: 10.00000 | K179: 件 | L179: 件 | O179: 1 | P179: 白家 | Q179: 绿海食品
A180: 冷鲜肉类 | B180: 猪副 | C180: 猪耳朵（二级）10kg | E180: 270 | F180: =IF(RC[-1]<50,1.5,IF(RC[-1]<150,2,IF(RC[-1]<250,2.5,IF(RC[-1]<700,3,100)))) -> 3 | G180: =RC[-2]+RC[-1] -> 273 | H180: =IF(RC[-3]<50,1.5,IF(RC[-3]<150,2,IF(RC[-3]<250,2.5,IF(RC[-3]<700,3,100)))) -> 3 | I180: =RC[-2]+RC[-1] -> 276 | J180: 10.00000 | K180: 件 | L180: 件 | O180: 1 | P180: 白家 | Q180: 绿海食品
A181: 冷鲜肉类 | B181: 猪副 | C181: 猪大肠（一级）10kg | E181: 200 | F181: =IF(RC[-1]<50,1.5,IF(RC[-1]<150,2,IF(RC[-1]<250,2.5,IF(RC[-1]<700,3,100)))) -> 2.5 | G181: =RC[-2]+RC[-1] -> 202.5 | H181: =IF(RC[-3]<50,1.5,IF(RC[-3]<150,2,IF(RC[-3]<250,2.5,IF(RC[-3]<700,3,100)))) -> 2.5 | I181: =RC[-2]+RC[-1] -> 205 | J181: 10.00000 | K181: 件 | L181: 件 | O181: 1 | P181: 白家 | Q181: 绿海食品
A182: 冷鲜肉类 | B182: 猪副 | C182: 猪大肠（二级）10kg | E182: 150 | F182: =IF(RC[-1]<50,1.5,IF(RC[-1]<150,2,IF(RC[-1]<250,2.5,IF(RC[-1]<700,3,100)))) -> 2.5 | G182: =RC[-2]+RC[-1] -> 152.5 | H182: =IF(RC[-3]<50,1.5,IF(RC[-3]<150,2,IF(RC[-3]<250,2.5,IF(RC[-3]<700,3,100)))) -> 2.5 | I182: =RC[-2]+RC[-1] -> 155 | J182: 10.00000 | K182: 件 | L182: 件 | O182: 1 | P182: 白家 | Q182: 绿海食品
A183: 冷鲜肉类 | B183: 猪副 | C183: 猪儿肠 10kg | E183: 90 | F183: =IF(RC[-1]<50,1.5,IF(RC[-1]<150,2,IF(RC[-1]<250,2.5,IF(RC[-1]<700,3,100)))) -> 2 | G183: =RC[-2]+RC[-1] -> 92 | H183: =IF(RC[-3]<50,1.5,IF(RC[-3]<150,2,IF(RC[-3]<250,2.5,IF(RC[-3]<700,3,100)))) -> 2 | I183: =RC[-2]+RC[-1] -> 94 | J183: 10.00000 | K183: 件 | L183: 件 | O183: 1 | P183: 白家 | Q183: 绿海食品
A184: 冷鲜肉类 | B184: 猪副 | C184: 猪蹄（一级）10kg | E184: 300 | F184: =IF(RC[-1]<50,1.5,IF(RC[-1]<150,2,IF(RC[-1]<250,2.5,IF(RC[-1]<700,3,100)))) -> 3 | G184: =RC[-2]+RC[-1] -> 303 | H184: =IF(RC[-3]<50,1.5,IF(RC[-3]<150,2,IF(RC[-3]<250,2.5,IF(RC[-3]<700,3,100)))) -> 3 | I184: =RC[-2]+RC[-1] -> 306 | J184: 10.00000 | K184: 件 | L184: 件 | O184: 1 | P184: 白家 | Q184: 绿海食品
A185: 冷鲜肉类 | B185: 猪副 | C185: 猪蹄（二级）10kg | E185: 270 | F185: =IF(RC[-1]<50,1.5,IF(RC[-1]<150,2,IF(RC[-1]<250,2.5,IF(RC[-1]<700,3,100)))) -> 3 | G185: =RC[-2]+RC[-1] -> 273 | H185: =IF(RC[-3]<50,1.5,IF(RC[-3]<150,2,IF(RC[-3]<250,2.5,IF(RC[-3]<700,3,100)))) -> 3 | I185: =RC[-2]+RC[-1] -> 276 | J185: 10.00000 | K185: 件 | L185: 件 | O185: 1 | P185: 白家 | Q185: 绿海食品
A186: 冷鲜肉类 | B186: 猪副 | C186: 猪脆骨 | E186: 330 | F186: =IF(RC[-1]<50,1.5,IF(RC[-1]<150,2,IF(RC[-1]<250,2.5,IF(RC[-1]<700,3,100)))) -> 3 | G186: =RC[-2]+RC[-1] -> 333 | H186: =IF(RC[-3]<50,1.5,IF(RC[-3]<150,2,IF(RC[-3]<250,2.5,IF(RC[-3]<700,3,100)))) -> 3 | I186: =RC[-2]+RC[-1] -> 336 | J186: 10.00000 | K186: 件 | L186: 件 | O186: 1 | P186: 白家 | Q186: 绿海食品
A187: 冷鲜肉类 | B187: 猪副 | C187: 猪脑花 | E187: 275 | F187: =IF(RC[-1]<50,1.5,IF(RC[-1]<150,2,IF(RC[-1]<250,2.5,IF(RC[-1]<700,3,100)))) -> 3 | G187: =RC[-2]+RC[-1] -> 278 | H187: =IF(RC[-3]<50,1.5,IF(RC[-3]<150,2,IF(RC[-3]<250,2.5,IF(RC[-3]<700,3,100)))) -> 3 | I187: =RC[-2]+RC[-1] -> 281 | J187: 10.00000 | K187: 件 | L187: 件 | O187: 1 | P187: 白家 | Q187: 绿海食品
A188: 冷鲜肉类 | B188: 猪副 | C188: 猪棒骨 | E188: 100 | F188: =IF(RC[-1]<50,1.5,IF(RC[-1]<150,2,IF(RC[-1]<250,2.5,IF(RC[-1]<700,3,100)))) -> 2 | G188: =RC[-2]+RC[-1] -> 102 | H188: =IF(RC[-3]<50,1.5,IF(RC[-3]<150,2,IF(RC[-3]<250,2.5,IF(RC[-3]<700,3,100)))) -> 2 | I188: =RC[-2]+RC[-1] -> 104 | J188: 10.00000 | K188: 件 | L188: 件 | O188: 1 | P188: 白家 | Q188: 绿海食品
A189: 冷鲜肉类 | B189: 猪副 | C189: 猪舌 | E189: 280 | F189: =IF(RC[-1]<50,1.5,IF(RC[-1]<150,2,IF(RC[-1]<250,2.5,IF(RC[-1]<700,3,100)))) -> 3 | G189: =RC[-2]+RC[-1] -> 283 | H189: =IF(RC[-3]<50,1.5,IF(RC[-3]<150,2,IF(RC[-3]<250,2.5,IF(RC[-3]<700,3,100)))) -> 3 | I189: =RC[-2]+RC[-1] -> 286 | J189: 10.00000 | K189: 件 | L189: 件 | O189: 1 | P189: 白家 | Q189: 绿海食品
A190: 冷鲜肉类 | B190: 猪副 | C190: 猪小肚 | E190: 280 | F190: =IF(RC[-1]<50,1.5,IF(RC[-1]<150,2,IF(RC[-1]<250,2.5,IF(RC[-1]<700,3,100)))) -> 3 | G190: =RC[-2]+RC[-1] -> 283 | H190: =IF(RC[-3]<50,1.5,IF(RC[-3]<150,2,IF(RC[-3]<250,2.5,IF(RC[-3]<700,3,100)))) -> 3 | I190: =RC[-2]+RC[-1] -> 286 | J190: 10.00000 | K190: 件 | L190: 件 | O190: 1 | P190: 白家 | Q190: 绿海食品
A191: 冷鲜肉类 | B191: 猪副 | C191: 猪尾（一级）10kg | E191: 630 | F191: =IF(RC[-1]<50,1.5,IF(RC[-1]<150,2,IF(RC[-1]<250,2.5,IF(RC[-1]<700,3,100)))) -> 3 | G191: =RC[-2]+RC[-1] -> 633 | H191: =IF(RC[-3]<50,1.5,IF(RC[-3]<150,2,IF(RC[-3]<250,2.5,IF(RC[-3]<700,3,100)))) -> 3 | I191: =RC[-2]+RC[-1] -> 636 | J191: 10.00000 | K191: 件 | L191: 件 | O191: 1 | P191: 白家 | Q191: 绿海食品
A192: 冷鲜肉类 | B192: 猪副 | C192: 猪尾（二级）10kg | E192: 550 | F192: =IF(RC[-1]<50,1.5,IF(RC[-1]<150,2,IF(RC[-1]<250,2.5,IF(RC[-1]<700,3,100)))) -> 3 | G192: =RC[-2]+RC[-1] -> 553 | H192: =IF(RC[-3]<50,1.5,IF(RC[-3]<150,2,IF(RC[-3]<250,2.5,IF(RC[-3]<700,3,100)))) -> 3 | I192: =RC[-2]+RC[-1] -> 556 | J192: 10.00000 | K192: 件 | L192: 件 | O192: 1 | P192: 白家 | Q192: 绿海食品
A193: 冷鲜肉类 | B193: 猪副 | C193: 猪肠头（一级）10kg | E193: 260 | F193: =IF(RC[-1]<50,1.5,IF(RC[-1]<150,2,IF(RC[-1]<250,2.5,IF(RC[-1]<700,3,100)))) -> 3 | G193: =RC[-2]+RC[-1] -> 263 | H193: =IF(RC[-3]<50,1.5,IF(RC[-3]<150,2,IF(RC[-3]<250,2.5,IF(RC[-3]<700,3,100)))) -> 3 | I193: =RC[-2]+RC[-1] -> 266 | J193: 10.00000 | K193: 件 | L193: 件 | O193: 1 | P193: 白家 | Q193: 绿海食品
A194: 冷鲜肉类 | B194: 猪副 | C194: 猪肠头（二级）10kg | E194: 200 | F194: =IF(RC[-1]<50,1.5,IF(RC[-1]<150,2,IF(RC[-1]<250,2.5,IF(RC[-1]<700,3,100)))) -> 2.5 | G194: =RC[-2]+RC[-1] -> 202.5 | H194: =IF(RC[-3]<50,1.5,IF(RC[-3]<150,2,IF(RC[-3]<250,2.5,IF(RC[-3]<700,3,100)))) -> 2.5 | I194: =RC[-2]+RC[-1] -> 205 | J194: 10.00000 | K194: 件 | L194: 件 | O194: 1 | P194: 白家 | Q194: 绿海食品
A195: 冷鲜肉类 | B195: 猪副 | C195: 猪肚尖 | E195: 210 | F195: =IF(RC[-1]<50,1.5,IF(RC[-1]<150,2,IF(RC[-1]<250,2.5,IF(RC[-1]<700,3,100)))) -> 2.5 | G195: =RC[-2]+RC[-1] -> 212.5 | H195: =IF(RC[-3]<50,1.5,IF(RC[-3]<150,2,IF(RC[-3]<250,2.5,IF(RC[-3]<700,3,100)))) -> 2.5 | I195: =RC[-2]+RC[-1] -> 215 | J195: 10.00000 | K195: 件 | L195: 件 | O195: 1 | P195: 白家 | Q195: 绿海食品
A196: 冷鲜肉类 | B196: 猪副 | C196: 猪排骨（一级）10kg | E196: 280 | F196: =IF(RC[-1]<50,1.5,IF(RC[-1]<150,2,IF(RC[-1]<250,2.5,IF(RC[-1]<700,3,100)))) -> 3 | G196: =RC[-2]+RC[-1] -> 283 | H196: =IF(RC[-3]<50,1.5,IF(RC[-3]<150,2,IF(RC[-3]<250,2.5,IF(RC[-3]<700,3,100)))) -> 3 | I196: =RC[-2]+RC[-1] -> 286 | J196: 10.00000 | K196: 件 | L196: 件 | O196: 1 | P196: 白家 | Q196: 绿海食品
A197: 冷鲜肉类 | B197: 猪副 | C197: 猪排骨（二级）10kg | E197: 160 | F197: =IF(RC[-1]<50,1.5,IF(RC[-1]<150,2,IF(RC[-1]<250,2.5,IF(RC[-1]<700,3,100)))) -> 2.5 | G197: =RC[-2]+RC[-1] -> 162.5 | H197: =IF(RC[-3]<50,1.5,IF(RC[-3]<150,2,IF(RC[-3]<250,2.5,IF(RC[-3]<700,3,100)))) -> 2.5 | I197: =RC[-2]+RC[-1] -> 165 | J197: 10.00000 | K197: 件 | L197: 件 | O197: 1 | P197: 白家 | Q197: 绿海食品
A198: 冷鲜肉类 | B198: 猪副 | C198: 猪天梯（一级）10kg | E198: 420 | F198: =IF(RC[-1]<50,1.5,IF(RC[-1]<150,2,IF(RC[-1]<250,2.5,IF(RC[-1]<700,3,100)))) -> 3 | G198: =RC[-2]+RC[-1] -> 423 | H198: =IF(RC[-3]<50,1.5,IF(RC[-3]<150,2,IF(RC[-3]<250,2.5,IF(RC[-3]<700,3,100)))) -> 3 | I198: =RC[-2]+RC[-1] -> 426 | J198: 10.00000 | K198: 件 | L198: 件 | O198: 1 | P198: 白家 | Q198: 绿海食品
A199: 冷鲜肉类 | B199: 猪副 | C199: 猪天梯（二级）10kg | E199: 270 | F199: =IF(RC[-1]<50,1.5,IF(RC[-1]<150,2,IF(RC[-1]<250,2.5,IF(RC[-1]<700,3,100)))) -> 3 | G199: =RC[-2]+RC[-1] -> 273 | H199: =IF(RC[-3]<50,1.5,IF(RC[-3]<150,2,IF(RC[-3]<250,2.5,IF(RC[-3]<700,3,100)))) -> 3 | I199: =RC[-2]+RC[-1] -> 276 | J199: 10.00000 | K199: 件 | L199: 件 | O199: 1 | P199: 白家 | Q199: 绿海食品
A200: 冷鲜肉类 | B200: 猪副 | C200: 猪拱嘴 | E200: 200 | F200: =IF(RC[-1]<50,1.5,IF(RC[-1]<150,2,IF(RC[-1]<250,2.5,IF(RC[-1]<700,3,100)))) -> 2.5 | G200: =RC[-2]+RC[-1] -> 202.5 | H200: =IF(RC[-3]<50,1.5,IF(RC[-3]<150,2,IF(RC[-3]<250,2.5,IF(RC[-3]<700,3,100)))) -> 2.5 | I200: =RC[-2]+RC[-1] -> 205 | J200: 10.00000 | K200: 件 | L200: 件 | O200: 1 | P200: 白家 | Q200: 绿海食品
A201: 冷鲜肉类 | B201: 猪副 | C201: 猪肾 | E201: 37 | F201: =IF(RC[-1]<50,1.5,IF(RC[-1]<150,2,IF(RC[-1]<250,2.5,IF(RC[-1]<700,3,100)))) -> 1.5 | G201: =RC[-2]+RC[-1] -> 38.5 | H201: =IF(RC[-3]<50,1.5,IF(RC[-3]<150,2,IF(RC[-3]<250,2.5,IF(RC[-3]<700,3,100)))) -> 1.5 | I201: =RC[-2]+RC[-1] -> 40 | J201: 500.00000000 | K201: 斤 | L201: 斤 | O201: 1 | P201: 白家 | Q201: 绿海食品
A202: 冷鲜肉类 | B202: 鸭肉（冻） | C202: 鸭唇 | E202: 120 | F202: =IF(RC[-1]<50,1.5,IF(RC[-1]<150,2,IF(RC[-1]<250,2.5,IF(RC[-1]<700,3,100)))) -> 2 | G202: =RC[-2]+RC[-1] -> 122 | H202: =IF(RC[-3]<50,1.5,IF(RC[-3]<150,2,IF(RC[-3]<250,2.5,IF(RC[-3]<700,3,100)))) -> 2 | I202: =RC[-2]+RC[-1] -> 124 | J202: 12.00000 | K202: 件 | L202: 件 | O202: 1 | P202: 白家 | Q202: 绿海食品
A203: 冷鲜肉类 | B203: 鸭肉（冻） | C203: 鸭舌 | E203: 140 | F203: =IF(RC[-1]<50,1.5,IF(RC[-1]<150,2,IF(RC[-1]<250,2.5,IF(RC[-1]<700,3,100)))) -> 2 | G203: =RC[-2]+RC[-1] -> 142 | H203: =IF(RC[-3]<50,1.5,IF(RC[-3]<150,2,IF(RC[-3]<250,2.5,IF(RC[-3]<700,3,100)))) -> 2 | I203: =RC[-2]+RC[-1] -> 144 | J203: 12.00000 | K203: 件 | L203: 件 | O203: 1 | P203: 白家 | Q203: 绿海食品
A204: 冷鲜肉类 | B204: 鸭肉（冻） | C204: 鸭头（8个） | E204: 210 | F204: =IF(RC[-1]<50,1.5,IF(RC[-1]<150,2,IF(RC[-1]<250,2.5,IF(RC[-1]<700,3,100)))) -> 2.5 | G204: =RC[-2]+RC[-1] -> 212.5 | H204: =IF(RC[-3]<50,1.5,IF(RC[-3]<150,2,IF(RC[-3]<250,2.5,IF(RC[-3]<700,3,100)))) -> 2.5 | I204: =RC[-2]+RC[-1] -> 215 | J204: 12.00000 | K204: 件 | L204: 件 | O204: 1 | P204: 白家 | Q204: 绿海食品
A205: 冷鲜肉类 | B205: 鸭肉（冻） | C205: 鸭头（9个） | E205: 220 | F205: =IF(RC[-1]<50,1.5,IF(RC[-1]<150,2,IF(RC[-1]<250,2.5,IF(RC[-1]<700,3,100)))) -> 2.5 | G205: =RC[-2]+RC[-1] -> 222.5 | H205: =IF(RC[-3]<50,1.5,IF(RC[-3]<150,2,IF(RC[-3]<250,2.5,IF(RC[-3]<700,3,100)))) -> 2.5 | I205: =RC[-2]+RC[-1] -> 225 | J205: 12.00000 | K205: 件 | L205: 件 | O205: 1 | P205: 白家 | Q205: 绿海食品
A206: 冷鲜肉类 | B206: 鸭肉（冻） | C206: 鸭头（10）个 | E206: 230 | F206: =IF(RC[-1]<50,1.5,IF(RC[-1]<150,2,IF(RC[-1]<250,2.5,IF(RC[-1]<700,3,100)))) -> 2.5 | G206: =RC[-2]+RC[-1] -> 232.5 | H206: =IF(RC[-3]<50,1.5,IF(RC[-3]<150,2,IF(RC[-3]<250,2.5,IF(RC[-3]<700,3,100)))) -> 2.5 | I206: =RC[-2]+RC[-1] -> 235 | J206: 12.00000 | K206: 件 | L206: 件 | O206: 1 | P206: 白家 | Q206: 绿海食品
A207: 冷鲜肉类 | B207: 鸭肉（冻） | C207: 鸭心 | E207: 140 | F207: =IF(RC[-1]<50,1.5,IF(RC[-1]<150,2,IF(RC[-1]<250,2.5,IF(RC[-1]<700,3,100)))) -> 2 | G207: =RC[-2]+RC[-1] -> 142 | H207: =IF(RC[-3]<50,1.5,IF(RC[-3]<150,2,IF(RC[-3]<250,2.5,IF(RC[-3]<700,3,100)))) -> 2 | I207: =RC[-2]+RC[-1] -> 144 | J207: 12.00000 | K207: 件 | L207: 件 | O207: 1 | P207: 白家 | Q207: 绿海食品
A208: 冷鲜肉类 | B208: 鸭肉（冻） | C208: 鸭郡把 | E208: 220 | F208: =IF(RC[-1]<50,1.5,IF(RC[-1]<150,2,IF(RC[-1]<250,2.5,IF(RC[-1]<700,3,100)))) -> 2.5 | G208: =RC[-2]+RC[-1] -> 222.5 | H208: =IF(RC[-3]<50,1.5,IF(RC[-3]<150,2,IF(RC[-3]<250,2.5,IF(RC[-3]<700,3,100)))) -> 2.5 | I208: =RC[-2]+RC[-1] -> 225 | J208: 12.00000 | K208: 件 | L208: 件 | O208: 1 | P208: 白家 | Q208: 绿海食品
A209: 冷鲜肉类 | B209: 鸭肉（冻） | C209: 鸭胗（小） | E209: 330 | F209: =IF(RC[-1]<50,1.5,IF(RC[-1]<150,2,IF(RC[-1]<250,2.5,IF(RC[-1]<700,3,100)))) -> 3 | G209: =RC[-2]+RC[-1] -> 333 | H209: =IF(RC[-3]<50,1.5,IF(RC[-3]<150,2,IF(RC[-3]<250,2.5,IF(RC[-3]<700,3,100)))) -> 3 | I209: =RC[-2]+RC[-1] -> 336 | J209: 12.00000 | K209: 件 | L209: 件 | O209: 1 | P209: 白家 | Q209: 绿海食品
A210: 冷鲜肉类 | B210: 鸭肉（冻） | C210: 鸭胗（中） | E210: 340 | F210: =IF(RC[-1]<50,1.5,IF(RC[-1]<150,2,IF(RC[-1]<250,2.5,IF(RC[-1]<700,3,100)))) -> 3 | G210: =RC[-2]+RC[-1] -> 343 | H210: =IF(RC[-3]<50,1.5,IF(RC[-3]<150,2,IF(RC[-3]<250,2.5,IF(RC[-3]<700,3,100)))) -> 3 | I210: =RC[-2]+RC[-1] -> 346 | J210: 12.00000 | K210: 件 | L210: 件 | O210: 1 | P210: 白家 | Q210: 绿海食品
A211: 冷鲜肉类 | B211: 鸭肉（冻） | C211: 鸭胗（大） | E211: 350 | F211: =IF(RC[-1]<50,1.5,IF(RC[-1]<150,2,IF(RC[-1]<250,2.5,IF(RC[-1]<700,3,100)))) -> 3 | G211: =RC[-2]+RC[-1] -> 353 | H211: =IF(RC[-3]<50,1.5,IF(RC[-3]<150,2,IF(RC[-3]<250,2.5,IF(RC[-3]<700,3,100)))) -> 3 | I211: =RC[-2]+RC[-1] -> 356 | J211: 12.00000 | K211: 件 | L211: 件 | O211: 1 | P211: 白家 | Q211: 绿海食品
A212: 冷鲜肉类 | B212: 鸭肉（冻） | C212: 鸭脚（大） | E212: 280 | F212: =IF(RC[-1]<50,1.5,IF(RC[-1]<150,2,IF(RC[-1]<250,2.5,IF(RC[-1]<700,3,100)))) -> 3 | G212: =RC[-2]+RC[-1] -> 283 | H212: =IF(RC[-3]<50,1.5,IF(RC[-3]<150,2,IF(RC[-3]<250,2.5,IF(RC[-3]<700,3,100)))) -> 3 | I212: =RC[-2]+RC[-1] -> 286 | J212: 12.00000 | K212: 件 | L212: 件 | O212: 1 | P212: 白家 | Q212: 绿海食品
A213: 冷鲜肉类 | B213: 鸭肉（冻） | C213: 鸭二节翅 | E213: 125 | F213: =IF(RC[-1]<50,1.5,IF(RC[-1]<150,2,IF(RC[-1]<250,2.5,IF(RC[-1]<700,3,100)))) -> 2 | G213: =RC[-2]+RC[-1] -> 127 | H213: =IF(RC[-3]<50,1.5,IF(RC[-3]<150,2,IF(RC[-3]<250,2.5,IF(RC[-3]<700,3,100)))) -> 2 | I213: =RC[-2]+RC[-1] -> 129 | J213: 10.00000 | K213: 件 | L213: 件 | O213: 1 | P213: 白家 | Q213: 绿海食品
A214: 冷鲜肉类 | B214: 鸭肉（冻） | C214: 鸭脖（6根） | E214: 185 | F214: =IF(RC[-1]<50,1.5,IF(RC[-1]<150,2,IF(RC[-1]<250,2.5,IF(RC[-1]<700,3,100)))) -> 2.5 | G214: =RC[-2]+RC[-1] -> 187.5 | H214: =IF(RC[-3]<50,1.5,IF(RC[-3]<150,2,IF(RC[-3]<250,2.5,IF(RC[-3]<700,3,100)))) -> 2.5 | I214: =RC[-2]+RC[-1] -> 190 | J214: 12.00000 | K214: 件 | L214: 件 | O214: 1 | P214: 白家 | Q214: 绿海食品
A215: 冷鲜肉类 | B215: 鸭肉（冻） | C215: 鸭腿 | E215: 115 | F215: =IF(RC[-1]<50,1.5,IF(RC[-1]<150,2,IF(RC[-1]<250,2.5,IF(RC[-1]<700,3,100)))) -> 2 | G215: =RC[-2]+RC[-1] -> 117 | H215: =IF(RC[-3]<50,1.5,IF(RC[-3]<150,2,IF(RC[-3]<250,2.5,IF(RC[-3]<700,3,100)))) -> 2 | I215: =RC[-2]+RC[-1] -> 119 | J215: 10.00000 | K215: 件 | L215: 件 | O215: 1 | P215: 白家 | Q215: 绿海食品
A216: 冷鲜肉类 | B216: 鸭肉（冻） | C216: 半边鸭 | E216: 80 | F216: =IF(RC[-1]<50,1.5,IF(RC[-1]<150,2,IF(RC[-1]<250,2.5,IF(RC[-1]<700,3,100)))) -> 2 | G216: =RC[-2]+RC[-1] -> 82 | H216: =IF(RC[-3]<50,1.5,IF(RC[-3]<150,2,IF(RC[-3]<250,2.5,IF(RC[-3]<700,3,100)))) -> 2 | I216: =RC[-2]+RC[-1] -> 84 | J216: 9.50000 | K216: 件 | L216: 件 | O216: 1 | P216: 白家 | Q216: 绿海食品
A217: 冷鲜肉类 | B217: 鸭肉（冻） | C217: 白条鸭 2.9斤*8只 | E217: 125 | F217: =IF(RC[-1]<50,1.5,IF(RC[-1]<150,2,IF(RC[-1]<250,2.5,IF(RC[-1]<700,3,100)))) -> 2 | G217: =RC[-2]+RC[-1] -> 127 | H217: =IF(RC[-3]<50,1.5,IF(RC[-3]<150,2,IF(RC[-3]<250,2.5,IF(RC[-3]<700,3,100)))) -> 2 | I217: =RC[-2]+RC[-1] -> 129 | J217: 1.45 | K217: 件 | L217: 件 | O217: 1 | P217: 白家 | Q217: 绿海食品
A218: 冷鲜肉类 | B218: 鸭肉（冻） | C218: 白条鸭 3.9斤*8只 | E218: 145 | F218: =IF(RC[-1]<50,1.5,IF(RC[-1]<150,2,IF(RC[-1]<250,2.5,IF(RC[-1]<700,3,100)))) -> 2 | G218: =RC[-2]+RC[-1] -> 147 | H218: =IF(RC[-3]<50,1.5,IF(RC[-3]<150,2,IF(RC[-3]<250,2.5,IF(RC[-3]<700,3,100)))) -> 2 | I218: =RC[-2]+RC[-1] -> 149 | J218: 1.95 | K218: 件 | L218: 件 | O218: 1 | P218: 白家 | Q218: 绿海食品
A219: 冷鲜肉类 | B219: 鸭肉（冻） | C219: 去骨鸭爪 | E219: 210 | F219: =IF(RC[-1]<50,1.5,IF(RC[-1]<150,2,IF(RC[-1]<250,2.5,IF(RC[-1]<700,3,100)))) -> 2.5 | G219: =RC[-2]+RC[-1] -> 212.5 | H219: =IF(RC[-3]<50,1.5,IF(RC[-3]<150,2,IF(RC[-3]<250,2.5,IF(RC[-3]<700,3,100)))) -> 2.5 | I219: =RC[-2]+RC[-1] -> 215 | J219: 5.00000 | K219: 件 | L219: 件 | O219: 1 | P219: 白家 | Q219: 绿海食品
A220: 冷鲜肉类 | B220: 鸡肉（冻） | C220: 鸡尖（一级） | E220: 130 | F220: =IF(RC[-1]<50,1.5,IF(RC[-1]<150,2,IF(RC[-1]<250,2.5,IF(RC[-1]<700,3,100)))) -> 2 | G220: =RC[-2]+RC[-1] -> 132 | H220: =IF(RC[-3]<50,1.5,IF(RC[-3]<150,2,IF(RC[-3]<250,2.5,IF(RC[-3]<700,3,100)))) -> 2 | I220: =RC[-2]+RC[-1] -> 134 | J220: 10.00000 | K220: 件 | L220: 件 | O220: 1 | P220: 白家 | Q220: 绿海食品
A221: 冷鲜肉类 | B221: 鸡肉（冻） | C221: 鸡尖（二级） | E221: 110 | F221: =IF(RC[-1]<50,1.5,IF(RC[-1]<150,2,IF(RC[-1]<250,2.5,IF(RC[-1]<700,3,100)))) -> 2 | G221: =RC[-2]+RC[-1] -> 112 | H221: =IF(RC[-3]<50,1.5,IF(RC[-3]<150,2,IF(RC[-3]<250,2.5,IF(RC[-3]<700,3,100)))) -> 2 | I221: =RC[-2]+RC[-1] -> 114 | J221: 10.00000 | K221: 件 | L221: 件 | O221: 1 | P221: 白家 | Q221: 绿海食品
A222: 冷鲜肉类 | B222: 鸡肉（冻） | C222: 鸡胸 | E222: 120 | F222: =IF(RC[-1]<50,1.5,IF(RC[-1]<150,2,IF(RC[-1]<250,2.5,IF(RC[-1]<700,3,100)))) -> 2 | G222: =RC[-2]+RC[-1] -> 122 | H222: =IF(RC[-3]<50,1.5,IF(RC[-3]<150,2,IF(RC[-3]<250,2.5,IF(RC[-3]<700,3,100)))) -> 2 | I222: =RC[-2]+RC[-1] -> 124 | J222: 10.00000 | K222: 件 | L222: 件 | O222: 1 | P222: 白家 | Q222: 绿海食品
A223: 冷鲜肉类 | B223: 鸡肉（冻） | C223: 鸡皮 | E223: 110 | F223: =IF(RC[-1]<50,1.5,IF(RC[-1]<150,2,IF(RC[-1]<250,2.5,IF(RC[-1]<700,3,100)))) -> 2 | G223: =RC[-2]+RC[-1] -> 112 | H223: =IF(RC[-3]<50,1.5,IF(RC[-3]<150,2,IF(RC[-3]<250,2.5,IF(RC[-3]<700,3,100)))) -> 2 | I223: =RC[-2]+RC[-1] -> 114 | J223: 12.00000 | K223: 件 | L223: 件 | O223: 1 | P223: 白家 | Q223: 绿海食品
A224: 冷鲜肉类 | B224: 鸡肉（冻） | C224: 鸡胗 | E224: 220 | F224: =IF(RC[-1]<50,1.5,IF(RC[-1]<150,2,IF(RC[-1]<250,2.5,IF(RC[-1]<700,3,100)))) -> 2.5 | G224: =RC[-2]+RC[-1] -> 222.5 | H224: =IF(RC[-3]<50,1.5,IF(RC[-3]<150,2,IF(RC[-3]<250,2.5,IF(RC[-3]<700,3,100)))) -> 2.5 | I224: =RC[-2]+RC[-1] -> 225 | J224: 10.00000 | K224: 件 | L224: 件 | O224: 1 | P224: 白家 | Q224: 绿海食品
A225: 冷鲜肉类 | B225: 鸡肉（冻） | C225: 鸡中翅 | E225: 210 | F225: =IF(RC[-1]<50,1.5,IF(RC[-1]<150,2,IF(RC[-1]<250,2.5,IF(RC[-1]<700,3,100)))) -> 2.5 | G225: =RC[-2]+RC[-1] -> 212.5 | H225: =IF(RC[-3]<50,1.5,IF(RC[-3]<150,2,IF(RC[-3]<250,2.5,IF(RC[-3]<700,3,100)))) -> 2.5 | I225: =RC[-2]+RC[-1] -> 215 | J225: 10.00000 | K225: 件 | L225: 件 | O225: 1 | P225: 白家 | Q225: 绿海食品
A226: 冷鲜肉类 | B226: 鸡肉（冻） | C226: 鸡边腿 | E226: 80 | F226: =IF(RC[-1]<50,1.5,IF(RC[-1]<150,2,IF(RC[-1]<250,2.5,IF(RC[-1]<700,3,100)))) -> 2 | G226: =RC[-2]+RC[-1] -> 82 | H226: =IF(RC[-3]<50,1.5,IF(RC[-3]<150,2,IF(RC[-3]<250,2.5,IF(RC[-3]<700,3,100)))) -> 2 | I226: =RC[-2]+RC[-1] -> 84 | J226: 8.50000 | K226: 件 | L226: 件 | O226: 1 | P226: 白家 | Q226: 绿海食品
A227: 冷鲜肉类 | B227: 鸡肉（冻） | C227: 鸡腿 | E227: 165 | F227: =IF(RC[-1]<50,1.5,IF(RC[-1]<150,2,IF(RC[-1]<250,2.5,IF(RC[-1]<700,3,100)))) -> 2.5 | G227: =RC[-2]+RC[-1] -> 167.5 | H227: =IF(RC[-3]<50,1.5,IF(RC[-3]<150,2,IF(RC[-3]<250,2.5,IF(RC[-3]<700,3,100)))) -> 2.5 | I227: =RC[-2]+RC[-1] -> 170 | J227: 10.00000 | K227: 件 | L227: 件 | O227: 1 | P227: 白家 | Q227: 绿海食品
A228: 禽蛋粮油 | B228: 杂粮 | C228: 黑米 | E228: 3.3 | F228: 0.15 | G228: =RC[-2]+RC[-1] -> 3.4499999999999997 | H228: 0.15 | I228: =RC[-2]+RC[-1] -> 3.5999999999999996 | J228: 500.00000000 | K228: 斤 | L228: 斤 | O228: 1 | P228: 西南食品城 | Q228: D-43
A229: 禽蛋粮油 | B229: 杂粮 | C229: 黄豆 | E229: 2.5 | F229: 0.15 | G229: =RC[-2]+RC[-1] -> 2.65 | H229: 0.15 | I229: =RC[-2]+RC[-1] -> 2.8 | J229: 500.00000000 | K229: 袋 | L229: 袋 | O229: 1 | P229: 西南食品城 | Q229: D-43
A230: 禽蛋粮油 | B230: 杂粮 | C230: 黑豆 | E230: 5.5 | F230: 0.2 | G230: =RC[-2]+RC[-1] -> 5.7 | H230: 0.2 | I230: =RC[-2]+RC[-1] -> 5.9 | J230: 500.00000000 | K230: 斤 | L230: 斤 | O230: 1 | P230: 西南食品城 | Q230: D-43
A231: 禽蛋粮油 | B231: 杂粮 | C231: 黑芝麻 | E231: 11 | F231: 0.5 | G231: =RC[-2]+RC[-1] -> 11.5 | H231: 0.5 | I231: =RC[-2]+RC[-1] -> 12 | J231: 500.00000000 | K231: 斤 | L231: 斤 | O231: 1 | P231: 西南食品城 | Q231: D-43
A232: 禽蛋粮油 | B232: 杂粮 | C232: 白芝麻 | E232: 8 | F232: 0.25 | G232: =RC[-2]+RC[-1] -> 8.25 | H232: 0.25 | I232: =RC[-2]+RC[-1] -> 8.5 | J232: 500.00000000 | K232: 斤 | L232: 斤 | O232: 1 | P232: 西南食品城 | Q232: D-43
A233: 禽蛋粮油 | B233: 杂粮 | C233: 八宝粥 | E233: 3.2 | F233: 0.15 | G233: =RC[-2]+RC[-1] -> 3.35 | H233: 0.15 | I233: =RC[-2]+RC[-1] -> 3.5 | J233: 500.00000000 | K233: 斤 | L233: 斤 | O233: 1 | P233: 西南食品城 | Q233: D-43
A234: 禽蛋粮油 | B234: 杂粮 | C234: 绿豆 | E234: 5.59 | F234: 0.2 | G234: =RC[-2]+RC[-1] -> 5.79 | H234: 0.2 | I234: =RC[-2]+RC[-1] -> 5.99 | J234: 500.00000000 | K234: 斤 | L234: 斤 | O234: 1 | P234: 西南食品城 | Q234: D-43
A235: 禽蛋粮油 | B235: 杂粮 | C235: 雪豆 | E235: 5.9 | F235: 0.2 | G235: =RC[-2]+RC[-1] -> 6.1000000000000005 | H235: 0.2 | I235: =RC[-2]+RC[-1] -> 6.3000000000000007 | J235: 500.00000000 | K235: 斤 | L235: 斤 | O235: 1 | P235: 西南食品城 | Q235: D-43
A236: 禽蛋粮油 | B236: 杂粮 | C236: 红豆 | E236: 5.59 | F236: 0.2 | G236: =RC[-2]+RC[-1] -> 5.79 | H236: 0.2 | I236: =RC[-2]+RC[-1] -> 5.99 | J236: 500.00000000 | K236: 斤 | L236: 斤 | O236: 1 | P236: 西南食品城 | Q236: D-43
A237: 禽蛋粮油 | B237: 杂粮 | C237: 玉米面 | E237: 1.8 | F237: 0.1 | G237: =RC[-2]+RC[-1] -> 1.9000000000000001 | H237: 0.1 | I237: =RC[-2]+RC[-1] -> 2 | J237: 500.00000000 | K237: 斤 | L237: 斤 | O237: 1 | P237: 西南食品城 | Q237: D-43
A238: 禽蛋粮油 | B238: 杂粮 | C238: 玉米渣 | E238: 1.8 | F238: 0.1 | G238: =RC[-2]+RC[-1] -> 1.9000000000000001 | H238: 0.1 | I238: =RC[-2]+RC[-1] -> 2 | J238: 500.00000000 | K238: 斤 | L238: 斤 | O238: 1 | P238: 西南食品城 | Q238: D-43
A239: 禽蛋粮油 | B239: 杂粮 | C239: 小米 | E239: 4.4000000000000004 | F239: 0.1 | G239: =RC[-2]+RC[-1] -> 4.5 | H239: 0.1 | I239: =RC[-2]+RC[-1] -> 4.5999999999999996 | J239: 500.00000000 | K239: 斤 | L239: 斤 | O239: 1 | P239: 西南食品城 | Q239: D-43
A240: 禽蛋粮油 | B240: 杂粮 | C240: 冰糖 | E240: 3.5 | F240: 0.1 | G240: =RC[-2]+RC[-1] -> 3.6 | H240: 0.1 | I240: =RC[-2]+RC[-1] -> 3.7 | J240: 500.00000000 | K240: 斤 | L240: 斤 | O240: 1 | P240: 西南食品城 | Q240: D-43
A241: 禽蛋粮油 | B241: 杂粮 | C241: 白糖 50kg | E241: 265 | F241: 3 | G241: =RC[-2]+RC[-1] -> 268 | H241: 3 | I241: =RC[-2]+RC[-1] -> 271 | J241: 500.00000000 | K241: 斤 | L241: 斤 | O241: 1 | P241: 西南食品城 | Q241: D-43
A242: 禽蛋粮油 | B242: 杂粮 | C242: 豆粉 | E242: 1.72 | F242: 0.1 | G242: =RC[-2]+RC[-1] -> 1.82 | H242: 0.1 | I242: =RC[-2]+RC[-1] -> 1.9200000000000002 | J242: 500.00000000 | K242: 斤 | L242: 斤 | O242: 1 | P242: 西南食品城 | Q242: D-43
A243: 禽蛋粮油 | B243: 杂粮 | C243: 燕麦片 | E243: 3.08 | F243: 0.1 | G243: =RC[-2]+RC[-1] -> 3.18 | H243: 0.1 | I243: =RC[-2]+RC[-1] -> 3.2800000000000002 | K243: 斤 | L243: 斤 | O243: 1
A244: 禽蛋粮油 | B244: 杂粮 | C244: 燕麦米 | E244: 2.86 | F244: 0.1 | G244: =RC[-2]+RC[-1] -> 2.96 | H244: 0.1 | I244: =RC[-2]+RC[-1] -> 3.06 | K244: 斤 | L244: 斤 | O244: 1
A245: 禽蛋粮油 | B245: 杂粮 | C245: 大黄米 | E245: 3.63 | F245: 0.1 | G245: =RC[-2]+RC[-1] -> 3.73 | H245: 0.1 | I245: =RC[-2]+RC[-1] -> 3.83 | K245: 斤 | L245: 斤 | O245: 1
A246: 禽蛋粮油 | B246: 杂粮 | C246: 熟粉 | E246: 2.2999999999999998 | F246: 0.1 | G246: =RC[-2]+RC[-1] -> 2.4 | H246: 0.1 | I246: =RC[-2]+RC[-1] -> 2.5 | K246: 斤 | L246: 斤 | O246: 1
A247: 禽蛋粮油 | B247: 杂粮 | C247: 玉米片 | E247: 2.0499999999999998 | F247: 0.1 | G247: =RC[-2]+RC[-1] -> 2.15 | H247: 0.1 | I247: =RC[-2]+RC[-1] -> 2.25 | K247: 斤 | L247: 斤 | O247: 1
A248: 禽蛋粮油 | B248: 粮油 | C248: 金龙鱼 食用调和油 黄金比例 5L | D248: 非转基因 | G248: =RC[-2]+RC[-1] -> 0 | I248: =RC[-2]+RC[-1] -> 0 | J248: 5.00000000 | K248: 桶 | L248: 桶 | M248: 200102800000 | N248: 1028 | O248: 1
A249: 禽蛋粮油 | B249: 粮油 | C249: 金龙鱼 食用调和油 黄金比例 5L | D249: 转基因 | G249: =RC[-2]+RC[-1] -> 0 | I249: =RC[-2]+RC[-1] -> 0 | J249: 5.00000000 | K249: 桶 | L249: 桶 | M249: 200102900000 | N249: 1029 | O249: 1
A250: 禽蛋粮油 | B250: 粮油 | C250: 金龙鱼 食用调和油 葵花籽清香型 5L | D250: 转基因 | G250: =RC[-2]+RC[-1] -> 0 | I250: =RC[-2]+RC[-1] -> 0 | J250: 5.00000000 | K250: 桶 | L250: 桶 | M250: 200103100000 | N250: 1031 | O250: 1
A251: 禽蛋粮油 | B251: 粮油 | C251: 金龙鱼 食用调和油 花生浓香 5L | D251: 非转基因 | G251: =RC[-2]+RC[-1] -> 0 | I251: =RC[-2]+RC[-1] -> 0 | J251: 5.00000000 | K251: 桶 | L251: 桶 | M251: 200103000000 | N251: 1030 | O251: 1
A252: 禽蛋粮油 | B252: 粮油 | C252: 金龙鱼 阳光葵花籽油 5L | D252: 非转基因 | G252: =RC[-2]+RC[-1] -> 0 | I252: =RC[-2]+RC[-1] -> 0 | J252: 5.00000000 | K252: 桶 | L252: 桶 | M252: 200102700000 | N252: 1027 | O252: 1
A253: 禽蛋粮油 | B253: 粮油 | C253: 金龙鱼 纯香菜籽油 5L | D253: 转基因 | G253: =RC[-2]+RC[-1] -> 0 | I253: =RC[-2]+RC[-1] -> 0 | J253: 5.00000000 | K253: 桶 | L253: 桶 | M253: 200102100000 | N253: 1021 | O253: 1
A254: 禽蛋粮油 | B254: 粮油 | C254: 金龙鱼 纯香AE菜籽油 5L | D254: 转基因 | G254: =RC[-2]+RC[-1] -> 0 | I254: =RC[-2]+RC[-1] -> 0 | J254: 5.00000000 | K254: 桶 | L254: 桶 | M254: 200102200000 | N254: 1022 | O254: 1
A255: 禽蛋粮油 | B255: 粮油 | C255: 金龙鱼 纯正花生油 压榨一级 5L | D255: 非转基因 | G255: =RC[-2]+RC[-1] -> 0 | I255: =RC[-2]+RC[-1] -> 0 | J255: 5.00000000 | K255: 桶 | L255: 桶 | M255: 200102500000 | N255: 1025 | O255: 1
A256: 禽蛋粮油 | B256: 粮油 | C256: 金龙鱼 精炼一级大豆油 5L | D256: 非转基因 | G256: =RC[-2]+RC[-1] -> 0 | I256: =RC[-2]+RC[-1] -> 0 | J256: 5.00000000 | K256: 桶 | L256: 桶 | M256: 200102300000 | N256: 1023 | O256: 1
A257: 禽蛋粮油 | B257: 粮油 | C257: 金龙鱼 精炼一级大豆油 5L | D257: 转基因 | G257: =RC[-2]+RC[-1] -> 0 | I257: =RC[-2]+RC[-1] -> 0 | J257: 5.00000000 | K257: 桶 | L257: 桶 | M257: 200102400000 | N257: 1024 | O257: 1
A258: 禽蛋粮油 | B258: 粮油 | C258: 金龙鱼 玉米油 玉米胚芽油 5L | D258: 非转基因 | G258: =RC[-2]+RC[-1] -> 0 | I258: =RC[-2]+RC[-1] -> 0 | J258: 5.00000000 | K258: 桶 | L258: 桶 | M258: 200103200000 | N258: 1032 | O258: 1
A259: 禽蛋粮油 | B259: 粮油 | C259: 金龙鱼 特香花生油 压榨一级 5L | D259: 非转基因 | G259: =RC[-2]+RC[-1] -> 0 | I259: =RC[-2]+RC[-1] -> 0 | J259: 5.00000000 | K259: 桶 | L259: 桶 | M259: 200102600000 | N259: 1026 | O259: 1
A260: 禽蛋粮油 | B260: 粮油 | C260: 奇彩鱼食用调和油（花生浓香）20L | D260: 餐饮专供 | G260: =RC[-2]+RC[-1] -> 0 | I260: =RC[-2]+RC[-1] -> 0 | J260: 20.00000000 | K260: 件 | L260: 件 | M260: 200101100000 | N260: 1011 | O260: 1
A261: 禽蛋粮油 | B261: 粮油 | C261: 奇彩鱼食用调和油（花生浓香）12.5Lx2 | G261: =RC[-2]+RC[-1] -> 0 | I261: =RC[-2]+RC[-1] -> 0 | J261: 25.00000000 | K261: 件 | L261: 件 | M261: 200101000000 | N261: 1010 | O261: 1
A262: 禽蛋粮油 | B262: 粮油 | C262: 奇彩鱼食用调和油（纯香菜籽）22L | D262: 餐饮专供 | G262: =RC[-2]+RC[-1] -> 0 | I262: =RC[-2]+RC[-1] -> 0 | J262: 22.00000000 | K262: 件 | L262: 件 | M262: 200100900000 | N262: 1009 | O262: 1
A263: 禽蛋粮油 | B263: 粮油 | C263: 奇彩鱼食用调和油（纯香菜籽）12.5Lx2 | D263: 餐饮专供 | G263: =RC[-2]+RC[-1] -> 0 | I263: =RC[-2]+RC[-1] -> 0 | J263: 25.00000000 | K263: 件 | L263: 件 | M263: 200100800000 | N263: 1008 | O263: 1
A264: 禽蛋粮油 | B264: 粮油 | C264: 奇彩鱼食用调和油（纯香菜籽）10Lx2 | D264: 餐饮专供 | G264: =RC[-2]+RC[-1] -> 0 | I264: =RC[-2]+RC[-1] -> 0 | J264: 20.00000000 | K264: 件 | L264: 件 | M264: 200100700000 | N264: 1007 | O264: 1
A265: 禽蛋粮油 | B265: 粮油 | C265: 奇彩鱼烹调油22L | D265: 餐饮专用，成品超级棕榈液油 | G265: =RC[-2]+RC[-1] -> 0 | I265: =RC[-2]+RC[-1] -> 0 | J265: 22.00000000 | K265: 件 | L265: 件 | M265: 200100600000 | N265: 1006 | O265: 1
A266: 禽蛋粮油 | B266: 粮油 | C266: 奇彩鱼烹调油12.5L*2 | D266: 餐饮专用，成品超级棕榈液油 | G266: =RC[-2]+RC[-1] -> 0 | I266: =RC[-2]+RC[-1] -> 0 | J266: 25.00000000 | K266: 件 | L266: 件 | M266: 200100500000 | N266: 1005 | O266: 1
A267: 禽蛋粮油 | B267: 粮油 | C267: 奇彩鱼一级大豆油22L | G267: =RC[-2]+RC[-1] -> 0 | I267: =RC[-2]+RC[-1] -> 0 | J267: 22.00000000 | K267: 件 | L267: 件 | M267: 200100200000 | N267: 1002 | O267: 1
A268: 禽蛋粮油 | B268: 粮油 | C268: 奇彩鱼一级大豆油20L | G268: =RC[-2]+RC[-1] -> 0 | I268: =RC[-2]+RC[-1] -> 0 | J268: 20.00000000 | K268: 件 | L268: 件 | M268: 200100300000 | N268: 1003 | O268: 1
A269: 禽蛋粮油 | B269: 粮油 | C269: 奇彩鱼一级大豆油12.5L*2 | G269: =RC[-2]+RC[-1] -> 0 | I269: =RC[-2]+RC[-1] -> 0 | J269: 25.00000000 | K269: 件 | L269: 件 | M269: 200100100000 | N269: 1001 | O269: 1
A270: 禽蛋粮油 | B270: 粮油 | C270: 奇彩鱼一级大豆油10L*2 | G270: =RC[-2]+RC[-1] -> 0 | I270: =RC[-2]+RC[-1] -> 0 | J270: 20.00000000 | K270: 件 | L270: 件 | M270: 200100400000 | N270: 1004 | O270: 1
A271: 禽蛋粮油 | B271: 粮油 | C271: 神象 纯菜油 25kg + 桶押金（25） | E271: 345 | F271: 5 | G271: =RC[-2]+RC[-1] -> 350 | H271: 5 | I271: =RC[-2]+RC[-1] -> 355 | K271: 桶 | L271: 桶 | O271: 1
A272: 禽蛋粮油 | B272: 粮油 | C272: 神象 小榨香油 25kg + 桶押金（25） | E272: 305 | F272: 5 | G272: =RC[-2]+RC[-1] -> 310 | H272: 5 | I272: =RC[-2]+RC[-1] -> 315 | K272: 桶 | L272: 桶 | O272: 1
A273: 禽蛋粮油 | B273: 粮油 | C273: 神象 调和浓香 25kg + 桶押金（25） | E273: 275 | F273: 5 | G273: =RC[-2]+RC[-1] -> 280 | H273: 5 | I273: =RC[-2]+RC[-1] -> 285 | K273: 桶 | L273: 桶 | O273: 1
A274: 禽蛋粮油 | B274: 粮油 | C274: 神象 调和纯香 25kg + 桶押金（25） | E274: 255 | F274: 5 | G274: =RC[-2]+RC[-1] -> 260 | H274: 5 | I274: =RC[-2]+RC[-1] -> 265 | K274: 桶 | L274: 桶 | O274: 1
A275: 禽蛋粮油 | B275: 粮油 | C275: 神象 调和清香 25kg + 桶押金（25） | E275: 235 | F275: 5 | G275: =RC[-2]+RC[-1] -> 240 | H275: 5 | I275: =RC[-2]+RC[-1] -> 245 | K275: 桶 | L275: 桶 | O275: 1
A276: 禽蛋粮油 | B276: 粮油 | C276: 神象 压榨纯香 25kg + 桶押金（25） | E276: 260 | F276: 5 | G276: =RC[-2]+RC[-1] -> 265 | H276: 5 | I276: =RC[-2]+RC[-1] -> 270 | K276: 桶 | L276: 桶 | O276: 1
A277: 禽蛋粮油 | B277: 粮油 | C277: 神象 浓香油 25kg + 桶押金（25） | E277: 265 | F277: 5 | G277: =RC[-2]+RC[-1] -> 270 | H277: 5 | I277: =RC[-2]+RC[-1] -> 275 | K277: 桶 | L277: 桶 | O277: 1
A278: 禽蛋粮油 | B278: 粮油 | C278: 神象 色拉油 25kg + 桶押金（25） | E278: 175 | F278: 4 | G278: =RC[-2]+RC[-1] -> 179 | H278: 4 | I278: =RC[-2]+RC[-1] -> 183 | K278: 桶 | L278: 桶 | O278: 1
A279: 禽蛋粮油 | B279: 粮油 | C279: 金禄福 菜籽油 25kg | E279: 235 | F279: 5 | G279: =RC[-2]+RC[-1] -> 240 | H279: 5 | I279: =RC[-2]+RC[-1] -> 245 | K279: 件 | L279: 件 | O279: 1 | P279: 西南食品城 | Q279: D-43
A280: 禽蛋粮油 | B280: 粮油 | C280: 川龙 大豆油 25kg | E280: 165 | F280: 2 | G280: =RC[-2]+RC[-1] -> 167 | H280: 3 | I280: =RC[-2]+RC[-1] -> 170 | K280: 件 | L280: 件 | O280: 1 | P280: 西南食品城 | Q280: D-43
A281: 禽蛋粮油 | B281: 粮油 | C281: 润香园 大豆油 25kg | E281: 165 | F281: 2 | G281: =RC[-2]+RC[-1] -> 167 | H281: 3 | I281: =RC[-2]+RC[-1] -> 170 | K281: 件 | L281: 件 | O281: 1 | P281: 西南食品城 | Q281: D-43
A282: 禽蛋粮油 | B282: 粮油 | C282: 踏水坊 火锅油碟（红）lx200个 | E282: 310 | F282: 5 | G282: =RC[-2]+RC[-1] -> 315 | H282: 5 | I282: =RC[-2]+RC[-1] -> 320 | K282: 件 | L282: 件 | O282: 1 | P282: 海霸王 | Q282: 金博水产
A283: 禽蛋粮油 | B283: 粮油 | C283: 踏水坊 火锅油碟（绿）lx200个 | E283: 340 | F283: 5 | G283: =RC[-2]+RC[-1] -> 345 | H283: 5 | I283: =RC[-2]+RC[-1] -> 350 | K283: 件 | L283: 件 | O283: 1 | P283: 海霸王 | Q283: 金博水产
A284: 禽蛋粮油 | B284: 粮油 | C284: 踏水坊 麻辣火锅油碟（黄）lx200个 | E284: 360 | F284: 5 | G284: =RC[-2]+RC[-1] -> 365 | H284: 5 | I284: =RC[-2]+RC[-1] -> 370 | K284: 件 | L284: 件 | O284: 1 | P284: 海霸王 | Q284: 金博水产
A285: 禽蛋粮油 | B285: 粮油 | C285: 踏水坊 袋装透明火锅油碟 lx200袋 | E285: 200 | F285: 5 | G285: =RC[-2]+RC[-1] -> 205 | H285: 5 | I285: =RC[-2]+RC[-1] -> 210 | K285: 件 | L285: 件 | O285: 1 | P285: 海霸王 | Q285: 金博水产
A286: 禽蛋粮油 | B286: 粮油 | C286: 踏水坊 袋装锡箔火锅油碟 lx200袋 | E286: 220 | F286: 5 | G286: =RC[-2]+RC[-1] -> 225 | H286: 5 | I286: =RC[-2]+RC[-1] -> 230 | K286: 件 | L286: 件 | O286: 1 | P286: 海霸王 | Q286: 金博水产
A287: 禽蛋粮油 | B287: 粮油 | C287: 肖佬五老火锅油 4袋*8.5斤 | E287: 240 | F287: 2 | G287: =RC[-2]+RC[-1] -> 242 | H287: 3 | I287: =RC[-2]+RC[-1] -> 245 | K287: 件 | L287: 件 | O287: 1 | P287: 海霸王 | Q287: 金博水产
A288: 禽蛋粮油 | B288: 粮油 | C288: 肖佬五36斤珍品 4袋*9斤 | E288: 233 | F288: 2 | G288: =RC[-2]+RC[-1] -> 235 | H288: 3 | I288: =RC[-2]+RC[-1] -> 238 | K288: 件 | L288: 件 | O288: 1 | P288: 海霸王 | Q288: 金博水产
A289: 禽蛋粮油 | B289: 粮油 | C289: 肖佬五34斤珍品 4袋*8.5斤 | E289: 208 | F289: 3 | G289: =RC[-2]+RC[-1] -> 211 | H289: 4 | I289: =RC[-2]+RC[-1] -> 215 | K289: 件 | L289: 件 | O289: 1 | P289: 海霸王 | Q289: 金博水产
A290: 禽蛋粮油 | B290: 粮油 | C290: 肖佬五28斤珍品 4袋*7斤 | E290: 175 | F290: 2 | G290: =RC[-2]+RC[-1] -> 177 | H290: 3 | I290: =RC[-2]+RC[-1] -> 180 | K290: 件 | L290: 件 | O290: 1 | P290: 海霸王 | Q290: 金博水产
A291: 禽蛋粮油 | B291: 粮油 | C291: 肖佬五火锅底料 1*30袋 | E291: 265 | F291: 2 | G291: =RC[-2]+RC[-1] -> 267 | H291: 3 | I291: =RC[-2]+RC[-1] -> 270 | K291: 件 | L291: 件 | O291: 1 | P291: 海霸王 | Q291: 金博水产
A292: 禽蛋粮油 | B292: 粮油 | C292: 张兵兵36斤 4袋*9斤 | E292: 245 | F292: 5 | G292: =RC[-2]+RC[-1] -> 250 | H292: 5 | I292: =RC[-2]+RC[-1] -> 255 | K292: 件 | L292: 件 | O292: 1 | P292: 海霸王 | Q292: 金博水产
A293: 禽蛋粮油 | B293: 粮油 | C293: 张兵兵34斤 4袋*8.5斤 | E293: 225 | F293: 2 | G293: =RC[-2]+RC[-1] -> 227 | H293: 3 | I293: =RC[-2]+RC[-1] -> 230 | K293: 件 | L293: 件 | O293: 1 | P293: 海霸王 | Q293: 金博水产
A294: 禽蛋粮油 | B294: 粮油 | C294: 张兵兵27斤 3袋*9斤 | E294: 175 | F294: 2 | G294: =RC[-2]+RC[-1] -> 177 | H294: 3 | I294: =RC[-2]+RC[-1] -> 180 | K294: 件 | L294: 件 | O294: 1 | P294: 海霸王 | Q294: 金博水产
A295: 禽蛋粮油 | B295: 粮油 | C295: 五三泰香米 25kg | E295: 121 | F295: =IF(RC[-1]<100,"3",IF(RC[-1]<120,"3.5",IF(RC[-1]<140,"4","4.5"))) -> 4 | G295: =RC[-2]+RC[-1] -> 125 | H295: =IF(RC[-3]<100,"3",IF(RC[-3]<120,"3.5",IF(RC[-3]<140,"4","4.5"))) -> 4 | I295: =RC[-2]+RC[-1] -> 129 | K295: 袋 | L295: 袋 | O295: 1 | P295: 海霸王 | Q295: 粮道王
A296: 禽蛋粮油 | B296: 粮油 | C296: 秋珍泰香米 25kg | E296: 115 | F296: =IF(RC[-1]<100,"3",IF(RC[-1]<120,"3.5",IF(RC[-1]<140,"4","4.5"))) -> 3.5 | G296: =RC[-2]+RC[-1] -> 118.5 | H296: =IF(RC[-3]<100,"3",IF(RC[-3]<120,"3.5",IF(RC[-3]<140,"4","4.5"))) -> 3.5 | I296: =RC[-2]+RC[-1] -> 122 | K296: 袋 | L296: 袋 | O296: 1 | P296: 海霸王 | Q296: 粮道王
A297: 禽蛋粮油 | B297: 粮油 | C297: 粮道王珍珠米 25kg | E297: 125 | F297: =IF(RC[-1]<100,"3",IF(RC[-1]<120,"3.5",IF(RC[-1]<140,"4","4.5"))) -> 4 | G297: =RC[-2]+RC[-1] -> 129 | H297: =IF(RC[-3]<100,"3",IF(RC[-3]<120,"3.5",IF(RC[-3]<140,"4","4.5"))) -> 4 | I297: =RC[-2]+RC[-1] -> 133 | K297: 袋 | L297: 袋 | O297: 1 | P297: 海霸王 | Q297: 粮道王
A298: 禽蛋粮油 | B298: 粮油 | C298: 绿福珍珠米 25kg | E298: 119 | F298: =IF(RC[-1]<100,"3",IF(RC[-1]<120,"3.5",IF(RC[-1]<140,"4","4.5"))) -> 3.5 | G298: =RC[-2]+RC[-1] -> 122.5 | H298: =IF(RC[-3]<100,"3",IF(RC[-3]<120,"3.5",IF(RC[-3]<140,"4","4.5"))) -> 3.5 | I298: =RC[-2]+RC[-1] -> 126 | K298: 袋 | L298: 袋 | O298: 1 | P298: 海霸王 | Q298: 粮道王
A299: 禽蛋粮油 | B299: 粮油 | C299: 五常香米 25kg | E299: 151 | F299: =IF(RC[-1]<100,"3",IF(RC[-1]<120,"3.5",IF(RC[-1]<140,"4","4.5"))) -> 4.5 | G299: =RC[-2]+RC[-1] -> 155.5 | H299: =IF(RC[-3]<100,"3",IF(RC[-3]<120,"3.5",IF(RC[-3]<140,"4","4.5"))) -> 4.5 | I299: =RC[-2]+RC[-1] -> 160 | K299: 袋 | L299: 袋 | O299: 1 | P299: 海霸王 | Q299: 粮道王
A300: 禽蛋粮油 | B300: 粮油 | C300: 泰国香米 25kg | E300: 280 | F300: =IF(RC[-1]<100,"3",IF(RC[-1]<120,"3.5",IF(RC[-1]<140,"4","4.5"))) -> 4.5 | G300: =RC[-2]+RC[-1] -> 284.5 | H300: =IF(RC[-3]<100,"3",IF(RC[-3]<120,"3.5",IF(RC[-3]<140,"4","4.5"))) -> 4.5 | I300: =RC[-2]+RC[-1] -> 289 | K300: 袋 | L300: 袋 | O300: 1 | P300: 海霸王 | Q300: 粮道王
A301: 禽蛋粮油 | B301: 粮油 | C301: 树堂汉中香米 25kg | E301: 116 | F301: =IF(RC[-1]<100,"3",IF(RC[-1]<120,"3.5",IF(RC[-1]<140,"4","4.5"))) -> 3.5 | G301: =RC[-2]+RC[-1] -> 119.5 | H301: =IF(RC[-3]<100,"3",IF(RC[-3]<120,"3.5",IF(RC[-3]<140,"4","4.5"))) -> 3.5 | I301: =RC[-2]+RC[-1] -> 123 | K301: 袋 | L301: 袋 | O301: 1 | P301: 海霸王 | Q301: 粮道王
A302: 禽蛋粮油 | B302: 粮油 | C302: 碗碗香汉中香米 25kg | E302: 116 | F302: =IF(RC[-1]<100,"3",IF(RC[-1]<120,"3.5",IF(RC[-1]<140,"4","4.5"))) -> 3.5 | G302: =RC[-2]+RC[-1] -> 119.5 | H302: =IF(RC[-3]<100,"3",IF(RC[-3]<120,"3.5",IF(RC[-3]<140,"4","4.5"))) -> 3.5 | I302: =RC[-2]+RC[-1] -> 123 | K302: 袋 | L302: 袋 | O302: 1 | P302: 海霸王 | Q302: 粮道王
A303: 禽蛋粮油 | B303: 粮油 | C303: 城固汉中米 25kg | E303: 117 | F303: 2 | G303: =RC[-2]+RC[-1] -> 119 | H303: 3 | I303: =RC[-2]+RC[-1] -> 122 | K303: 袋 | L303: 袋 | O303: 1 | P303: 西南食品城 | Q303: D-43
A304: 禽蛋粮油 | B304: 粮油 | C304: 勉县汉中米 25kg | E304: 120 | F304: 2 | G304: =RC[-2]+RC[-1] -> 122 | H304: 3 | I304: =RC[-2]+RC[-1] -> 125 | K304: 袋 | L304: 袋 | O304: 1 | P304: 西南食品城 | Q304: D-43
A305: 禽蛋粮油 | B305: 粮油 | C305: 湖北中国香米 25kg | E305: 123 | F305: 2 | G305: =RC[-2]+RC[-1] -> 125 | H305: 3 | I305: =RC[-2]+RC[-1] -> 128 | K305: 袋 | L305: 袋 | O305: 1 | P305: 西南食品城 | Q305: D-43
A306: 禽蛋粮油 | B306: 粮油 | C306: 聚源泰香米 25kg | E306: 123 | F306: 2 | G306: =RC[-2]+RC[-1] -> 125 | H306: 3 | I306: =RC[-2]+RC[-1] -> 128 | K306: 袋 | L306: 袋 | O306: 1 | P306: 西南食品城 | Q306: D-43
A307: 禽蛋粮油 | B307: 粮油 | C307: 聪明谷珍珠米 25kg | E307: 128 | F307: 2 | G307: =RC[-2]+RC[-1] -> 130 | H307: 3 | I307: =RC[-2]+RC[-1] -> 133 | K307: 袋 | L307: 袋 | O307: 1 | P307: 西南食品城 | Q307: D-43
A308: 禽蛋粮油 | B308: 粮油 | C308: 泰和香米 10kg | E308: 128 | F308: 2 | G308: =RC[-2]+RC[-1] -> 130 | H308: 3 | I308: =RC[-2]+RC[-1] -> 133 | K308: 袋 | L308: 袋 | O308: 1 | P308: 西南食品城 | Q308: D-43
A309: 禽蛋粮油 | B309: 粮油 | C309: 五常稻花香 10kg | E309: 52 | F309: 2 | G309: =RC[-2]+RC[-1] -> 54 | H309: 2 | I309: =RC[-2]+RC[-1] -> 56 | K309: 袋 | L309: 袋 | O309: 1 | P309: 西南食品城 | Q309: D-43
A310: 禽蛋粮油 | B310: 粮油 | C310: 五得利 高精面粉 25kg | E310: 97 | F310: 2 | G310: =RC[-2]+RC[-1] -> 99 | H310: 2 | I310: =RC[-2]+RC[-1] -> 101 | K310: 袋 | L310: 袋 | O310: 1 | P310: 西南食品城 | Q310: D-43
A311: 禽蛋粮油 | B311: 粮油 | C311: 五得利 特精面粉 25kg | E311: 95 | F311: 2 | G311: =RC[-2]+RC[-1] -> 97 | H311: 2 | I311: =RC[-2]+RC[-1] -> 99 | K311: 袋 | L311: 袋 | O311: 1 | P311: 西南食品城 | Q311: D-43
A312: 禽蛋粮油 | B312: 粮油 | C312: 五得利 雪花面粉 25kg | E312: 95 | F312: 2 | G312: =RC[-2]+RC[-1] -> 97 | H312: 2 | I312: =RC[-2]+RC[-1] -> 99 | K312: 袋 | L312: 袋 | O312: 1 | P312: 西南食品城 | Q312: D-43
A313: 禽蛋粮油 | B313: 禽蛋 | C313: 盐蛋/咸鸭蛋 | G313: =RC[-2]+RC[-1] -> 0 | I313: =RC[-2]+RC[-1] -> 0 | J313: 500.00000000 | K313: 斤 | L313: 斤 | M313: 200355200000 | N313: 3552 | O313: 1
A314: 禽蛋粮油 | B314: 禽蛋 | C314: 松花皮蛋 | G314: =RC[-2]+RC[-1] -> 0 | I314: =RC[-2]+RC[-1] -> 0 | J314: 500.00000000 | K314: 斤 | L314: 斤 | M314: 200355100000 | N314: 3551 | O314: 1
A315: 水产冻货 | B315: 冻货 | C315: 鱼肉卷（佳鹤）2500g*4袋 | D315: 捞神派 | E315: 71 | F315: 9 | G315: =RC[-2]+RC[-1] -> 80 | H315: 5 | I315: =RC[-2]+RC[-1] -> 85 | K315: 件 | L315: 件 | O315: 1 | P315: 海霸王 | Q315: 金博水产
A316: 水产冻货 | B316: 冻货 | C316: 虾肉卷（佳鹤）2500g*4袋 | D316: 捞神派 | E316: 71 | F316: 9 | G316: =RC[-2]+RC[-1] -> 80 | H316: 5 | I316: =RC[-2]+RC[-1] -> 85 | K316: 件 | L316: 件 | O316: 1 | P316: 海霸王 | Q316: 金博水产
A317: 水产冻货 | B317: 冻货 | C317: 包心鱼丸（佳鹤）2500g*4袋 | D317: 捞神派 | E317: 87 | F317: 13 | G317: =RC[-2]+RC[-1] -> 100 | H317: 5 | I317: =RC[-2]+RC[-1] -> 105 | K317: 件 | L317: 件 | O317: 1 | P317: 海霸王 | Q317: 金博水产
A318: 水产冻货 | B318: 冻货 | C318: 包心虾丸（佳鹤）2500g*4袋 | D318: 捞神派 | E318: 87 | F318: 13 | G318: =RC[-2]+RC[-1] -> 100 | H318: 5 | I318: =RC[-2]+RC[-1] -> 105 | K318: 件 | L318: 件 | O318: 1 | P318: 海霸王 | Q318: 金博水产
A319: 水产冻货 | B319: 冻货 | C319: 鱼皮脆（佳鹤）1500g*4袋 | D319: 捞神派 | E319: 58 | F319: 7 | G319: =RC[-2]+RC[-1] -> 65 | H319: 5 | I319: =RC[-2]+RC[-1] -> 70 | K319: 件 | L319: 件 | O319: 1 | P319: 海霸王 | Q319: 金博水产
A320: 水产冻货 | B320: 冻货 | C320: 腰花肠（佳鹤）1500g*4袋 | D320: 捞神派 | E320: 74 | F320: 11 | G320: =RC[-2]+RC[-1] -> 85 | H320: 5 | I320: =RC[-2]+RC[-1] -> 90 | K320: 件 | L320: 件 | O320: 1 | P320: 海霸王 | Q320: 金博水产
A321: 水产冻货 | B321: 冻货 | C321: 鱿鱼花（佳鹤）1500g*4袋 | D321: 捞神派 | E321: 74 | F321: 11 | G321: =RC[-2]+RC[-1] -> 85 | H321: 5 | I321: =RC[-2]+RC[-1] -> 90 | K321: 件 | L321: 件 | O321: 1 | P321: 海霸王 | Q321: 金博水产
A322: 水产冻货 | B322: 冻货 | C322: 鱼豆腐（佳鹤）2500g*4袋 | D322: 捞神派 | E322: 82 | F322: 13 | G322: =RC[-2]+RC[-1] -> 95 | H322: 5 | I322: =RC[-2]+RC[-1] -> 100 | K322: 件 | L322: 件 | O322: 1 | P322: 海霸王 | Q322: 金博水产
A323: 水产冻货 | B323: 冻货 | C323: 金品鱼丸（佳鹤）2500g*4袋 | D323: 捞神派 | E323: 58 | F323: 7 | G323: =RC[-2]+RC[-1] -> 65 | H323: 5 | I323: =RC[-2]+RC[-1] -> 70 | K323: 件 | L323: 件 | O323: 1 | P323: 海霸王 | Q323: 金博水产
A324: 水产冻货 | B324: 冻货 | C324: 金品鸡丸（佳鹤）2500g*4袋 | D324: 捞神派 | E324: 58 | F324: 7 | G324: =RC[-2]+RC[-1] -> 65 | H324: 5 | I324: =RC[-2]+RC[-1] -> 70 | K324: 件 | L324: 件 | O324: 1 | P324: 海霸王 | Q324: 金博水产
A325: 水产冻货 | B325: 冻货 | C325: 金品虾丸（佳鹤）2500g*4袋 | D325: 捞神派 | E325: 58 | F325: 7 | G325: =RC[-2]+RC[-1] -> 65 | H325: 5 | I325: =RC[-2]+RC[-1] -> 70 | K325: 件 | L325: 件 | O325: 1 | P325: 海霸王 | Q325: 金博水产
A326: 水产冻货 | B326: 冻货 | C326: 金品菠菜丸（佳鹤）2500g*4袋 | D326: 捞神派 | E326: 58 | F326: 7 | G326: =RC[-2]+RC[-1] -> 65 | H326: 5 | I326: =RC[-2]+RC[-1] -> 70 | K326: 件 | L326: 件 | O326: 1 | P326: 海霸王 | Q326: 金博水产
A327: 水产冻货 | B327: 冻货 | C327: 彩虹卷（佳鹤）2500g*4袋 | D327: 香港派 | E327: 106 | F327: 19 | G327: =RC[-2]+RC[-1] -> 125 | H327: 5 | I327: =RC[-2]+RC[-1] -> 130 | K327: 件 | L327: 件 | O327: 1 | P327: 海霸王 | Q327: 金博水产
A328: 水产冻货 | B328: 冻货 | C328: 片片脆（佳鹤）2500g*4袋 | D328: 香港派 | E328: 106 | F328: 19 | G328: =RC[-2]+RC[-1] -> 125 | H328: 5 | I328: =RC[-2]+RC[-1] -> 130 | K328: 件 | L328: 件 | O328: 1 | P328: 海霸王 | Q328: 金博水产
A329: 水产冻货 | B329: 冻货 | C329: 三文鱼卷（佳鹤）2500g*4袋 | D329: 香港派 | E329: 106 | F329: 19 | G329: =RC[-2]+RC[-1] -> 125 | H329: 5 | I329: =RC[-2]+RC[-1] -> 130 | K329: 件 | L329: 件 | O329: 1 | P329: 海霸王 | Q329: 金博水产
A330: 水产冻货 | B330: 冻货 | C330: 仿鳕鱼卷（佳鹤）2500g*4袋 | D330: 香港派 | E330: 106 | F330: 19 | G330: =RC[-2]+RC[-1] -> 125 | H330: 5 | I330: =RC[-2]+RC[-1] -> 130 | K330: 件 | L330: 件 | O330: 1 | P330: 海霸王 | Q330: 金博水产
A331: 水产冻货 | B331: 冻货 | C331: 小布丁（佳鹤）2500g*4袋 | D331: 香港派 | E331: 110 | F331: 20 | G331: =RC[-2]+RC[-1] -> 130 | H331: 5 | I331: =RC[-2]+RC[-1] -> 135 | K331: 件 | L331: 件 | O331: 1 | P331: 海霸王 | Q331: 金博水产
A332: 水产冻货 | B332: 冻货 | C332: 台湾烤肠（佳鹤）1900g*6袋 | D332: 香港派 | E332: 106 | F332: 19 | G332: =RC[-2]+RC[-1] -> 125 | H332: 5 | I332: =RC[-2]+RC[-1] -> 130 | K332: 件 | L332: 件 | O332: 1 | P332: 海霸王 | Q332: 金博水产
A333: 水产冻货 | B333: 冻货 | C333: 台湾烤肠（佳鹤）1900g*10袋 | D333: 香港派 | E333: 218 | F333: 47 | G333: =RC[-2]+RC[-1] -> 265 | H333: 5 | I333: =RC[-2]+RC[-1] -> 270 | K333: 件 | L333: 件 | O333: 1 | P333: 海霸王 | Q333: 金博水产
A334: 水产冻货 | B334: 冻货 | C334: 夹心蟹排（佳鹤）2500g*4袋 | D334: 台湾派 | E334: 106 | F334: 19 | G334: =RC[-2]+RC[-1] -> 125 | H334: 5 | I334: =RC[-2]+RC[-1] -> 130 | K334: 件 | L334: 件 | O334: 1 | P334: 海霸王 | Q334: 金博水产
A335: 水产冻货 | B335: 冻货 | C335: 脆皮蛋卷（佳鹤）2500g*4袋 | D335: 台湾派 | E335: 106 | F335: 19 | G335: =RC[-2]+RC[-1] -> 125 | H335: 5 | I335: =RC[-2]+RC[-1] -> 130 | K335: 件 | L335: 件 | O335: 1 | P335: 海霸王 | Q335: 金博水产
A336: 水产冻货 | B336: 冻货 | C336: 五彩鱼棒（佳鹤）2500g*4袋 | D336: 台湾派 | E336: 106 | F336: 19 | G336: =RC[-2]+RC[-1] -> 125 | H336: 5 | I336: =RC[-2]+RC[-1] -> 130 | K336: 件 | L336: 件 | O336: 1 | P336: 海霸王 | Q336: 金博水产
A337: 水产冻货 | B337: 冻货 | C337: 海参肉羹条（佳鹤）2500g*4袋 | D337: 台湾派 | E337: 106 | F337: 19 | G337: =RC[-2]+RC[-1] -> 125 | H337: 5 | I337: =RC[-2]+RC[-1] -> 130 | K337: 件 | L337: 件 | O337: 1 | P337: 海霸王 | Q337: 金博水产
A338: 水产冻货 | B338: 冻货 | C338: 虾米饺（佳鹤）2500g*4袋 | D338: 台湾派 | E338: 106 | F338: 19 | G338: =RC[-2]+RC[-1] -> 125 | H338: 5 | I338: =RC[-2]+RC[-1] -> 130 | K338: 件 | L338: 件 | O338: 1 | P338: 海霸王 | Q338: 金博水产
A339: 水产冻货 | B339: 冻货 | C339: 烤鱼棒（佳鹤）2500g*4袋 | D339: 台湾派 | E339: 106 | F339: 19 | G339: =RC[-2]+RC[-1] -> 125 | H339: 5 | I339: =RC[-2]+RC[-1] -> 130 | K339: 件 | L339: 件 | O339: 1 | P339: 海霸王 | Q339: 金博水产
A340: 水产冻货 | B340: 冻货 | C340: 龙虾球（佳鹤）2500g*4袋 | D340: 台湾派 | E340: 105 | F340: 18 | G340: =RC[-2]+RC[-1] -> 123 | H340: 5 | I340: =RC[-2]+RC[-1] -> 128 | K340: 件 | L340: 件 | O340: 1 | P340: 海霸王 | Q340: 金博水产
A341: 水产冻货 | B341: 冻货 | C341: 跳跳虾（佳鹤）2500g*4袋 | D341: 台湾派 | E341: 106 | F341: 19 | G341: =RC[-2]+RC[-1] -> 125 | H341: 5 | I341: =RC[-2]+RC[-1] -> 130 | K341: 件 | L341: 件 | O341: 1 | P341: 海霸王 | Q341: 金博水产
A342: 水产冻货 | B342: 冻货 | C342: 水煮鱼（佳鹤）2500g*4袋 | D342: 台湾派 | E342: 106 | F342: 19 | G342: =RC[-2]+RC[-1] -> 125 | H342: 5 | I342: =RC[-2]+RC[-1] -> 130 | K342: 件 | L342: 件 | O342: 1 | P342: 海霸王 | Q342: 金博水产
A343: 水产冻货 | B343: 冻货 | C343: 鱼皮脆（佳鹤）2500g*4袋 | D343: 台湾派 | E343: 90 | F343: 15 | G343: =RC[-2]+RC[-1] -> 105 | H343: 5 | I343: =RC[-2]+RC[-1] -> 110 | K343: 件 | L343: 件 | O343: 1 | P343: 海霸王 | Q343: 金博水产
A344: 水产冻货 | B344: 冻货 | C344: 肉燕（佳鹤）2500g*4袋 | D344: 台湾派 | E344: 102 | F344: 18 | G344: =RC[-2]+RC[-1] -> 120 | H344: 5 | I344: =RC[-2]+RC[-1] -> 125 | K344: 件 | L344: 件 | O344: 1 | P344: 海霸王 | Q344: 金博水产
A345: 水产冻货 | B345: 冻货 | C345: 笑脸（佳鹤）2500g*4袋 | D345: 台湾派 | E345: 102 | F345: 18 | G345: =RC[-2]+RC[-1] -> 120 | H345: 5 | I345: =RC[-2]+RC[-1] -> 125 | K345: 件 | L345: 件 | O345: 1 | P345: 海霸王 | Q345: 金博水产
A346: 水产冻货 | B346: 冻货 | C346: 鱼排（佳鹤）2500g*4袋 | D346: 台湾派 | E346: 102 | F346: 18 | G346: =RC[-2]+RC[-1] -> 120 | H346: 5 | I346: =RC[-2]+RC[-1] -> 125 | K346: 件 | L346: 件 | O346: 1 | P346: 海霸王 | Q346: 金博水产
A347: 水产冻货 | B347: 冻货 | C347: 脆花肠（佳鹤）2500g*4袋 | D347: 台湾派 | E347: 110 | F347: 20 | G347: =RC[-2]+RC[-1] -> 130 | H347: 5 | I347: =RC[-2]+RC[-1] -> 135 | K347: 件 | L347: 件 | O347: 1 | P347: 海霸王 | Q347: 金博水产
A348: 水产冻货 | B348: 冻货 | C348: 亲亲肠（佳鹤）2500g*4袋 | D348: 台湾派 | E348: 90 | F348: 15 | G348: =RC[-2]+RC[-1] -> 105 | H348: 5 | I348: =RC[-2]+RC[-1] -> 110 | K348: 件 | L348: 件 | O348: 1 | P348: 海霸王 | Q348: 金博水产
A349: 水产冻货 | B349: 冻货 | C349: 蟹黄棒（佳鹤）2500g*4袋 | D349: 台湾派 | E349: 102 | F349: 18 | G349: =RC[-2]+RC[-1] -> 120 | H349: 5 | I349: =RC[-2]+RC[-1] -> 125 | K349: 件 | L349: 件 | O349: 1 | P349: 海霸王 | Q349: 金博水产
A350: 水产冻货 | B350: 冻货 | C350: 蟹足棒（佳鹤）2500g*4袋 | D350: 台湾派 | E350: 50 | F350: 5 | G350: =RC[-2]+RC[-1] -> 55 | H350: 5 | I350: =RC[-2]+RC[-1] -> 60 | K350: 件 | L350: 件 | O350: 1 | P350: 海霸王 | Q350: 金博水产
A351: 水产冻货 | B351: 冻货 | C351: 鲍鱼片（佳鹤）2500g*4袋 | D351: 台湾派 | E351: 98 | F351: 17 | G351: =RC[-2]+RC[-1] -> 115 | H351: 5 | I351: =RC[-2]+RC[-1] -> 120 | K351: 件 | L351: 件 | O351: 1 | P351: 海霸王 | Q351: 金博水产
A352: 水产冻货 | B352: 冻货 | C352: 龙凤片（佳鹤）2500g*4袋 | D352: 台湾派 | E352: 98 | F352: 17 | G352: =RC[-2]+RC[-1] -> 115 | H352: 5 | I352: =RC[-2]+RC[-1] -> 120 | K352: 件 | L352: 件 | O352: 1 | P352: 海霸王 | Q352: 金博水产
A353: 水产冻货 | B353: 冻货 | C353: 鲨鱼片（佳鹤）2500g*4袋 | D353: 台湾派 | E353: 98 | F353: 17 | G353: =RC[-2]+RC[-1] -> 115 | H353: 5 | I353: =RC[-2]+RC[-1] -> 120 | K353: 件 | L353: 件 | O353: 1 | P353: 海霸王 | Q353: 金博水产
A354: 水产冻货 | B354: 冻货 | C354: 北海翅（佳鹤）2500g*4袋 | D354: 台湾派 | E354: 106 | F354: 19 | G354: =RC[-2]+RC[-1] -> 125 | H354: 5 | I354: =RC[-2]+RC[-1] -> 130 | K354: 件 | L354: 件 | O354: 1 | P354: 海霸王 | Q354: 金博水产
A355: 水产冻货 | B355: 冻货 | C355: 香菇鸡肉丸（佳鹤）1000g*10袋 | D355: 台湾派 | E355: 82 | F355: 13 | G355: =RC[-2]+RC[-1] -> 95 | H355: 5 | I355: =RC[-2]+RC[-1] -> 100 | K355: 件 | L355: 件 | O355: 1 | P355: 海霸王 | Q355: 金博水产
A356: 水产冻货 | B356: 冻货 | C356: 香菇贡丸（佳鹤）2500g*4袋 | D356: 台湾派 | E356: 106 | F356: 19 | G356: =RC[-2]+RC[-1] -> 125 | H356: 5 | I356: =RC[-2]+RC[-1] -> 130 | K356: 件 | L356: 件 | O356: 1 | P356: 海霸王 | Q356: 金博水产
A357: 水产冻货 | B357: 冻货 | C357: 撒尿牛丸（佳鹤）2500g*4袋 | D357: 台湾派 | E357: 90 | F357: 15 | G357: =RC[-2]+RC[-1] -> 105 | H357: 5 | I357: =RC[-2]+RC[-1] -> 110 | K357: 件 | L357: 件 | O357: 1 | P357: 海霸王 | Q357: 金博水产
A358: 水产冻货 | B358: 冻货 | C358: 章鱼丸（佳鹤）2500g*4袋 | D358: 台湾派 | E358: 106 | F358: 19 | G358: =RC[-2]+RC[-1] -> 125 | H358: 5 | I358: =RC[-2]+RC[-1] -> 130 | K358: 件 | L358: 件 | O358: 1 | P358: 海霸王 | Q358: 金博水产
A359: 水产冻货 | B359: 冻货 | C359: 墨鱼丸（佳鹤）2500g*4袋 | D359: 台湾派 | E359: 106 | F359: 19 | G359: =RC[-2]+RC[-1] -> 125 | H359: 5 | I359: =RC[-2]+RC[-1] -> 130 | K359: 件 | L359: 件 | O359: 1 | P359: 海霸王 | Q359: 金博水产
A360: 水产冻货 | B360: 冻货 | C360: 水晶包（佳鹤）2500g*4袋 | D360: 台湾派 | E360: 74 | F360: 11 | G360: =RC[-2]+RC[-1] -> 85 | H360: 5 | I360: =RC[-2]+RC[-1] -> 90 | K360: 件 | L360: 件 | O360: 1 | P360: 海霸王 | Q360: 金博水产
A361: 水产冻货 | B361: 冻货 | C361: 翡翠包（佳鹤）2500g*4袋 | D361: 台湾派 | E361: 74 | F361: 11 | G361: =RC[-2]+RC[-1] -> 85 | H361: 5 | I361: =RC[-2]+RC[-1] -> 90 | K361: 件 | L361: 件 | O361: 1 | P361: 海霸王 | Q361: 金博水产
A362: 水产冻货 | B362: 冻货 | C362: 雪花培根（海暘）1500g*10袋 | E362: 148 | F362: 4 | G362: =RC[-2]+RC[-1] -> 152 | H362: 3 | I362: =RC[-2]+RC[-1] -> 155 | K362: 件 | L362: 件 | O362: 1 | P362: 海霸王 | Q362: 金博水产
A363: 水产冻货 | B363: 冻货 | C363: 雪花培根（海暘）1500g*8袋 | E363: 174 | F363: 3 | G363: =RC[-2]+RC[-1] -> 177 | H363: 3 | I363: =RC[-2]+RC[-1] -> 180 | K363: 件 | L363: 件 | O363: 1 | P363: 海霸王 | Q363: 金博水产
A364: 水产冻货 | B364: 冻货 | C364: 雪花培根（海暘）180g*40袋 | E364: 165 | F364: 2 | G364: =RC[-2]+RC[-1] -> 167 | H364: 3 | I364: =RC[-2]+RC[-1] -> 170 | K364: 件 | L364: 件 | O364: 1 | P364: 海霸王 | Q364: 金博水产
A365: 水产冻货 | B365: 冻货 | C365: 雪花培根（海暘）500g*20袋 | E365: 164 | F365: 3 | G365: =RC[-2]+RC[-1] -> 167 | H365: 3 | I365: =RC[-2]+RC[-1] -> 170 | K365: 件 | L365: 件 | O365: 1 | P365: 海霸王 | Q365: 金博水产
A366: 水产冻货 | B366: 冻货 | C366: 雪花扒25g（海暘）l000g*10袋 | E366: 222 | F366: 8 | G366: =RC[-2]+RC[-1] -> 230 | H366: 5 | I366: =RC[-2]+RC[-1] -> 235 | K366: 件 | L366: 件 | O366: 1 | P366: 海霸王 | Q366: 金博水产
A367: 水产冻货 | B367: 冻货 | C367: 雪鱼扒50g（海暘）l000g*10袋 | E367: 222 | F367: 8 | G367: =RC[-2]+RC[-1] -> 230 | H367: 5 | I367: =RC[-2]+RC[-1] -> 235 | K367: 件 | L367: 件 | O367: 1 | P367: 海霸王 | Q367: 金博水产
A368: 水产冻货 | B368: 冻货 | C368: 雪花扒25g（海暘）500g*12袋 | E368: 186 | F368: 3 | G368: =RC[-2]+RC[-1] -> 189 | H368: 3 | I368: =RC[-2]+RC[-1] -> 192 | K368: 件 | L368: 件 | O368: 1 | P368: 海霸王 | Q368: 金博水产
A369: 水产冻货 | B369: 冻货 | C369: 雪鱼扒50g（海暘）500g*12袋 | E369: 186 | F369: 3 | G369: =RC[-2]+RC[-1] -> 189 | H369: 3 | I369: =RC[-2]+RC[-1] -> 192 | K369: 件 | L369: 件 | O369: 1 | P369: 海霸王 | Q369: 金博水产
A370: 水产冻货 | B370: 冻货 | C370: 牛肉扒（海洋）lOOOg*10袋 | E370: 222 | F370: 8 | G370: =RC[-2]+RC[-1] -> 230 | H370: 5 | I370: =RC[-2]+RC[-1] -> 235 | K370: 件 | L370: 件 | O370: 1 | P370: 海霸王 | Q370: 金博水产
A371: 水产冻货 | B371: 冻货 | C371: 海醇培根（海洋）lOOOg*10袋 | E371: 174 | F371: 1 | G371: =RC[-2]+RC[-1] -> 175 | H371: 2 | I371: =RC[-2]+RC[-1] -> 177 | K371: 件 | L371: 件 | O371: 1 | P371: 海霸王 | Q371: 金博水产
A372: 水产冻货 | B372: 冻货 | C372: 海醇培根（海洋）1500g*8袋 | E372: 198 | F372: 1 | G372: =RC[-2]+RC[-1] -> 199 | H372: 2 | I372: =RC[-2]+RC[-1] -> 201 | K372: 件 | L372: 件 | O372: 1 | P372: 海霸王 | Q372: 金博水产
A373: 水产冻货 | B373: 冻货 | C373: 翡翠龙虾球（海洋）2500g*4袋 | E373: 142 | F373: 1 | G373: =RC[-2]+RC[-1] -> 143 | H373: 2 | I373: =RC[-2]+RC[-1] -> 145 | K373: 件 | L373: 件 | O373: 1 | P373: 海霸王 | Q373: 金博水产
A374: 水产冻货 | B374: 冻货 | C374: 海醇包心鱼丸（海洋）2500g*4袋 | E374: 127 | F374: 1 | G374: =RC[-2]+RC[-1] -> 128 | H374: 2 | I374: =RC[-2]+RC[-1] -> 130 | K374: 件 | L374: 件 | O374: 1 | P374: 海霸王 | Q374: 金博水产
A375: 水产冻货 | B375: 冻货 | C375: 鱼肉卷 淡水丸（海洋）2500g*4袋 | E375: 102 | F375: 1 | G375: =RC[-2]+RC[-1] -> 103 | H375: 2 | I375: =RC[-2]+RC[-1] -> 105 | K375: 件 | L375: 件 | O375: 1 | P375: 海霸王 | Q375: 金博水产
A376: 水产冻货 | B376: 冻货 | C376: 爆汁鱼豆捞（海洋）2500g*4袋 | E376: 137 | F376: 1 | G376: =RC[-2]+RC[-1] -> 138 | H376: 2 | I376: =RC[-2]+RC[-1] -> 140 | K376: 件 | L376: 件 | O376: 1 | P376: 海霸王 | Q376: 金博水产
A377: 水产冻货 | B377: 冻货 | C377: 培根热狗45g（海洋）2500g*4袋 | E377: 122 | F377: 4 | G377: =RC[-2]+RC[-1] -> 126 | H377: 4 | I377: =RC[-2]+RC[-1] -> 130 | K377: 件 | L377: 件 | O377: 1 | P377: 海霸王 | Q377: 金博水产
A378: 水产冻货 | B378: 冻货 | C378: 海醇热狗38g（海洋）2500g*4袋 | E378: 107 | F378: 4 | G378: =RC[-2]+RC[-1] -> 111 | H378: 4 | I378: =RC[-2]+RC[-1] -> 115 | K378: 件 | L378: 件 | O378: 1 | P378: 海霸王 | Q378: 金博水产
A379: 水产冻货 | B379: 冻货 | C379: 海醇热狗38g（海洋）2500g*6袋 | E379: 157 | F379: 4 | G379: =RC[-2]+RC[-1] -> 161 | H379: 4 | I379: =RC[-2]+RC[-1] -> 165 | K379: 件 | L379: 件 | O379: 1 | P379: 海霸王 | Q379: 金博水产
A380: 水产冻货 | B380: 冻货 | C380: 美式热狗38g（海洋）1900g*6袋 | E380: 127 | F380: 4 | G380: =RC[-2]+RC[-1] -> 131 | H380: 4 | I380: =RC[-2]+RC[-1] -> 135 | K380: 件 | L380: 件 | O380: 1 | P380: 海霸王 | Q380: 金博水产
A381: 水产冻货 | B381: 冻货 | C381: 玉米肠（海洋）2500g*4袋 | E381: 147 | F381: 4 | G381: =RC[-2]+RC[-1] -> 151 | H381: 4 | I381: =RC[-2]+RC[-1] -> 155 | K381: 件 | L381: 件 | O381: 1 | P381: 海霸王 | Q381: 金博水产
A382: 水产冻货 | B382: 冻货 | C382: 海醇波波肠（海洋）2500g*4袋 | E382: 127 | F382: 4 | G382: =RC[-2]+RC[-1] -> 131 | H382: 4 | I382: =RC[-2]+RC[-1] -> 135 | K382: 件 | L382: 件 | O382: 1 | P382: 海霸王 | Q382: 金博水产
A383: 水产冻货 | B383: 冻货 | C383: 肘花卷（海洋）2500g*4袋 | E383: 120 | F383: 0 | G383: =RC[-2]+RC[-1] -> 120 | H383: 1 | I383: =RC[-2]+RC[-1] -> 121 | K383: 件 | L383: 件 | O383: 1 | P383: 海霸王 | Q383: 金博水产
A384: 水产冻货 | B384: 冻货 | C384: 鱼皮脆（安井）lkg*6袋 | E384: 68 | F384: 2 | G384: =RC[-2]+RC[-1] -> 70 | H384: 2 | I384: =RC[-2]+RC[-1] -> 72 | K384: 件 | L384: 件 | O384: 1 | P384: 海霸王 | Q384: 金博水产
A385: 水产冻货 | B385: 冻货 | C385: 太湖燕饺（安井）lkg*10袋 | E385: 105 | F385: 1 | G385: =RC[-2]+RC[-1] -> 106 | H385: 2 | I385: =RC[-2]+RC[-1] -> 108 | K385: 件 | L385: 件 | O385: 1 | P385: 海霸王 | Q385: 金博水产
A386: 水产冻货 | B386: 冻货 | C386: 迷你燕饺（安井）2.5kg*4袋 | E386: 105 | F386: 1 | G386: =RC[-2]+RC[-1] -> 106 | H386: 2 | I386: =RC[-2]+RC[-1] -> 108 | K386: 件 | L386: 件 | O386: 1 | P386: 海霸王 | Q386: 金博水产
A387: 水产冻货 | B387: 冻货 | C387: 霞迷饺（安井）2.5kg*4袋 | E387: 105 | F387: 1 | G387: =RC[-2]+RC[-1] -> 106 | H387: 2 | I387: =RC[-2]+RC[-1] -> 108 | K387: 件 | L387: 件 | O387: 1 | P387: 海霸王 | Q387: 金博水产
A388: 水产冻货 | B388: 冻货 | C388: 撒尿牛丸（安井）500g*20袋 | E388: 170 | F388: 3 | G388: =RC[-2]+RC[-1] -> 173 | H388: 4 | I388: =RC[-2]+RC[-1] -> 177 | K388: 件 | L388: 件 | O388: 1 | P388: 海霸王 | Q388: 金博水产
A389: 水产冻货 | B389: 冻货 | C389: 水晶包（安井）2.5kg*4袋 | E389: 110 | F389: 3 | G389: =RC[-2]+RC[-1] -> 113 | H389: 4 | I389: =RC[-2]+RC[-1] -> 117 | K389: 件 | L389: 件 | O389: 1 | P389: 海霸王 | Q389: 金博水产
A390: 水产冻货 | B390: 冻货 | C390: 福州鱼丸（安井）2.5kg*4袋 | E390: 127 | F390: 4 | G390: =RC[-2]+RC[-1] -> 131 | H390: 4 | I390: =RC[-2]+RC[-1] -> 135 | K390: 件 | L390: 件 | O390: 1 | P390: 海霸王 | Q390: 金博水产
A391: 水产冻货 | B391: 冻货 | C391: 火锅饺（安井）2.5kg*4袋 | E391: 105 | F391: 5 | G391: =RC[-2]+RC[-1] -> 110 | H391: 5 | I391: =RC[-2]+RC[-1] -> 115 | K391: 件 | L391: 件 | O391: 1 | P391: 海霸王 | Q391: 金博水产
A392: 水产冻货 | B392: 冻货 | C392: 鱼豆腐（安井）2.5kg*4袋 | E392: 137 | F392: 1 | G392: =RC[-2]+RC[-1] -> 138 | H392: 2 | I392: =RC[-2]+RC[-1] -> 140 | K392: 件 | L392: 件 | O392: 1 | P392: 海霸王 | Q392: 金博水产
A393: 水产冻货 | B393: 冻货 | C393: 切片千夜豆腐（安井）2.5kg*4袋 | E393: 70 | F393: 2 | G393: =RC[-2]+RC[-1] -> 72 | H393: 3 | I393: =RC[-2]+RC[-1] -> 75 | K393: 件 | L393: 件 | O393: 1 | P393: 海霸王 | Q393: 金博水产
A394: 水产冻货 | B394: 冻货 | C394: 包心鱼卷（安井）2.5kg*4袋 | E394: 125 | F394: 1 | G394: =RC[-2]+RC[-1] -> 126 | H394: 2 | I394: =RC[-2]+RC[-1] -> 128 | K394: 件 | L394: 件 | O394: 1 | P394: 海霸王 | Q394: 金博水产
A395: 水产冻货 | B395: 冻货 | C395: 夹心蟹排（安井）2.5kg*4袋 | E395: 115 | F395: 2 | G395: =RC[-2]+RC[-1] -> 117 | H395: 3 | I395: =RC[-2]+RC[-1] -> 120 | K395: 件 | L395: 件 | O395: 1 | P395: 海霸王 | Q395: 金博水产
A396: 水产冻货 | B396: 冻货 | C396: 夹心鱼排（安井）2.5kg*4袋 | E396: 100 | F396: 2 | G396: =RC[-2]+RC[-1] -> 102 | H396: 3 | I396: =RC[-2]+RC[-1] -> 105 | K396: 件 | L396: 件 | O396: 1 | P396: 海霸王 | Q396: 金博水产
A397: 水产冻货 | B397: 冻货 | C397: 夹心脆排（安井）2.5kg*4袋 | E397: 100 | F397: 2 | G397: =RC[-2]+RC[-1] -> 102 | H397: 3 | I397: =RC[-2]+RC[-1] -> 105 | K397: 件 | L397: 件 | O397: 1 | P397: 海霸王 | Q397: 金博水产
A398: 水产冻货 | B398: 冻货 | C398: 闽南香肉（安井）2.5kg*4袋 | E398: 128 | F398: 3 | G398: =RC[-2]+RC[-1] -> 131 | H398: 4 | I398: =RC[-2]+RC[-1] -> 135 | K398: 件 | L398: 件 | O398: 1 | P398: 海霸王 | Q398: 金博水产
A399: 水产冻货 | B399: 冻货 | C399: 手抓饺（安井）2.25kg*4袋 | E399: 100 | F399: 2 | G399: =RC[-2]+RC[-1] -> 102 | H399: 3 | I399: =RC[-2]+RC[-1] -> 105 | K399: 件 | L399: 件 | O399: 1 | P399: 海霸王 | Q399: 金博水产
A400: 水产冻货 | B400: 冻货 | C400: 金瓜卤肉包（安井）2.5kg*4袋 | E400: 112 | F400: 7 | G400: =RC[-2]+RC[-1] -> 119 | H400: 8 | I400: =RC[-2]+RC[-1] -> 127 | K400: 件 | L400: 件 | O400: 1 | P400: 海霸王 | Q400: 金博水产
A401: 水产冻货 | B401: 冻货 | C401: 虾味饺（味过胶套）（海霸王）lOOg*30盒 | E401: 80 | F401: 1 | G401: =RC[-2]+RC[-1] -> 81 | H401: 1 | I401: =RC[-2]+RC[-1] -> 82 | K401: 件 | L401: 件 | O401: 1 | P401: 海霸王 | Q401: 金博水产
A402: 水产冻货 | B402: 冻货 | C402: 虾迷饺（海霸王）2.5kg*4袋 | E402: 100 | F402: 2 | G402: =RC[-2]+RC[-1] -> 102 | H402: 3 | I402: =RC[-2]+RC[-1] -> 105 | K402: 件 | L402: 件 | O402: 1 | P402: 海霸王 | Q402: 金博水产
A403: 水产冻货 | B403: 冻货 | C403: 香芹虾味脆饺（海霸王）1.5kg*4袋 | E403: 88 | F403: 1 | G403: =RC[-2]+RC[-1] -> 89 | H403: 1 | I403: =RC[-2]+RC[-1] -> 90 | K403: 件 | L403: 件 | O403: 1 | P403: 海霸王 | Q403: 金博水产
A404: 水产冻货 | B404: 冻货 | C404: 菌菇燕味脆饺（海霸王）1.5kg*4袋 | E404: 88 | F404: 1 | G404: =RC[-2]+RC[-1] -> 89 | H404: 1 | I404: =RC[-2]+RC[-1] -> 90 | K404: 件 | L404: 件 | O404: 1 | P404: 海霸王 | Q404: 金博水产
A405: 水产冻货 | B405: 冻货 | C405: 马蹄蟹味脆饺（海霸王）1.5kg*4袋 | E405: 88 | F405: 1 | G405: =RC[-2]+RC[-1] -> 89 | H405: 1 | I405: =RC[-2]+RC[-1] -> 90 | K405: 件 | L405: 件 | O405: 1 | P405: 海霸王 | Q405: 金博水产
A406: 水产冻货 | B406: 冻货 | C406: 鲜虾脆（海霸王）1.5kg*4袋 | E406: 70 | F406: 1 | G406: =RC[-2]+RC[-1] -> 71 | H406: 1 | I406: =RC[-2]+RC[-1] -> 72 | K406: 件 | L406: 件 | O406: 1 | P406: 海霸王 | Q406: 金博水产
A407: 水产冻货 | B407: 冻货 | C407: 霸王脆（海霸王）1.5kg*4袋 | E407: 70 | F407: 1 | G407: =RC[-2]+RC[-1] -> 71 | H407: 1 | I407: =RC[-2]+RC[-1] -> 72 | K407: 件 | L407: 件 | O407: 1 | P407: 海霸王 | Q407: 金博水产
A408: 水产冻货 | B408: 冻货 | C408: 香菇脆饺（海霸王）2.5kg*4袋 | E408: 126 | F408: 2 | G408: =RC[-2]+RC[-1] -> 128 | H408: 2 | I408: =RC[-2]+RC[-1] -> 130 | K408: 件 | L408: 件 | O408: 1 | P408: 海霸王 | Q408: 金博水产
A409: 水产冻货 | B409: 冻货 | C409: 玉米虾味脆饺（海霸王）2.5kg*4袋 | E409: 126 | F409: 2 | G409: =RC[-2]+RC[-1] -> 128 | H409: 2 | I409: =RC[-2]+RC[-1] -> 130 | K409: 件 | L409: 件 | O409: 1 | P409: 海霸王 | Q409: 金博水产
A410: 水产冻货 | B410: 冻货 | C410: 蟹味脆饺（海霸王）2.5kg*4袋 | E410: 126 | F410: 2 | G410: =RC[-2]+RC[-1] -> 128 | H410: 2 | I410: =RC[-2]+RC[-1] -> 130 | K410: 件 | L410: 件 | O410: 1 | P410: 海霸王 | Q410: 金博水产
A411: 水产冻货 | B411: 冻货 | C411: 虾米一口脆（海霸王）2.5kg*4袋 | E411: 140 | F411: 1 | G411: =RC[-2]+RC[-1] -> 141 | H411: 1 | I411: =RC[-2]+RC[-1] -> 142 | K411: 件 | L411: 件 | O411: 1 | P411: 海霸王 | Q411: 金博水产
A412: 水产冻货 | B412: 冻货 | C412: 经典撒尿牛丸（海霸王）2.5kg*4袋 | E412: 175 | F412: 2 | G412: =RC[-2]+RC[-1] -> 177 | H412: 3 | I412: =RC[-2]+RC[-1] -> 180 | K412: 件 | L412: 件 | O412: 1 | P412: 海霸王 | Q412: 金博水产
A413: 水产冻货 | B413: 冻货 | C413: 鱼排（海霸王）2kg*6袋 | E413: 115 | F413: 2 | G413: =RC[-2]+RC[-1] -> 117 | H413: 3 | I413: =RC[-2]+RC[-1] -> 120 | K413: 件 | L413: 件 | O413: 1 | P413: 海霸王 | Q413: 金博水产
A414: 水产冻货 | B414: 冻货 | C414: 原味香肠（海霸王）1.5*8袋 | E414: 170 | F414: 3 | G414: =RC[-2]+RC[-1] -> 173 | H414: 4 | I414: =RC[-2]+RC[-1] -> 177 | K414: 件 | L414: 件 | O414: 1 | P414: 海霸王 | Q414: 金博水产
A415: 水产冻货 | B415: 冻货 | C415: 开花脆皮肠（海霸王）800g*10袋 | E415: 130 | F415: 2 | G415: =RC[-2]+RC[-1] -> 132 | H415: 3 | I415: =RC[-2]+RC[-1] -> 135 | K415: 件 | L415: 件 | O415: 1 | P415: 海霸王 | Q415: 金博水产
A416: 水产冻货 | B416: 冻货 | C416: 台湾肉板（海霸王）2.5kg*4袋 | E416: 130 | F416: 2 | G416: =RC[-2]+RC[-1] -> 132 | H416: 3 | I416: =RC[-2]+RC[-1] -> 135 | K416: 件 | L416: 件 | O416: 1 | P416: 海霸王 | Q416: 金博水产
A417: 水产冻货 | B417: 冻货 | C417: 水晶包（海霸王）2.5kg*4袋 | E417: 116 | F417: 2 | G417: =RC[-2]+RC[-1] -> 118 | H417: 2 | I417: =RC[-2]+RC[-1] -> 120 | K417: 件 | L417: 件 | O417: 1 | P417: 海霸王 | Q417: 金博水产
A418: 水产冻货 | B418: 冻货 | C418: 翡翠卤肉包（海霸王）2.5kg*4袋 | E418: 116 | F418: 2 | G418: =RC[-2]+RC[-1] -> 118 | H418: 2 | I418: =RC[-2]+RC[-1] -> 120 | K418: 件 | L418: 件 | O418: 1 | P418: 海霸王 | Q418: 金博水产
A419: 水产冻货 | B419: 冻货 | C419: 蟹味棒（海霸王）2.5kg*4袋 | E419: 125 | F419: 2 | G419: =RC[-2]+RC[-1] -> 127 | H419: 3 | I419: =RC[-2]+RC[-1] -> 130 | K419: 件 | L419: 件 | O419: 1 | P419: 海霸王 | Q419: 金博水产
A420: 水产冻货 | B420: 冻货 | C420: 味之霸道笋花2.5kg*4袋 | E420: 145 | F420: 2 | G420: =RC[-2]+RC[-1] -> 147 | H420: 3 | I420: =RC[-2]+RC[-1] -> 150 | K420: 件 | L420: 件 | O420: 1 | P420: 海霸王 | Q420: 金博水产
A421: 水产冻货 | B421: 冻货 | C421: 味之霸道笋片2.5kg*4袋 | E421: 160 | F421: 5 | G421: =RC[-2]+RC[-1] -> 165 | H421: 5 | I421: =RC[-2]+RC[-1] -> 170 | K421: 件 | L421: 件 | O421: 1 | P421: 海霸王 | Q421: 金博水产
A422: 水产冻货 | B422: 冻货 | C422: 味之霸道方竹笋皮500g*20袋 | E422: 80 | F422: 2 | G422: =RC[-2]+RC[-1] -> 82 | H422: 3 | I422: =RC[-2]+RC[-1] -> 85 | K422: 件 | L422: 件 | O422: 1 | P422: 海霸王 | Q422: 金博水产
A423: 水产冻货 | B423: 冻货 | C423: 好人家 花生汤圆 495g*20袋 | E423: 65 | F423: 2 | G423: =RC[-2]+RC[-1] -> 67 | H423: 3 | I423: =RC[-2]+RC[-1] -> 70 | K423: 件 | L423: 件 | O423: 1 | P423: 海霸王 | Q423: 金博水产
A424: 水产冻货 | B424: 冻货 | C424: 好人家 芝麻汤圆 495g*20袋 | E424: 65 | F424: 2 | G424: =RC[-2]+RC[-1] -> 67 | H424: 3 | I424: =RC[-2]+RC[-1] -> 70 | K424: 件 | L424: 件 | O424: 1 | P424: 海霸王 | Q424: 金博水产
A425: 水产冻货 | B425: 冻货 | C425: 好人家 珍珠汤圆 495g*20袋 | E425: 65 | F425: 2 | G425: =RC[-2]+RC[-1] -> 67 | H425: 3 | I425: =RC[-2]+RC[-1] -> 70 | K425: 件 | L425: 件 | O425: 1 | P425: 海霸王 | Q425: 金博水产
A426: 水产冻货 | B426: 冻货 | C426: 好人家 水饺 495g*20袋 | E426: 65 | F426: 2 | G426: =RC[-2]+RC[-1] -> 67 | H426: 3 | I426: =RC[-2]+RC[-1] -> 70 | K426: 件 | L426: 件 | O426: 1 | P426: 海霸王 | Q426: 金博水产
A427: 水产冻货 | B427: 冻货 | C427: 好人家 芝麻汤圆 400g*20袋 | E427: 55 | F427: 2 | G427: =RC[-2]+RC[-1] -> 57 | H427: 3 | I427: =RC[-2]+RC[-1] -> 60 | K427: 件 | L427: 件 | O427: 1 | P427: 海霸王 | Q427: 金博水产
A428: 水产冻货 | B428: 冻货 | C428: 好人家 珍珠汤圆 400g*20袋 | E428: 55 | F428: 2 | G428: =RC[-2]+RC[-1] -> 57 | H428: 3 | I428: =RC[-2]+RC[-1] -> 60 | K428: 件 | L428: 件 | O428: 1 | P428: 海霸王 | Q428: 金博水产
A429: 水产冻货 | B429: 冻货 | C429: 好人家 水饺 2.5kg*4袋 | E429: 65 | F429: 2 | G429: =RC[-2]+RC[-1] -> 67 | H429: 3 | I429: =RC[-2]+RC[-1] -> 70 | K429: 件 | L429: 件 | O429: 1 | P429: 海霸王 | Q429: 金博水产
A430: 水产冻货 | B430: 冻货 | C430: 好人家 芝麻汤圆 2.5kg*4袋 | E430: 65 | F430: 2 | G430: =RC[-2]+RC[-1] -> 67 | H430: 3 | I430: =RC[-2]+RC[-1] -> 70 | K430: 件 | L430: 件 | O430: 1 | P430: 海霸王 | Q430: 金博水产
A431: 水产冻货 | B431: 冻货 | C431: 好人家 花生汤圆 2.5kg*4袋 | E431: 65 | F431: 2 | G431: =RC[-2]+RC[-1] -> 67 | H431: 3 | I431: =RC[-2]+RC[-1] -> 70 | K431: 件 | L431: 件 | O431: 1 | P431: 海霸王 | Q431: 金博水产
A432: 水产冻货 | B432: 冻货 | C432: 好人家 大奇珍珠汤圆 2.5kg*4袋 | E432: 80 | F432: 2 | G432: =RC[-2]+RC[-1] -> 82 | H432: 3 | I432: =RC[-2]+RC[-1] -> 85 | K432: 件 | L432: 件 | O432: 1 | P432: 海霸王 | Q432: 金博水产
A433: 水产冻货 | B433: 冻货 | C433: 享口福 香芋地瓜丸 1*10袋 | E433: 42 | F433: 1 | G433: =RC[-2]+RC[-1] -> 43 | H433: 2 | I433: =RC[-2]+RC[-1] -> 45 | K433: 件 | L433: 件 | O433: 1 | P433: 海霸王 | Q433: 金博水产
A434: 水产冻货 | B434: 冻货 | C434: 享口福 荷叶夹 1*16袋 | E434: 42 | F434: 1 | G434: =RC[-2]+RC[-1] -> 43 | H434: 2 | I434: =RC[-2]+RC[-1] -> 45 | K434: 件 | L434: 件 | O434: 1 | P434: 海霸王 | Q434: 金博水产
A435: 水产冻货 | B435: 冻货 | C435: 享口福 菠萝卷 1*20袋 | E435: 52 | F435: 1 | G435: =RC[-2]+RC[-1] -> 53 | H435: 2 | I435: =RC[-2]+RC[-1] -> 55 | K435: 件 | L435: 件 | O435: 1 | P435: 海霸王 | Q435: 金博水产
A436: 水产冻货 | B436: 冻货 | C436: 享口福 香芋卷 1*20袋 | E436: 52 | F436: 1 | G436: =RC[-2]+RC[-1] -> 53 | H436: 2 | I436: =RC[-2]+RC[-1] -> 55 | K436: 件 | L436: 件 | O436: 1 | P436: 海霸王 | Q436: 金博水产
A437: 水产冻货 | B437: 冻货 | C437: 享口福 豆沙包 1*24袋 | E437: 50 | F437: 1 | G437: =RC[-2]+RC[-1] -> 51 | H437: 2 | I437: =RC[-2]+RC[-1] -> 53 | K437: 件 | L437: 件 | O437: 1 | P437: 海霸王 | Q437: 金博水产
A438: 水产冻货 | B438: 冻货 | C438: 享口福 馒头 1*24袋 | E438: 34 | F438: 0 | G438: =RC[-2]+RC[-1] -> 34 | H438: 1 | I438: =RC[-2]+RC[-1] -> 35 | K438: 件 | L438: 件 | O438: 1 | P438: 海霸王 | Q438: 金博水产
A439: 水产冻货 | B439: 冻货 | C439: 享口福 玉米酥 1*20袋 | E439: 78 | F439: 1 | G439: =RC[-2]+RC[-1] -> 79 | H439: 1 | I439: =RC[-2]+RC[-1] -> 80 | K439: 件 | L439: 件 | O439: 1 | P439: 海霸王 | Q439: 金博水产
A440: 水产冻货 | B440: 冻货 | C440: 享口福 绿茶佛饼 1*20袋 | E440: 105 | F440: 2 | G440: =RC[-2]+RC[-1] -> 107 | H440: 3 | I440: =RC[-2]+RC[-1] -> 110 | K440: 件 | L440: 件 | O440: 1 | P440: 海霸王 | Q440: 金博水产
A441: 水产冻货 | B441: 冻货 | C441: 享口福 杂粮窝窝头（玉米） 1*20袋 | E441: 38 | F441: 2 | G441: =RC[-2]+RC[-1] -> 40 | H441: 3 | I441: =RC[-2]+RC[-1] -> 43 | K441: 件 | L441: 件 | O441: 1 | P441: 海霸王 | Q441: 金博水产
A442: 水产冻货 | B442: 冻货 | C442: 享口福 油炸冰激凌 1*10袋 | E442: 52 | F442: 1 | G442: =RC[-2]+RC[-1] -> 53 | H442: 2 | I442: =RC[-2]+RC[-1] -> 55 | K442: 件 | L442: 件 | O442: 1 | P442: 海霸王 | Q442: 金博水产
A443: 水产冻货 | B443: 冻货 | C443: 享口福 红糖锅盔 1*16袋 | E443: 73 | F443: 1 | G443: =RC[-2]+RC[-1] -> 74 | H443: 1 | I443: =RC[-2]+RC[-1] -> 75 | K443: 件 | L443: 件 | O443: 1 | P443: 海霸王 | Q443: 金博水产
A444: 水产冻货 | B444: 冻货 | C444: 享口福 日式芙蓉虾 1*15袋 | E444: 90 | F444: 2 | G444: =RC[-2]+RC[-1] -> 92 | H444: 3 | I444: =RC[-2]+RC[-1] -> 95 | K444: 件 | L444: 件 | O444: 1 | P444: 海霸王 | Q444: 金博水产
A445: 水产冻货 | B445: 冻货 | C445: 享口福 南瓜饼 1*20袋 | E445: 28 | F445: 2 | G445: =RC[-2]+RC[-1] -> 30 | H445: 3 | I445: =RC[-2]+RC[-1] -> 33 | K445: 件 | L445: 件 | O445: 1 | P445: 海霸王 | Q445: 金博水产
A446: 水产冻货 | B446: 冻货 | C446: 享口福 牛蛙 1*20斤 | E446: 130 | F446: 10 | G446: =RC[-2]+RC[-1] -> 140 | H446: 5 | I446: =RC[-2]+RC[-1] -> 145 | K446: 件 | L446: 件 | O446: 1 | P446: 海霸王 | Q446: 金博水产
A447: 水产冻货 | B447: 冻货 | C447: 享口福 黄金鸡柳 1*18袋 | E447: 90 | F447: 2 | G447: =RC[-2]+RC[-1] -> 92 | H447: 3 | I447: =RC[-2]+RC[-1] -> 95 | K447: 件 | L447: 件 | O447: 1 | P447: 海霸王 | Q447: 金博水产
A448: 水产冻货 | B448: 冻货 | C448: 享口福 薯条 1*6袋 | E448: 100 | F448: 6 | G448: =RC[-2]+RC[-1] -> 106 | H448: 6 | I448: =RC[-2]+RC[-1] -> 112 | K448: 件 | L448: 件 | O448: 1 | P448: 海霸王 | Q448: 金博水产
A449: 水产冻货 | B449: 冻货 | C449: 享口福 鸡肉丸 2.5kg*4袋 | E449: 48 | F449: 2 | G449: =RC[-2]+RC[-1] -> 50 | H449: 3 | I449: =RC[-2]+RC[-1] -> 53 | K449: 件 | L449: 件 | O449: 1 | P449: 海霸王 | Q449: 金博水产
A450: 水产冻货 | B450: 冻货 | C450: 享口福 鱼肉丸 2.5kg*4袋 | E450: 48 | F450: 2 | G450: =RC[-2]+RC[-1] -> 50 | H450: 3 | I450: =RC[-2]+RC[-1] -> 53 | K450: 件 | L450: 件 | O450: 1 | P450: 海霸王 | Q450: 金博水产
A451: 水产冻货 | B451: 冻货 | C451: 享口福 牛肉丸 2.5kg*4袋 | E451: 48 | F451: 2 | G451: =RC[-2]+RC[-1] -> 50 | H451: 3 | I451: =RC[-2]+RC[-1] -> 53 | K451: 件 | L451: 件 | O451: 1 | P451: 海霸王 | Q451: 金博水产
A452: 水产冻货 | B452: 冻货 | C452: 享口福 猪肉丸 2.5kg*4袋 | E452: 48 | F452: 2 | G452: =RC[-2]+RC[-1] -> 50 | H452: 3 | I452: =RC[-2]+RC[-1] -> 53 | K452: 件 | L452: 件 | O452: 1 | P452: 海霸王 | Q452: 金博水产
A453: 水产冻货 | B453: 冻货 | C453: 火锅川粉 168g*60袋 | E453: 110 | F453: 5 | G453: =RC[-2]+RC[-1] -> 115 | H453: 5 | I453: =RC[-2]+RC[-1] -> 120 | K453: 件 | L453: 件 | O453: 1 | P453: 海霸王 | Q453: 金博水产
A454: 水产冻货 | B454: 冻货 | C454: 紫薯粉 180g*40袋 | E454: 135 | F454: 5 | G454: =RC[-2]+RC[-1] -> 140 | H454: 5 | I454: =RC[-2]+RC[-1] -> 145 | K454: 件 | L454: 件 | O454: 1 | P454: 海霸王 | Q454: 金博水产
A455: 水产冻货 | B455: 冻货 | C455: 土豆粉 360g*50袋 | E455: 52 | F455: 1 | G455: =RC[-2]+RC[-1] -> 53 | H455: 2 | I455: =RC[-2]+RC[-1] -> 55 | K455: 件 | L455: 件 | O455: 1 | P455: 海霸王 | Q455: 金博水产
A456: 水产冻货 | B456: 冻货 | C456: 散火锅粉 20kg | E456: 95 | F456: 2 | G456: =RC[-2]+RC[-1] -> 97 | H456: 3 | I456: =RC[-2]+RC[-1] -> 100 | K456: 件 | L456: 件 | O456: 1 | P456: 海霸王 | Q456: 金博水产
A457: 水产冻货 | B457: 冻货 | C457: 锦福鲜 脆皮肠 650g*10袋 | E457: 115 | F457: 2 | G457: =RC[-2]+RC[-1] -> 117 | H457: 3 | I457: =RC[-2]+RC[-1] -> 120 | K457: 件 | L457: 件 | O457: 1 | P457: 海霸王 | Q457: 金博水产
A458: 水产冻货 | B458: 冻货 | C458: 锦福鲜 脆皮肠 350g*20袋 | E458: 120 | F458: 2 | G458: =RC[-2]+RC[-1] -> 122 | H458: 3 | I458: =RC[-2]+RC[-1] -> 125 | K458: 件 | L458: 件 | O458: 1 | P458: 海霸王 | Q458: 金博水产
A459: 水产冻货 | B459: 冻货 | C459: 锦福鲜 脆皮肠 170g*10袋 | E459: 67 | F459: 4 | G459: =RC[-2]+RC[-1] -> 71 | H459: 4 | I459: =RC[-2]+RC[-1] -> 75 | K459: 件 | L459: 件 | O459: 1 | P459: 海霸王 | Q459: 金博水产
A460: 调料干货 | B460: 调味品 | C460: 黑胡椒粉 散装 | G460: =RC[-2]+RC[-1] -> 0 | I460: =RC[-2]+RC[-1] -> 0 | J460: 500.00000000 | K460: 斤 | L460: 斤 | M460: 200164400000 | N460: 1644 | O460: 1
A461: 调料干货 | B461: 调味品 | C461: 香油/芝麻调和油（建华）千春牌 25kg | G461: =RC[-2]+RC[-1] -> 0 | I461: =RC[-2]+RC[-1] -> 0 | J461: 25.00000000 | K461: 桶 | L461: 桶 | M461: 200164100000 | N461: 1641 | O461: 1
A462: 调料干货 | B462: 调味品 | C462: 香油/芝麻调和油（建华）80ml | D462: 120瓶/件，火锅油碟专用 | G462: =RC[-2]+RC[-1] -> 0 | I462: =RC[-2]+RC[-1] -> 0 | J462: 80.00000000 | K462: 件 | L462: 件 | M462: 200163800000 | N462: 1638 | O462: 1
A463: 调料干货 | B463: 调味品 | C463: 香油/芝麻调和油（建华）5L | G463: =RC[-2]+RC[-1] -> 0 | I463: =RC[-2]+RC[-1] -> 0 | J463: 5.00000000 | K463: 桶 | L463: 桶 | M463: 200163900000 | N463: 1639 | O463: 1
A464: 调料干货 | B464: 调味品 | C464: 香油/芝麻调和油（建华）25kg | G464: =RC[-2]+RC[-1] -> 0 | I464: =RC[-2]+RC[-1] -> 0 | J464: 25.00000000 | K464: 桶 | L464: 桶 | M464: 200164000000 | N464: 1640 | O464: 1
A465: 调料干货 | B465: 调味品 | C465: 青花椒面 | G465: =RC[-2]+RC[-1] -> 0 | I465: =RC[-2]+RC[-1] -> 0 | J465: 500.00000000 | K465: 斤 | L465: 斤 | M465: 200162700000 | N465: 1627 | O465: 1
A466: 调料干货 | B466: 调味品 | C466: 青花椒粒 | G466: =RC[-2]+RC[-1] -> 0 | I466: =RC[-2]+RC[-1] -> 0 | J466: 500.00000000 | K466: 斤 | L466: 斤 | M466: 200162600000 | N466: 1626 | O466: 1
A467: 调料干货 | B467: 调味品 | C467: 辣椒面 朝天椒 散装 | G467: =RC[-2]+RC[-1] -> 0 | I467: =RC[-2]+RC[-1] -> 0 | J467: 500.00000000 | K467: 斤 | L467: 斤 | M467: 200165000000 | N467: 1650 | O467: 1
A468: 调料干货 | B468: 调味品 | C468: 辣椒面 小米辣 散装 | G468: =RC[-2]+RC[-1] -> 0 | I468: =RC[-2]+RC[-1] -> 0 | J468: 500.00000000 | K468: 斤 | L468: 斤 | M468: 200165200000 | N468: 1652 | O468: 1
A469: 调料干货 | B469: 调味品 | C469: 辣椒面 二荆条 散装 | E469: 9 | F469: 0.5 | G469: =RC[-2]+RC[-1] -> 9.5 | H469: 0.5 | I469: =RC[-2]+RC[-1] -> 10 | J469: 500.00000000 | K469: 斤 | L469: 斤 | M469: 200165100000 | N469: 1651 | O469: 1
A470: 调料干货 | B470: 调味品 | C470: 辣椒段 朝天椒 散装 | G470: =RC[-2]+RC[-1] -> 0 | I470: =RC[-2]+RC[-1] -> 0 | J470: 500.00000000 | K470: 斤 | L470: 斤 | M470: 200164700000 | N470: 1647 | O470: 1
A471: 调料干货 | B471: 调味品 | C471: 辣椒段 朝天椒 去籽 散装 | G471: =RC[-2]+RC[-1] -> 0 | I471: =RC[-2]+RC[-1] -> 0 | J471: 500.00000000 | K471: 斤 | L471: 斤 | M471: 200164900000 | N471: 1649 | O471: 1
A472: 调料干货 | B472: 调味品 | C472: 辣椒段 二荆条 散装 | E472: 9 | F472: 0.5 | G472: =RC[-2]+RC[-1] -> 9.5 | H472: 0.5 | I472: =RC[-2]+RC[-1] -> 10 | J472: 500.00000000 | K472: 斤 | L472: 斤 | M472: 200164600000 | N472: 1646 | O472: 1
A473: 调料干货 | B473: 调味品 | C473: 辣椒段 二荆条 去籽 散装 | G473: =RC[-2]+RC[-1] -> 0 | I473: =RC[-2]+RC[-1] -> 0 | J473: 500.00000000 | K473: 斤 | L473: 斤 | M473: 200164800000 | N473: 1648 | O473: 1
A474: 调料干货 | B474: 调味品 | C474: 藤椒油（建华）500ml | D474: 12瓶/件 | E474: 145 | F474: 2 | G474: =RC[-2]+RC[-1] -> 147 | H474: 3 | I474: =RC[-2]+RC[-1] -> 150 | J474: 500.00000000 | K474: 瓶 | L474: 瓶 | M474: 200163100000 | N474: 1631 | O474: 1
A475: 调料干货 | B475: 调味品 | C475: 藤椒油（建华）25kg | G475: =RC[-2]+RC[-1] -> 0 | I475: =RC[-2]+RC[-1] -> 0 | J475: 25.00000000 | K475: 桶 | L475: 桶 | M475: 200163200000 | N475: 1632 | O475: 1
A476: 调料干货 | B476: 调味品 | C476: 藤椒油（幺麻子）5L | D476: 非转基因菜籽油，4桶/件 | G476: =RC[-2]+RC[-1] -> 0 | I476: =RC[-2]+RC[-1] -> 0 | J476: 5.00000000 | K476: 桶 | L476: 桶 | M476: 200163000000 | N476: 1630 | O476: 1
A477: 调料干货 | B477: 调味品 | C477: 藤椒油（幺麻子）500ml | D477: 非转基因菜籽油，12瓶/件 | E477: 215 | F477: 2 | G477: =RC[-2]+RC[-1] -> 217 | H477: 3 | I477: =RC[-2]+RC[-1] -> 220 | J477: 500.00000000 | K477: 瓶 | L477: 瓶 | M477: 200162800000 | N477: 1628 | O477: 1
A478: 调料干货 | B478: 调味品 | C478: 藤椒油（幺麻子）1.8L | D478: 非转基因菜籽油，6瓶/件 | G478: =RC[-2]+RC[-1] -> 0 | I478: =RC[-2]+RC[-1] -> 0 | J478: 1.80000000 | K478: 瓶 | L478: 瓶 | M478: 200162900000 | N478: 1629 | O478: 1
A479: 调料干货 | B479: 调味品 | C479: 花椒油（建华）500ml | G479: =RC[-2]+RC[-1] -> 0 | I479: =RC[-2]+RC[-1] -> 0 | J479: 500.00000000 | K479: 瓶 | L479: 瓶 | M479: 200163500000 | N479: 1634 | O479: 1
A480: 调料干货 | B480: 调味品 | C480: 花椒油（建华）25kg | G480: =RC[-2]+RC[-1] -> 0 | I480: =RC[-2]+RC[-1] -> 0 | J480: 25.00000000 | K480: 桶 | L480: 桶 | M480: 200163600000 | N480: 1636 | O480: 1
A481: 调料干货 | B481: 调味品 | C481: 花椒油（建华）2.5L | D481: 6瓶/件 | G481: =RC[-2]+RC[-1] -> 0 | I481: =RC[-2]+RC[-1] -> 0 | J481: 2.50000000 | K481: 瓶 | L481: 瓶 | M481: 200163700000 | N481: 1637 | O481: 1
A482: 调料干货 | B482: 调味品 | C482: 花椒油（幺麻子）380ml | G482: =RC[-2]+RC[-1] -> 0 | I482: =RC[-2]+RC[-1] -> 0 | J482: 380.00000000 | K482: 瓶 | L482: 瓶 | M482: 200163400000 | N482: 1634 | O482: 1
A483: 调料干货 | B483: 调味品 | C483: 花椒油（幺麻子）250ml | D483: 12瓶/件 | G483: =RC[-2]+RC[-1] -> 0 | I483: =RC[-2]+RC[-1] -> 0 | J483: 250.00000000 | K483: 瓶 | L483: 瓶 | M483: 200163300000 | N483: 1633 | O483: 1
A484: 调料干货 | B484: 调味品 | C484: 绵白糖 50kg 散装 | D484: 一级 | G484: =RC[-2]+RC[-1] -> 0 | I484: =RC[-2]+RC[-1] -> 0 | J484: 500.00000000 | K484: 斤 | L484: 斤 | M484: 200165400000 | N484: 1654 | O484: 1
A485: 调料干货 | B485: 调味品 | C485: 绵白糖 50kg | D485: 一级 | G485: =RC[-2]+RC[-1] -> 0 | I485: =RC[-2]+RC[-1] -> 0 | J485: 50.00000000 | K485: 袋 | L485: 袋 | M485: 200165300000 | N485: 1653 | O485: 1
A486: 调料干货 | B486: 调味品 | C486: 红花椒面 | E486: 40 | F486: 1 | G486: =RC[-2]+RC[-1] -> 41 | H486: 1 | I486: =RC[-2]+RC[-1] -> 42 | J486: 500.00000000 | K486: 斤 | L486: 斤 | M486: 200162500000 | N486: 1625 | O486: 1
A487: 调料干货 | B487: 调味品 | C487: 红花椒粒 | E487: 58 | F487: 1 | G487: =RC[-2]+RC[-1] -> 59 | H487: 1 | I487: =RC[-2]+RC[-1] -> 60 | J487: 500.00000000 | K487: 斤 | L487: 斤 | M487: 200162400000 | N487: 1624 | O487: 1
A488: 调料干货 | B488: 调味品 | C488: 红糖 散装 | E488: 4 | F488: 0.2 | G488: =RC[-2]+RC[-1] -> 4.2 | H488: 0.3 | I488: =RC[-2]+RC[-1] -> 4.5 | J488: 500.00000000 | K488: 斤 | L488: 斤 | M488: 200162300000 | N488: 1623 | O488: 1
A489: 调料干货 | B489: 调味品 | C489: 白胡椒粉 散装 | G489: =RC[-2]+RC[-1] -> 0 | I489: =RC[-2]+RC[-1] -> 0 | J489: 500.00000000 | K489: 斤 | L489: 斤 | M489: 200164300000 | N489: 1643 | O489: 1
A490: 调料干货 | B490: 调味品 | C490: 白砂糖 散装 | G490: =RC[-2]+RC[-1] -> 0 | I490: =RC[-2]+RC[-1] -> 0 | J490: 500.00000000 | K490: 斤 | L490: 斤 | M490: 200162200000 | N490: 1622 | O490: 1
A491: 调料干货 | B491: 调味品 | C491: 白砂糖 50KG/袋 | E491: 268 | F491: 3 | G491: =RC[-2]+RC[-1] -> 271 | H491: 4 | I491: =RC[-2]+RC[-1] -> 275 | J491: 50.00000000 | K491: 袋 | L491: 袋 | M491: 200162100000 | N491: 1621 | O491: 1
A492: 调料干货 | B492: 调味品 | C492: 干辣椒 二荆条 散装 | G492: =RC[-2]+RC[-1] -> 0 | I492: =RC[-2]+RC[-1] -> 0 | J492: 500.00000000 | K492: 斤 | L492: 斤 | M492: 200164500000 | N492: 1645 | O492: 1
A493: 调料干货 | B493: 调味品 | C493: 味精（飞马） 25kg | D493: 25kg/袋，散装无盐鲜度特鲜 | E493: 245 | F493: 2 | G493: =RC[-2]+RC[-1] -> 247 | H493: 3 | I493: =RC[-2]+RC[-1] -> 250 | J493: 25.00000000 | K493: 袋 | L493: 袋 | M493: 200158100000 | N493: 1581 | O493: 1
A494: 调料干货 | B494: 调味品 | C494: 味精（飞马纯粮）454g*22袋 | D494: 22袋/件，粉末，大飞马 | G494: =RC[-2]+RC[-1] -> 0 | I494: =RC[-2]+RC[-1] -> 0 | J494: 9988.00000000 | K494: 件 | L494: 件 | M494: 200158200000 | N494: 1582 | O494: 1
A495: 调料干货 | B495: 调味品 | C495: 味精（飞马纯粮）400g*25袋 | D495: 25袋/件，粉末，小飞马 | G495: =RC[-2]+RC[-1] -> 0 | I495: =RC[-2]+RC[-1] -> 0 | J495: 10.00000000 | K495: 件 | L495: 件 | M495: 200158300000 | N495: 1583 | O495: 1
A496: 调料干货 | B496: 调味品 | C496: 味精（飞马纯粮）2.5kg | D496: 晶体 | G496: =RC[-2]+RC[-1] -> 0 | I496: =RC[-2]+RC[-1] -> 0 | J496: 2.50000000 | K496: 袋 | L496: 袋 | M496: 200158500000 | N496: 1585 | O496: 1
A497: 调料干货 | B497: 调味品 | C497: 味精（飞马纯粮）1kg | D497: 晶体 | G497: =RC[-2]+RC[-1] -> 0 | I497: =RC[-2]+RC[-1] -> 0 | J497: 1.00000000 | K497: 袋 | L497: 袋 | M497: 200158400000 | N497: 1584 | O497: 1
A498: 调料干货 | B498: 调味品 | C498: 味精（国泰）454g*22袋/件 | D498: 晶体 | G498: =RC[-2]+RC[-1] -> 0 | I498: =RC[-2]+RC[-1] -> 0 | J498: 9.98800000 | K498: 件 | L498: 件 | M498: 200158700000 | N498: 1587 | O498: 1
A499: 调料干货 | B499: 调味品 | C499: 味精（国泰）400g*25袋/件 | D499: 晶体 | G499: =RC[-2]+RC[-1] -> 0 | I499: =RC[-2]+RC[-1] -> 0 | J499: 10.00000000 | K499: 件 | L499: 件 | M499: 200158600000 | N499: 1586 | O499: 1
A500: 调料干货 | B500: 调味品 | C500: 味精（伊品）2kg*10袋/件 | D500: 玉米原料，晶体 | G500: =RC[-2]+RC[-1] -> 0 | I500: =RC[-2]+RC[-1] -> 0 | J500: 20.00000000 | K500: 件 | L500: 件 | M500: 200158800000 | N500: 1588 | O500: 1
A501: 调料干货 | B501: 调味品 | C501: 味精（伊品）2.5kg*10袋/件 | D501: 玉米原料，晶体 | G501: =RC[-2]+RC[-1] -> 0 | I501: =RC[-2]+RC[-1] -> 0 | J501: 25.00000000 | K501: 件 | L501: 件 | M501: 200158900000 | N501: 1589 | O501: 1
A502: 调料干货 | B502: 调味品 | C502: 单晶冰糖 散装 | G502: =RC[-2]+RC[-1] -> 0 | I502: =RC[-2]+RC[-1] -> 0 | J502: 500.00000000 | K502: 斤 | L502: 斤 | M502: 200164200000 | N502: 1642 | O502: 1
A503: 调料干货 | B503: 酱汁调料 | C503: 酱料（海天黄豆酱）6kg*2 | D503: 2罐/件，蘸酱 蒸排骨 | G503: =RC[-2]+RC[-1] -> 0 | I503: =RC[-2]+RC[-1] -> 0 | J503: 6.00000000 | K503: 件 | L503: 件 | M503: 200153100000 | N503: 1531 | O503: 1
A504: 调料干货 | B504: 酱汁调料 | C504: 酱料（海天海鲜酱）7kg*2 | D504: 2罐/件，烧烤料/火锅蘸料点蘸海鲜牛排 | G504: =RC[-2]+RC[-1] -> 0 | I504: =RC[-2]+RC[-1] -> 0 | J504: 14.00000000 | K504: 件 | L504: 件 | M504: 200153200000 | N504: 1532 | O504: 1
A505: 调料干货 | B505: 酱汁调料 | C505: 豆瓣（鹃城牌）红豆瓣 20kg | D505: 纸桶装 | G505: =RC[-2]+RC[-1] -> 0 | I505: =RC[-2]+RC[-1] -> 0 | J505: 20.00000000 | K505: 桶 | L505: 桶 | M505: 200150900000 | N505: 1509 | O505: 1
A506: 调料干货 | B506: 酱汁调料 | C506: 豆瓣（鹃城牌）红油豆瓣 8kg | D506: 桶装 | G506: =RC[-2]+RC[-1] -> 0 | I506: =RC[-2]+RC[-1] -> 0 | J506: 8.00000000 | K506: 桶 | L506: 桶 | M506: 200150500000 | N506: 1505 | O506: 1
A507: 调料干货 | B507: 酱汁调料 | C507: 豆瓣（鹃城牌）红油豆瓣 15kg | D507: 一级，彩箱装 | G507: =RC[-2]+RC[-1] -> 0 | I507: =RC[-2]+RC[-1] -> 0 | J507: 15.00000000 | K507: 件 | L507: 件 | M507: 200150700000 | N507: 1507 | O507: 1
A508: 调料干货 | B508: 酱汁调料 | C508: 豆瓣（鹃城牌）红油豆瓣 15kg | D508: 特级，纸桶装 | G508: =RC[-2]+RC[-1] -> 0 | I508: =RC[-2]+RC[-1] -> 0 | J508: 15.00000000 | K508: 件 | L508: 件 | M508: 200150800000 | N508: 1508 | O508: 1
A509: 调料干货 | B509: 酱汁调料 | C509: 豆瓣（鹃城牌）红油豆瓣 10kg | D509: 一级，彩箱装 | G509: =RC[-2]+RC[-1] -> 0 | I509: =RC[-2]+RC[-1] -> 0 | J509: 0.00000000 | K509: 件 | L509: 件 | M509: 200150600000 | N509: 1506 | O509: 1
A510: 调料干货 | B510: 酱汁调料 | C510: 豆瓣（鹃城牌）火锅豆瓣 15kg | D510: 彩箱装 | G510: =RC[-2]+RC[-1] -> 0 | I510: =RC[-2]+RC[-1] -> 0 | J510: 15.00000000 | K510: 件 | L510: 件 | M510: 200150400000 | N510: 1504 | O510: 1
A511: 调料干货 | B511: 酱汁调料 | C511: 豆瓣（鹃城牌）火锅豆瓣 13.5kg | D511: 彩箱装 | G511: =RC[-2]+RC[-1] -> 0 | I511: =RC[-2]+RC[-1] -> 0 | J511: 13.50000000 | K511: 件 | L511: 件 | M511: 200150300000 | N511: 1503 | O511: 1
A512: 调料干货 | B512: 酱汁调料 | C512: 豆瓣（鹃城牌）火锅豆瓣 12kg | D512: 彩箱装 | G512: =RC[-2]+RC[-1] -> 0 | I512: =RC[-2]+RC[-1] -> 0 | J512: 12.00000000 | K512: 件 | L512: 件 | M512: 200150200000 | N512: 1502 | O512: 1
A513: 调料干货 | B513: 酱汁调料 | C513: 豆瓣（鹃城牌）火锅豆瓣 10kg | D513: 彩箱装 | G513: =RC[-2]+RC[-1] -> 0 | I513: =RC[-2]+RC[-1] -> 0 | J513: 10.00000000 | K513: 件 | L513: 件 | M513: 200150100000 | N513: 1501 | O513: 1
A514: 调料干货 | B514: 酱汁调料 | C514: 豆瓣（鹃城牌）中餐豆瓣 10kg | D514: 彩箱装 | G514: =RC[-2]+RC[-1] -> 0 | I514: =RC[-2]+RC[-1] -> 0 | J514: 10.00000000 | K514: 件 | L514: 件 | M514: 200151000000 | N514: 1510 | O514: 1
A515: 调料干货 | B515: 酱汁调料 | C515: 豆瓣（丽通 红油豆瓣）20kg | D515: 纸桶装 | G515: =RC[-2]+RC[-1] -> 0 | I515: =RC[-2]+RC[-1] -> 0 | J515: 20.00000000 | K515: 桶 | L515: 桶 | M515: 200152600000 | N515: 1526 | O515: 1
A516: 调料干货 | B516: 酱汁调料 | C516: 豆瓣（丽通 红油豆瓣）15kg | D516: 纸桶装 | G516: =RC[-2]+RC[-1] -> 0 | I516: =RC[-2]+RC[-1] -> 0 | J516: 15.00000000 | K516: 桶 | L516: 桶 | M516: 200152500000 | N516: 1525 | O516: 1
A517: 调料干货 | B517: 酱汁调料 | C517: 豆瓣（丽通 红油豆瓣）13.5kg | D517: 彩箱装 | G517: =RC[-2]+RC[-1] -> 0 | I517: =RC[-2]+RC[-1] -> 0 | J517: 13.50000000 | K517: 件 | L517: 件 | M517: 200152300000 | N517: 1523 | O517: 1
A518: 调料干货 | B518: 酱汁调料 | C518: 豆瓣（丽通 红油豆瓣）13.5kg | D518: 塑料桶装 | G518: =RC[-2]+RC[-1] -> 0 | I518: =RC[-2]+RC[-1] -> 0 | J518: 13.50000000 | K518: 桶 | L518: 桶 | M518: 200152400000 | N518: 1524 | O518: 1
A519: 调料干货 | B519: 酱汁调料 | C519: 豆瓣（丽通 红油豆瓣）12kg | D519: 彩箱装 | G519: =RC[-2]+RC[-1] -> 0 | I519: =RC[-2]+RC[-1] -> 0 | J519: 12.00000000 | K519: 件 | L519: 件 | M519: 200152200000 | N519: 1522 | O519: 1
A520: 调料干货 | B520: 酱汁调料 | C520: 豆瓣（丽通 红油豆瓣）10kg | D520: 彩箱装 | G520: =RC[-2]+RC[-1] -> 0 | I520: =RC[-2]+RC[-1] -> 0 | J520: 10.00000000 | K520: 件 | L520: 件 | M520: 200152100000 | N520: 1521 | O520: 1
A521: 调料干货 | B521: 酱汁调料 | C521: 豆瓣（丽通 特制火锅）20kg | D521: 纸桶装 | G521: =RC[-2]+RC[-1] -> 0 | I521: =RC[-2]+RC[-1] -> 0 | J521: 20.00000000 | K521: 桶 | L521: 桶 | M521: 200152700000 | N521: 1527 | O521: 1
A522: 调料干货 | B522: 酱汁调料 | C522: 豆瓣（丽通 一级火锅）20kg | D522: 纸桶装 | G522: =RC[-2]+RC[-1] -> 0 | I522: =RC[-2]+RC[-1] -> 0 | J522: 20.00000000 | K522: 桶 | L522: 桶 | M522: 200152800000 | N522: 1528 | O522: 1
A523: 调料干货 | B523: 酱汁调料 | C523: 蒸鱼豉油（海天）4.9L*2 | D523: 2瓶/件 | G523: =RC[-2]+RC[-1] -> 0 | I523: =RC[-2]+RC[-1] -> 0 | J523: 9.80000000 | K523: 件 | L523: 件 | M523: 200152900000 | N523: 1529 | O523: 1
A524: 调料干货 | B524: 酱汁调料 | C524: 蒸鱼豉油（李锦记）1.9L*6 | D524: 6瓶/件 | G524: =RC[-2]+RC[-1] -> 0 | I524: =RC[-2]+RC[-1] -> 0 | J524: 11.40000000 | K524: 件 | L524: 件 | M524: 200153000000 | N524: 1530 | O524: 1
A525: 调料干货 | B525: 酱汁调料 | C525: 耗油（海天蚝油皇）6kg*2 | D525: 2罐/件，焖肉烧烤炒菜 蚝油 酱料 | G525: =RC[-2]+RC[-1] -> 0 | I525: =RC[-2]+RC[-1] -> 0 | J525: 12.00000000 | K525: 件 | L525: 件 | M525: 200153300000 | N525: 1533 | O525: 1
A526: 调料干货 | B526: 酱汁调料 | C526: 耗油（海天上等蚝油）6kg*2 | D526: 2罐/件，蚝油牛肉 烧烤必备 | G526: =RC[-2]+RC[-1] -> 0 | I526: =RC[-2]+RC[-1] -> 0 | J526: 12.00000000 | K526: 件 | L526: 件 | M526: 200153400000 | N526: 1534 | O526: 1
A527: 调料干货 | B527: 酱油醋 | C527: 酱油（海天红烧酱油）1.9L*6 | D527: 6瓶/件，红烧肉调料 非转基因黄豆 | G527: =RC[-2]+RC[-1] -> 0 | I527: =RC[-2]+RC[-1] -> 0 | J527: 11.40000000 | K527: 件 | L527: 件 | M527: 200154900000 | N527: 1549 | O527: 1
A528: 调料干货 | B528: 酱油醋 | C528: 酱油（海天海鲜酱油）4.9L*2 | D528: 2瓶/件，非转基因黄豆 | G528: =RC[-2]+RC[-1] -> 0 | I528: =RC[-2]+RC[-1] -> 0 | J528: 9.80000000 | K528: 件 | L528: 件 | M528: 200155000000 | N528: 1550 | O528: 1
A529: 调料干货 | B529: 酱油醋 | C529: 酱油（海天一品鲜酱油）4.9L*2 | D529: 2瓶/件，非转基因黄豆 特级酱油 | G529: =RC[-2]+RC[-1] -> 0 | I529: =RC[-2]+RC[-1] -> 0 | J529: 9.80000000 | K529: 件 | L529: 件 | M529: 200155600000 | N529: 1556 | O529: 1
A530: 调料干货 | B530: 酱油醋 | C530: 郫县豆瓣 | D530: 每瓶500克 | G530: =RC[-2]+RC[-1] -> 0 | I530: =RC[-2]+RC[-1] -> 0 | J530: 500.00000000 | K530: 瓶 | L530: 瓶 | M530: 200005700000 | N530: 262 | O530: 1
A531: 调料干货 | B531: 酱油醋 | C531: 豪吉鸡精100g | D531: 每袋100克 | G531: =RC[-2]+RC[-1] -> 0 | I531: =RC[-2]+RC[-1] -> 0 | J531: 100.00000000 | K531: 袋 | L531: 袋 | M531: 200006600000 | N531: 255 | O531: 1
A532: 调料干货 | B532: 酱油醋 | C532: 豆粉 | D532: 每袋200克 | G532: =RC[-2]+RC[-1] -> 0 | I532: =RC[-2]+RC[-1] -> 0 | J532: 200.00000000 | K532: 袋 | L532: 袋 | M532: 200006100000 | N532: 300 | O532: 1
A533: 调料干货 | B533: 酱油醋 | C533: 调味盐 | D533: 每袋250克 | G533: =RC[-2]+RC[-1] -> 0 | I533: =RC[-2]+RC[-1] -> 0 | J533: 250.00000000 | K533: 袋 | L533: 袋 | M533: 200005600000 | N533: 264 | O533: 1
A534: 调料干货 | B534: 酱油醋 | C534: 芝麻油 | D534: 每瓶450毫升 | G534: =RC[-2]+RC[-1] -> 0 | I534: =RC[-2]+RC[-1] -> 0 | J534: 450.00000000 | K534: 瓶 | L534: 瓶 | M534: 200006900000 | N534: 261 | O534: 1
A535: 调料干货 | B535: 酱油醋 | C535: 老抽（海天草菇老抽）4.9L*2 | D535: 2瓶/件，非转基因黄豆 | G535: =RC[-2]+RC[-1] -> 0 | I535: =RC[-2]+RC[-1] -> 0 | J535: 9.80000000 | K535: 件 | L535: 件 | M535: 200154800000 | N535: 1548 | O535: 1
A536: 调料干货 | B536: 酱油醋 | C536: 老抽（海天草菇老抽）1.9L*6 | D536: 6瓶/件，非转基因黄豆 | G536: =RC[-2]+RC[-1] -> 0 | I536: =RC[-2]+RC[-1] -> 0 | J536: 11.40000000 | K536: 件 | L536: 件 | M536: 200154700000 | N536: 1547 | O536: 1
A537: 调料干货 | B537: 酱油醋 | C537: 老抽（海天老抽王）4.9L*2 | D537: 2瓶/件，红烧烹饪，非转基因黄豆 | G537: =RC[-2]+RC[-1] -> 0 | I537: =RC[-2]+RC[-1] -> 0 | J537: 9.80000000 | K537: 件 | L537: 件 | M537: 200155300000 | N537: 1553 | O537: 1
A538: 调料干货 | B538: 酱油醋 | C538: 老抽（李锦记锦珍老抽）1.75L*6 | D538: 6瓶/件 | G538: =RC[-2]+RC[-1] -> 0 | I538: =RC[-2]+RC[-1] -> 0 | J538: 10.50000000 | K538: 件 | L538: 件 | M538: 200154400000 | N538: 1544 | O538: 1
A539: 调料干货 | B539: 酱油醋 | C539: 老抽（李锦记草菇老抽）1.75L*6 | D539: 6瓶/件 | G539: =RC[-2]+RC[-1] -> 0 | I539: =RC[-2]+RC[-1] -> 0 | J539: 10.50000000 | K539: 件 | L539: 件 | M539: 200154100000 | N539: 1541 | O539: 1
A540: 调料干货 | B540: 酱油醋 | C540: 老抽（李锦记精选老抽）1.75L*6 | D540: 6瓶/件 | G540: =RC[-2]+RC[-1] -> 0 | I540: =RC[-2]+RC[-1] -> 0 | J540: 10.50000000 | K540: 件 | L540: 件 | M540: 200154200000 | N540: 1542 | O540: 1
A541: 调料干货 | B541: 酱油醋 | C541: 红糖 | D541: 每袋300克 | G541: =RC[-2]+RC[-1] -> 0 | I541: =RC[-2]+RC[-1] -> 0 | J541: 300.00000000 | K541: 袋 | L541: 袋 | M541: 200006800000 | N541: 257 | O541: 0
A542: 调料干货 | B542: 酱油醋 | C542: 精晶白砂糖300g | D542: 每袋300克 | G542: =RC[-2]+RC[-1] -> 0 | I542: =RC[-2]+RC[-1] -> 0 | J542: 400.00000000 | K542: 袋 | L542: 袋 | M542: 200006200000 | N542: 252 | O542: 1
A543: 调料干货 | B543: 酱油醋 | C543: 白醋 | D543: 每瓶480毫升 | G543: =RC[-2]+RC[-1] -> 0 | I543: =RC[-2]+RC[-1] -> 0 | J543: 480.00000000 | K543: 瓶 | L543: 瓶 | M543: 200006500000 | N543: 254 | O543: 0
A544: 调料干货 | B544: 酱油醋 | C544: 生抽（海天鲜味生抽）4.9L*2 | D544: 2瓶/件，调料 蘸料 凉拌 | G544: =RC[-2]+RC[-1] -> 0 | I544: =RC[-2]+RC[-1] -> 0 | J544: 9.80000000 | K544: 件 | L544: 件 | M544: 200155500000 | N544: 1555 | O544: 1
A545: 调料干货 | B545: 酱油醋 | C545: 生抽（海天鲜味生抽）1.9L*6 | D545: 6瓶/件，非转基因黄豆 调料 蘸料 凉拌 | G545: =RC[-2]+RC[-1] -> 0 | I545: =RC[-2]+RC[-1] -> 0 | J545: 11.40000000 | K545: 件 | L545: 件 | M545: 200155400000 | N545: 1554 | O545: 1
A546: 调料干货 | B546: 酱油醋 | C546: 生抽（海天金标生抽）4.9L*2 | D546: 2瓶/件，非转基因黄豆 | G546: =RC[-2]+RC[-1] -> 0 | I546: =RC[-2]+RC[-1] -> 0 | J546: 9.80000000 | K546: 件 | L546: 件 | M546: 200155200000 | N546: 1552 | O546: 1
A547: 调料干货 | B547: 酱油醋 | C547: 生抽（海天金标生抽）1.9L*6 | D547: 6瓶/件，非转基因黄豆 | G547: =RC[-2]+RC[-1] -> 0 | I547: =RC[-2]+RC[-1] -> 0 | J547: 11.40000000 | K547: 件 | L547: 件 | M547: 200155100000 | N547: 1551 | O547: 1
A548: 调料干货 | B548: 酱油醋 | C548: 生抽（李锦记锦珍生抽）1.75L*6 | D548: 6瓶/件 | G548: =RC[-2]+RC[-1] -> 0 | I548: =RC[-2]+RC[-1] -> 0 | J548: 10.50000000 | K548: 件 | L548: 件 | M548: 200154500000 | N548: 1545 | O548: 1
A549: 调料干货 | B549: 酱油醋 | C549: 生抽（李锦记金标生抽）1.75L*6 | D549: 6瓶/件 | G549: =RC[-2]+RC[-1] -> 0 | I549: =RC[-2]+RC[-1] -> 0 | J549: 10.50000000 | K549: 件 | L549: 件 | M549: 200154600000 | N549: 1546 | O549: 1
A550: 调料干货 | B550: 酱油醋 | C550: 生抽（李锦记精选生抽）1.75L*6 | D550: 6瓶/件 | G550: =RC[-2]+RC[-1] -> 0 | I550: =RC[-2]+RC[-1] -> 0 | J550: 10.50000000 | K550: 件 | L550: 件 | M550: 200154300000 | N550: 1543 | O550: 1
A551: 调料干货 | B551: 酱油醋 | C551: 甜面酱 | D551: 每小袋40克 | G551: =RC[-2]+RC[-1] -> 0 | I551: =RC[-2]+RC[-1] -> 0 | J551: 40.00000000 | K551: 袋 | L551: 袋 | M551: 200008200000 | N551: 258 | O551: 1
A552: 调料干货 | B552: 酱油醋 | C552: 料酒 | D552: 每瓶500毫升 | G552: =RC[-2]+RC[-1] -> 0 | I552: =RC[-2]+RC[-1] -> 0 | J552: 480.00000000 | K552: 瓶 | L552: 瓶 | M552: 200005900000 | N552: 259 | O552: 1
A553: 调料干货 | B553: 酱油醋 | C553: 国泰味精200g | D553: 每袋200克 | G553: =RC[-2]+RC[-1] -> 0 | I553: =RC[-2]+RC[-1] -> 0 | J553: 0.00000000 | K553: 袋 | L553: 袋 | M553: 200013900000 | N553: 265 | O553: 1
A554: 调料干货 | B554: 酱油醋 | C554: 国泰味精100g | D554: 每袋100克 | G554: =RC[-2]+RC[-1] -> 0 | I554: =RC[-2]+RC[-1] -> 0 | J554: 200.00000000 | K554: 袋 | L554: 袋 | M554: 200005800000 | N554: 250 | O554: 1
A555: 调料干货 | B555: 酱油醋 | C555: 冰糖 | D555: 每袋200克 | G555: =RC[-2]+RC[-1] -> 0 | I555: =RC[-2]+RC[-1] -> 0 | J555: 200.00000000 | K555: 袋 | L555: 袋 | M555: 200006300000 | N555: 260 | O555: 1
A556: 调料干货 | B556: 酱油醋 | C556: 保宁醋 特级 440ml*12瓶 | G556: =RC[-2]+RC[-1] -> 0 | I556: =RC[-2]+RC[-1] -> 0 | J556: 440.00000000 | K556: 件 | L556: 件 | M556: 200160200000 | N556: 1602 | O556: 1
A557: 调料干货 | B557: 酱油醋 | C557: 保宁醋 特级 2.5L*6瓶 | G557: =RC[-2]+RC[-1] -> 0 | I557: =RC[-2]+RC[-1] -> 0 | J557: 2.50000000 | K557: 件 | L557: 件 | M557: 200160100000 | N557: 1601 | O557: 1
A558: 调料干货 | B558: 酱油醋 | C558: 保宁醋 一级 430ml*20瓶 | E558: 75 | F558: 2 | G558: =RC[-2]+RC[-1] -> 77 | H558: 2 | I558: =RC[-2]+RC[-1] -> 79 | J558: 430.00000000 | K558: 件 | L558: 件 | M558: 200160400000 | N558: 1604 | O558: 1
A559: 调料干货 | B559: 酱油醋 | C559: 保宁醋 一级 400ml*30袋 | G559: =RC[-2]+RC[-1] -> 0 | I559: =RC[-2]+RC[-1] -> 0 | J559: 400.00000000 | K559: 件 | L559: 件 | M559: 200160500000 | N559: 1605 | O559: 1
A560: 调料干货 | B560: 酱油醋 | C560: 保宁醋 一级 2.5L*6瓶 | G560: =RC[-2]+RC[-1] -> 0 | I560: =RC[-2]+RC[-1] -> 0 | J560: 2.50000000 | K560: 件 | L560: 件 | M560: 200160300000 | N560: 1603 | O560: 1
A561: 调料干货 | B561: 酱油醋 | C561: 久大精纯盐350g | D561: 每袋350克 | G561: =RC[-2]+RC[-1] -> 0 | I561: =RC[-2]+RC[-1] -> 0 | J561: 350.00000000 | K561: 袋 | L561: 袋 | M561: 200005500000 | N561: 263 | O561: 1
A562: 酒水饮料 | B562: 白酒 | C562: 五粮春45度
A563: 酒水饮料 | B563: 白酒 | C563: 红花郎15年
A564: 酒水饮料 | B564: 白酒 | C564: 红花郎10年
A565: 酒水饮料 | B565: 白酒 | C565: 金如意郎
A566: 酒水饮料 | B566: 白酒 | C566: 自在如意郎
A567: 酒水饮料 | B567: 白酒 | C567: 红心如意郎
A568: 酒水饮料 | B568: 白酒 | C568: 郎酒原装藏品
A569: 酒水饮料 | B569: 白酒 | C569: 郎酒原浆纯品
A570: 酒水饮料 | B570: 白酒 | C570: 小贵宾郎100ml（歪嘴）
A571: 酒水饮料 | B571: 白酒 | C571: 贵宾郎218ml
A572: 酒水饮料 | B572: 白酒 | C572: 红星二锅头
A573: 酒水饮料 | B573: 白酒 | C573: 劲酒125ml
A574: 酒水饮料 | B574: 白酒 | C574: 十年花雕
A575: 酒水饮料 | B575: 白酒 | C575: 八年花雕
A576: 酒水饮料 | B576: 白酒 | C576: 丰谷小酒（亲酒）
A577: 酒水饮料 | B577: 白酒 | C577: 泸州老窖特曲1斤装
A578: 酒水饮料 | B578: 白酒 | C578: 泸州老窖特曲半斤装
A579: 酒水饮料 | B579: 白酒 | C579: 泸州原味卡盒
A580: 酒水饮料 | B580: 白酒 | C580: 泸州原味淡雅
A581: 酒水饮料 | B581: 白酒 | C581: 丰谷酒寨特酿
A582: 酒水饮料 | B582: 白酒 | C582: 丰谷酒寨窖藏
A583: 酒水饮料 | B583: 白酒 | C583: 丰谷酒寨特制
A584: 酒水饮料 | B584: 白酒 | C584: 丰谷酒寨佳酿
A585: 酒水饮料 | B585: 白酒 | C585: 丰谷特曲1斤装
A586: 酒水饮料 | B586: 白酒 | C586: 丰谷特曲半斤装
A587: 酒水饮料 | B587: 白酒 | C587: 丰谷一品
A588: 酒水饮料 | B588: 白酒 | C588: 丰谷二品
A589: 酒水饮料 | B589: 白酒 | C589: 丰谷三品
A590: 酒水饮料 | B590: 白酒 | C590: 丰谷五品
A591: 酒水饮料 | B591: 白酒 | C591: 丰谷纯粮10年
A592: 酒水饮料 | B592: 白酒 | C592: 丰谷10年
A593: 酒水饮料 | B593: 啤酒 | C593: 冰纯嘉士伯 | D593: 0.330L*24Bt | E593: 95 | F593: 2 | G593: =RC[-2]+RC[-1] -> 97 | H593: 3 | I593: =RC[-2]+RC[-1] -> 100
A594: 酒水饮料 | B594: 啤酒 | C594: 乐堡啤酒 | D594: 0.330L*24Bt | E594: 73 | F594: 2 | G594: =RC[-2]+RC[-1] -> 75 | H594: 3 | I594: =RC[-2]+RC[-1] -> 78
A595: 酒水饮料 | B595: 啤酒 | C595: 乐堡啤酒 | D595: 0.500L*12Bt | E595: 53 | F595: 2 | G595: =RC[-2]+RC[-1] -> 55 | H595: 3 | I595: =RC[-2]+RC[-1] -> 58
A596: 酒水饮料 | B596: 啤酒 | C596: 1664白 | D596: 0.330L*24Bt | E596: 280 | F596: 3 | G596: =RC[-2]+RC[-1] -> 283 | H596: 4 | I596: =RC[-2]+RC[-1] -> 287
A597: 酒水饮料 | B597: 啤酒 | C597: 哈尔滨啤酒冰纯 | D597: 0.500L*12Bt | E597: 58 | F597: 2 | G597: =RC[-2]+RC[-1] -> 60 | H597: 3 | I597: =RC[-2]+RC[-1] -> 63
A598: 酒水饮料 | B598: 啤酒 | C598: 百威 | D598: 0.330L*24Bt | E598: 93 | F598: 2 | G598: =RC[-2]+RC[-1] -> 95 | H598: 3 | I598: =RC[-2]+RC[-1] -> 98
A599: 酒水饮料 | B599: 啤酒 | C599: 百威 | D599: 0.500L*12Bt | E599: 68 | F599: 2 | G599: =RC[-2]+RC[-1] -> 70 | H599: 3 | I599: =RC[-2]+RC[-1] -> 73
A600: 酒水饮料 | B600: 啤酒 | C600: 科罗娜 | D600: 0.330L*24Bt | E600: 175 | F600: 5 | G600: =RC[-2]+RC[-1] -> 180 | H600: 5 | I600: =RC[-2]+RC[-1] -> 185
A601: 酒水饮料 | B601: 啤酒 | C601: 福佳啤酒 | D601: 0.330L*24Bt | E601: 195 | F601: 5 | G601: =RC[-2]+RC[-1] -> 200 | H601: 5 | I601: =RC[-2]+RC[-1] -> 205
A602: 酒水饮料 | B602: 啤酒 | C602: 青岛纯生 500ml*12瓶 | G602: =RC[-2]+RC[-1] -> 0 | I602: =RC[-2]+RC[-1] -> 0 | J602: 500.00000000 | K602: 件 | L602: 件 | M602: 200300300000 | N602: 3003 | O602: 1
A603: 酒水饮料 | B603: 啤酒 | C603: 青岛啤酒 经典11度 330ml*24听 | G603: =RC[-2]+RC[-1] -> 0 | I603: =RC[-2]+RC[-1] -> 0 | J603: 330.00000000 | K603: 件 | L603: 件 | M603: 200300100000 | N603: 3001 | O603: 1
A604: 酒水饮料 | B604: 啤酒 | C604: 青岛啤酒 纯生8度 330ml*24听 | G604: =RC[-2]+RC[-1] -> 0 | I604: =RC[-2]+RC[-1] -> 0 | J604: 330.00000000 | K604: 件 | L604: 件 | M604: 200300200000 | N604: 3002 | O604: 1
A605: 酒水饮料 | B605: 啤酒 | C605: 雪花啤酒 9度精制 330ml*24听 | G605: =RC[-2]+RC[-1] -> 0 | I605: =RC[-2]+RC[-1] -> 0 | J605: 330.00000000 | K605: 件 | L605: 件 | M605: 200301600000 | N605: 3016 | O605: 1
A606: 酒水饮料 | B606: 啤酒 | C606: 雪花啤酒 8度纯生 330ml*24听 | G606: =RC[-2]+RC[-1] -> 0 | I606: =RC[-2]+RC[-1] -> 0 | J606: 330.00000000 | K606: 件 | L606: 件 | M606: 200301200000 | N606: 3012 | O606: 1
A607: 酒水饮料 | B607: 啤酒 | C607: 雪花啤酒 8度特爽 500ml*12瓶 | G607: =RC[-2]+RC[-1] -> 0 | I607: =RC[-2]+RC[-1] -> 0 | J607: 500.00000000 | K607: 件 | L607: 件 | M607: 200301300000 | N607: 3013 | O607: 1
A608: 酒水饮料 | B608: 啤酒 | C608: 雪花啤酒 8度勇闯天涯 500ml*12瓶 | G608: =RC[-2]+RC[-1] -> 0 | I608: =RC[-2]+RC[-1] -> 0 | J608: 500.00000000 | K608: 件 | L608: 件 | M608: 200301500000 | N608: 3015 | O608: 1
A609: 酒水饮料 | B609: 啤酒 | C609: 雪花啤酒 8度勇闯天涯 330ml*24听 | G609: =RC[-2]+RC[-1] -> 0 | I609: =RC[-2]+RC[-1] -> 0 | J609: 330.00000000 | K609: 件 | L609: 件 | M609: 200301400000 | N609: 3014 | O609: 1
A610: 酒水饮料 | B610: 啤酒 | C610: 雪花啤酒 7度纯生 500ml*12瓶 | G610: =RC[-2]+RC[-1] -> 0 | I610: =RC[-2]+RC[-1] -> 0 | J610: 500.00000000 | K610: 件 | L610: 件 | M610: 200301100000 | N610: 3011 | O610: 1
A611: 酒水饮料 | B611: 啤酒 | C611: 雪花啤酒 10度清爽 330ml*24听 | G611: =RC[-2]+RC[-1] -> 0 | I611: =RC[-2]+RC[-1] -> 0 | J611: 330.00000000 | K611: 件 | L611: 件 | M611: 200301800000 | N611: 3018 | O611: 1
A612: 酒水饮料 | B612: 啤酒 | C612: 雪花啤酒 10度干啤 330ml*24听 | G612: =RC[-2]+RC[-1] -> 0 | I612: =RC[-2]+RC[-1] -> 0 | J612: 330.00000000 | K612: 件 | L612: 件 | M612: 200301700000 | N612: 3017 | O612: 1
A613: 酒水饮料 | B613: 啤酒 | C613: 百威金樽 500ml*12瓶 | E613: 100 | F613: 4 | G613: =RC[-2]+RC[-1] -> 104 | H613: 4 | I613: =RC[-2]+RC[-1] -> 108 | J613: 330.00000000 | K613: 件 | L613: 件 | M613: 200301700000 | N613: 3017 | O613: 1
A614: 酒水饮料 | B614: 啤酒 | C614: 百威纯生 500ml*12瓶 | E614: 88 | F614: 1 | G614: =RC[-2]+RC[-1] -> 89 | H614: 1 | I614: =RC[-2]+RC[-1] -> 90 | J614: 330.00000000 | K614: 件 | L614: 件 | M614: 200301700000 | N614: 3017 | O614: 1
A615: 酒水饮料 | B615: 啤酒 | C615: 百威 500ml*12瓶 | E615: 80 | F615: 1 | G615: =RC[-2]+RC[-1] -> 81 | H615: 1 | I615: =RC[-2]+RC[-1] -> 82 | J615: 330.00000000 | K615: 件 | L615: 件 | M615: 200301700000 | N615: 3017 | O615: 1
A616: 酒水饮料 | B616: 啤酒 | C616: 哈尔滨纯生 550ml*12瓶 | E616: 50 | F616: 1 | G616: =RC[-2]+RC[-1] -> 51 | H616: 1 | I616: =RC[-2]+RC[-1] -> 52 | J616: 330.00000000 | K616: 件 | L616: 件 | M616: 200301700000 | N616: 3017 | O616: 1
A617: 酒水饮料 | B617: 啤酒 | C617: 哈尔滨小麦王 500ml*12瓶 | E617: 50 | F617: 1 | G617: =RC[-2]+RC[-1] -> 51 | H617: 1 | I617: =RC[-2]+RC[-1] -> 52 | J617: 330.00000000 | K617: 件 | L617: 件 | M617: 200301700000 | N617: 3017 | O617: 1
A618: 酒水饮料 | B618: 啤酒 | C618: 哈尔滨冰纯 500ml*12瓶 | E618: 50 | F618: 1 | G618: =RC[-2]+RC[-1] -> 51 | H618: 1 | I618: =RC[-2]+RC[-1] -> 52 | J618: 330.00000000 | K618: 件 | L618: 件 | M618: 200301700000 | N618: 3017 | O618: 1
A619: 酒水饮料 | B619: 啤酒 | C619: 哈尔滨冰爽 500ml*12瓶 | E619: 50 | F619: 1 | G619: =RC[-2]+RC[-1] -> 51 | H619: 1 | I619: =RC[-2]+RC[-1] -> 52 | J619: 330.00000000 | K619: 件 | L619: 件 | M619: 200301700000 | N619: 3017 | O619: 1
A620: 酒水饮料 | B620: 果汁饮料 | C620: 统一 鲜橙多 450ml*15瓶 | E620: 40 | F620: 0 | G620: =RC[-2]+RC[-1] -> 40 | H620: 1 | I620: =RC[-2]+RC[-1] -> 41 | J620: 450.00000000 | K620: 件 | L620: 件 | M620: 200303500000 | N620: 3035 | O620: 1
A621: 酒水饮料 | B621: 果汁饮料 | C621: 统一 鲜橙多 1.5L*6瓶 | E621: 38 | F621: 3 | G621: =RC[-2]+RC[-1] -> 41 | H621: 3 | I621: =RC[-2]+RC[-1] -> 44 | J621: 2.00000000 | K621: 件 | L621: 件 | M621: 200303400000 | N621: 3034 | O621: 1
A622: 酒水饮料 | B622: 果汁饮料 | C622: 统一 鲜橙多 250ml*24瓶 | E622: 30 | F622: 0 | G622: =RC[-2]+RC[-1] -> 30 | H622: 0 | I622: =RC[-2]+RC[-1] -> 30 | J622: 2.00000000 | K622: 件 | L622: 件 | M622: 200303400000 | N622: 3034 | O622: 1
A623: 酒水饮料 | B623: 果汁饮料 | C623: 唯怡绿标90 植物蛋白饮料 960ml*12瓶 | D623: 花生 | G623: =RC[-2]+RC[-1] -> 0 | I623: =RC[-2]+RC[-1] -> 0 | J623: 960.00000000 | K623: 件 | L623: 件 | M623: 200303100000 | N623: 3031 | O623: 1
A624: 酒水饮料 | B624: 果汁饮料 | C624: 唯怡紫标E 植物蛋白饮料 960ml*12瓶 | D624: 花生 核桃 非转基因大豆 | E624: 120 | G624: =RC[-2]+RC[-1] -> 120 | I624: =RC[-2]+RC[-1] -> 120 | J624: 960.00000000 | K624: 件 | L624: 件 | M624: 200303300000 | N624: 3033 | O624: 1
A625: 酒水饮料 | B625: 果汁饮料 | C625: 唯怡紫标90 植物蛋白饮料 960ml*12瓶 | D625: 花生 核桃 非转基因大豆 | G625: =RC[-2]+RC[-1] -> 0 | I625: =RC[-2]+RC[-1] -> 0 | J625: 960.00000000 | K625: 件 | L625: 件 | M625: 200303200000 | N625: 3032 | O625: 1
A626: 酒水饮料 | B626: 果汁饮料 | C626: 唯怡9果原浆 310mlx24听 | E626: 120 | F626: 1 | G626: =RC[-2]+RC[-1] -> 121 | H626: 1 | I626: =RC[-2]+RC[-1] -> 122 | J626: 960.00000000 | K626: 件 | L626: 件 | M626: 200303200000 | N626: 3032 | O626: 1
A627: 酒水饮料 | B627: 果汁饮料 | C627: 唯怡E6 960mlx24听 | E627: 120 | F627: 1 | G627: =RC[-2]+RC[-1] -> 121 | H627: 1 | I627: =RC[-2]+RC[-1] -> 122 | J627: 960.00000000 | K627: 件 | L627: 件 | M627: 200303200000 | N627: 3032 | O627: 1
A628: 酒水饮料 | B628: 果汁饮料 | C628: 加多宝凉茶 500ml*15瓶 | G628: =RC[-2]+RC[-1] -> 0 | I628: =RC[-2]+RC[-1] -> 0 | J628: 500.00000000 | K628: 件 | L628: 件 | M628: 200303800000 | N628: 3038 | O628: 1
A629: 酒水饮料 | B629: 果汁饮料 | C629: 加多宝凉茶 310ml*24听 | E629: 75 | F629: 2 | G629: =RC[-2]+RC[-1] -> 77 | H629: 3 | I629: =RC[-2]+RC[-1] -> 80 | J629: 310.00000000 | K629: 件 | L629: 件 | M629: 200303700000 | N629: 3037 | O629: 1
A630: 酒水饮料 | B630: 果汁饮料 | C630: 加多宝凉茶 250ml*24盒 | G630: =RC[-2]+RC[-1] -> 0 | I630: =RC[-2]+RC[-1] -> 0 | J630: 250.00000000 | K630: 件 | L630: 件 | M630: 200303600000 | N630: 3036 | O630: 1
A631: 酒水饮料 | B631: 饮用水 | C631: 怡宝 纯净水 555ML*24瓶 | G631: =RC[-2]+RC[-1] -> 0 | I631: =RC[-2]+RC[-1] -> 0 | J631: 555.00000000 | K631: 件 | L631: 件 | M631: 200308400000 | N631: 3084 | O631: 1
A632: 酒水饮料 | B632: 饮用水 | C632: 怡宝 纯净水 350ML*24瓶 | E632: 28 | F632: 1 | G632: =RC[-2]+RC[-1] -> 29 | H632: 1 | I632: =RC[-2]+RC[-1] -> 30 | J632: 350.00000000 | K632: 件 | L632: 件 | M632: 200308300000 | N632: 3083 | O632: 1
A633: 酒水饮料 | B633: 饮用水 | C633: 农夫山泉 天然饮用水 550ML*24瓶 | G633: =RC[-2]+RC[-1] -> 0 | I633: =RC[-2]+RC[-1] -> 0 | J633: 550.00000000 | K633: 件 | L633: 件 | M633: 200308100000 | N633: 3081 | O633: 1
A634: 酒水饮料 | B634: 饮用水 | C634: 农夫山泉 天然饮用水 380ML*24瓶 | G634: =RC[-2]+RC[-1] -> 0 | I634: =RC[-2]+RC[-1] -> 0 | J634: 380.00000000 | K634: 件 | L634: 件 | M634: 200308200000 | N634: 3082 | O634: 1
A635: 酒水饮料 | B635: 饮用水 | C635: 冰露 矿泉水 350ML*24瓶 | E635: 15 | F635: 1 | G635: =RC[-2]+RC[-1] -> 16 | H635: 1 | I635: =RC[-2]+RC[-1] -> 17 | J635: 350.00000000 | K635: 件 | L635: 件 | M635: 200308300000 | N635: 3083 | O635: 1
A636: 酒水饮料 | B636: 碳酸饮料 | C636: 芬达 橙味汽水 500ML*24瓶 | G636: =RC[-2]+RC[-1] -> 0 | I636: =RC[-2]+RC[-1] -> 0 | J636: 500.00000000 | K636: 件 | L636: 件 | M636: 200305300000 | N636: 3053 | O636: 1
A637: 酒水饮料 | B637: 碳酸饮料 | C637: 芬达 橙味汽水 330ML*24听 | E637: 43 | F637: 2 | G637: =RC[-2]+RC[-1] -> 45 | H637: 2 | I637: =RC[-2]+RC[-1] -> 47 | J637: 330.00000000 | K637: 件 | L637: 件 | M637: 200305200000 | N637: 3052 | O637: 1
A638: 酒水饮料 | B638: 碳酸饮料 | C638: 芬达 橙味汽水 1.25L*12瓶 | G638: =RC[-2]+RC[-1] -> 0 | I638: =RC[-2]+RC[-1] -> 0 | J638: 1.25000000 | K638: 件 | L638: 件 | M638: 200305100000 | N638: 3051 | O638: 1
A639: 酒水饮料 | B639: 碳酸饮料 | C639: 可口可乐 500ML*24瓶 | E639: 58 | F639: 0 | G639: =RC[-2]+RC[-1] -> 58 | H639: 1 | I639: =RC[-2]+RC[-1] -> 59 | J639: 500.00000000 | K639: 件 | L639: 件 | M639: 200305700000 | N639: 3057 | O639: 1
A640: 酒水饮料 | B640: 碳酸饮料 | C640: 可口可乐 330ML*24听 | E640: 43 | F640: 2 | G640: =RC[-2]+RC[-1] -> 45 | H640: 2 | I640: =RC[-2]+RC[-1] -> 47 | J640: 330.00000000 | K640: 件 | L640: 件 | M640: 200305600000 | N640: 3056 | O640: 1
A641: 酒水饮料 | B641: 碳酸饮料 | C641: 可口可乐 2L*6瓶 | G641: =RC[-2]+RC[-1] -> 0 | I641: =RC[-2]+RC[-1] -> 0 | J641: 2.00000000 | K641: 件 | L641: 件 | M641: 200305500000 | N641: 3055 | O641: 1
A642: 酒水饮料 | B642: 碳酸饮料 | C642: 可口可乐 1.25L*12瓶 | E642: 56 | F642: 1 | G642: =RC[-2]+RC[-1] -> 57 | H642: 1 | I642: =RC[-2]+RC[-1] -> 58 | J642: 1.25000000 | K642: 件 | L642: 件 | M642: 200305400000 | N642: 3054 | O642: 1
A643: 酒水饮料 | B643: 碳酸饮料 | C643: 雪碧 1.25L*12瓶 | E643: 56 | F643: 1 | G643: =RC[-2]+RC[-1] -> 57 | H643: 1 | I643: =RC[-2]+RC[-1] -> 58 | J643: 1.25000000 | K643: 件 | L643: 件 | M643: 200305400000 | N643: 3054 | O643: 1
A644: 酒水饮料 | B644: 碳酸饮料 | C644: 雪碧 330ml*24听 | E644: 43 | F644: 2 | G644: =RC[-2]+RC[-1] -> 45 | H644: 2 | I644: =RC[-2]+RC[-1] -> 47 | J644: 1.25000000 | K644: 件 | L644: 件 | M644: 200305400000 | N644: 3054 | O644: 1
A645: 酒水饮料 | B645: 碳酸饮料 | C645: 雪碧 500ML*24瓶 | E645: 58 | F645: 0 | G645: =RC[-2]+RC[-1] -> 58 | H645: 1 | I645: =RC[-2]+RC[-1] -> 59 | J645: 500.00000000 | K645: 件 | L645: 件 | M645: 200305700000 | N645: 3057 | O645: 1
A646: 酒水饮料 | B646: 果汁饮料 | C646: 美汁源 果粒橙 1.25L*12 | E646: 76 | F646: 1 | G646: =RC[-2]+RC[-1] -> 77 | H646: 1 | I646: =RC[-2]+RC[-1] -> 78 | J646: 500.00000000 | K646: 件 | L646: 件 | M646: 200305700000 | N646: 3057 | O646: 1
A647: 酒水饮料 | B647: 果汁饮料 | C647: 红牛 250ml*24 | E647: 124 | F647: 0 | G647: =RC[-2]+RC[-1] -> 124 | H647: 1 | I647: =RC[-2]+RC[-1] -> 125 | J647: 500.00000000 | K647: 件 | L647: 件 | M647: 200305700000 | N647: 3057 | O647: 1
A648: 酒水饮料 | B648: 果汁饮料 | C648: 威仕康星 酸角汁 250ml*24 | E648: 90 | F648: 1 | G648: =RC[-2]+RC[-1] -> 91 | H648: 1 | I648: =RC[-2]+RC[-1] -> 92 | J648: 500.00000000 | K648: 件 | L648: 件 | M648: 200305700000 | N648: 3057 | O648: 1
A649: 酒水饮料 | B649: 果汁饮料 | C649: 威仕康星 芒果汁 226ml*20 | E649: 90 | F649: 1 | G649: =RC[-2]+RC[-1] -> 91 | H649: 1 | I649: =RC[-2]+RC[-1] -> 92 | J649: 500.00000000 | K649: 件 | L649: 件 | M649: 200305700000 | N649: 3057 | O649: 1
A650: 酒水饮料 | B650: 果汁饮料 | C650: 六个核桃 无糖核桃乳 240ml*20 | E650: 78 | F650: 1 | G650: =RC[-2]+RC[-1] -> 79 | H650: 1 | I650: =RC[-2]+RC[-1] -> 80 | J650: 500.00000000 | K650: 件 | L650: 件 | M650: 200305700000 | N650: 3057 | O650: 1
A651: 酒水饮料 | B651: 饮用水 | C651: 白鹿天然饮用水 | D651: 0.75L*12 | E651: 205 | F651: 5 | G651: =RC[-2]+RC[-1] -> 210 | H651: 5 | I651: =RC[-2]+RC[-1] -> 215
A652: 酒水饮料 | B652: 饮用水 | C652: 白鹿含气天然矿泉水 | D652: 0.75L*12 | E652: 205 | F652: 5 | G652: =RC[-2]+RC[-1] -> 210 | H652: 5 | I652: =RC[-2]+RC[-1] -> 215
A653: 酒水饮料 | B653: 饮用水 | C653: 滋宝皇妃天然矿泉水 | D653: 1.5L*12 | E653: 158 | F653: 4 | G653: =RC[-2]+RC[-1] -> 162 | H653: 4 | I653: =RC[-2]+RC[-1] -> 166
A654: 酒水饮料 | B654: 饮用水 | C654: 滋宝皇妃天然矿泉水 | D654: 0.500L*24Bt | E654: 158 | F654: 4 | G654: =RC[-2]+RC[-1] -> 162 | H654: 4 | I654: =RC[-2]+RC[-1] -> 166
A655: 酒水饮料 | B655: 饮用水 | C655: 滋宝皇妃天然矿泉水 | D655: 0.330L*24Bt | E655: 152 | F655: 4 | G655: =RC[-2]+RC[-1] -> 156 | H655: 4 | I655: =RC[-2]+RC[-1] -> 160
A656: 酒水饮料 | B656: 果汁饮料 | C656: 宝蓝吉柠檬汁 | D656: 125ml*24 | E656: 236 | F656: 5 | G656: =RC[-2]+RC[-1] -> 241 | H656: 5 | I656: =RC[-2]+RC[-1] -> 246
A657: 酒水饮料 | B657: 果汁饮料 | C657: 宝蓝吉青柠檬汁 | D657: 125ml*24 | E657: 236 | F657: 5 | G657: =RC[-2]+RC[-1] -> 241 | H657: 5 | I657: =RC[-2]+RC[-1] -> 246
A658: 酒水饮料 | B658: 果汁饮料 | C658: 宝蓝吉柠檬汁 | D658: 1L*6 | E658: 140 | F658: 3 | G658: =RC[-2]+RC[-1] -> 143 | H658: 3 | I658: =RC[-2]+RC[-1] -> 146
A659: 酒水饮料 | B659: 啤酒 | C659: 宝蓝吉柠檬啤酒 | D659: 0.330L*12Bt | E659: 366.8 | F659: 5 | G659: =RC[-2]+RC[-1] -> 371.8 | H659: 5 | I659: =RC[-2]+RC[-1] -> 376.8
A660: 酒水饮料 | B660: 果汁饮料 | C660: 宝蓝吉传统柠檬汁 | D660: 200ml*15 | E660: 160.25 | F660: 4 | G660: =RC[-2]+RC[-1] -> 164.25 | H660: 4 | I660: =RC[-2]+RC[-1] -> 168.25
A661: 酒水饮料 | B661: 果汁饮料 | C661: 宝蓝吉传统柠檬汁 | D661: 125ml*24 | E661: 162.79999999999998 | F661: 4 | G661: =RC[-2]+RC[-1] -> 166.79999999999998 | H661: 4 | I661: =RC[-2]+RC[-1] -> 170.79999999999998
A662: 酒水饮料 | B662: 果汁饮料 | C662: 宝蓝吉传统柠檬汁 | D662: 500ml*6 | E662: 140 | F662: 4 | G662: =RC[-2]+RC[-1] -> 144 | H662: 4 | I662: =RC[-2]+RC[-1] -> 148
A663: 酒水饮料 | B663: 果汁饮料 | C663: 雪域真情酸奶 | D663: 1*15盒 | E663: 270 | F663: 2 | G663: =RC[-2]+RC[-1] -> 272 | H663: 3 | I663: =RC[-2]+RC[-1] -> 275
A664: 酒水饮料 | B664: 果汁饮料 | C664: 世锦苹果醋 | D664: 1*12瓶 | E664: 180 | F664: 2 | G664: =RC[-2]+RC[-1] -> 182 | H664: 3 | I664: =RC[-2]+RC[-1] -> 185
A665: 酒水饮料 | B665: 果汁饮料 | C665: 椰奶1000ml | D665: 1*12瓶 | E665: 156 | F665: 2 | G665: =RC[-2]+RC[-1] -> 158 | H665: 3 | I665: =RC[-2]+RC[-1] -> 161
A666: 酒水饮料 | B666: 果汁饮料 | C666: 王老吉 | D666: 1*24听 | E666: 75 | F666: 2 | G666: =RC[-2]+RC[-1] -> 77 | H666: 3 | I666: =RC[-2]+RC[-1] -> 80
A667: 餐饮半成品 | B667: 面食 | C667: 安徽相思墩家常年糕 1*30袋 | E667: 90 | F667: 5 | G667: =RC[-2]+RC[-1] -> 95 | H667: 5 | I667: =RC[-2]+RC[-1] -> 100 | K667: 件 | L667: 件 | O667: 1 | P667: 海霸王 | Q667: 金博水产
A668: 餐饮半成品 | B668: 其他 | C668: 安徽神师徽鸡蛋干 1*50袋 | E668: 95 | F668: 2 | G668: =RC[-2]+RC[-1] -> 97 | H668: 3 | I668: =RC[-2]+RC[-1] -> 100 | K668: 件 | L668: 件 | O668: 1 | P668: 海霸王 | Q668: 金博水产
A669: 餐饮半成品 | B669: 其他 | C669: 咸蛋黄 1*20袋 | E669: 460 | F669: 7 | G669: =RC[-2]+RC[-1] -> 467 | H669: 8 | I669: =RC[-2]+RC[-1] -> 475 | K669: 件 | L669: 件 | O669: 1 | P669: 海霸王 | Q669: 金博水产
A670: 餐饮半成品 | B670: 其他 | C670: 云南王中王豆皮 1*14袋 | E670: 78 | F670: 2 | G670: =RC[-2]+RC[-1] -> 80 | H670: 2 | I670: =RC[-2]+RC[-1] -> 82 | K670: 件 | L670: 件 | O670: 1 | P670: 海霸王 | Q670: 金博水产
A671: 餐饮半成品 | B671: 其他 | C671: 苕皮 1*80袋 | E671: 72 | F671: 2 | G671: =RC[-2]+RC[-1] -> 74 | H671: 2 | I671: =RC[-2]+RC[-1] -> 76 | K671: 件 | L671: 件 | O671: 1 | P671: 海霸王 | Q671: 金博水产
A672: 餐饮半成品 | B672: 其他 | C672: 祥友香豆腐 1*10袋 | E672: 78 | F672: 2 | G672: =RC[-2]+RC[-1] -> 80 | H672: 2 | I672: =RC[-2]+RC[-1] -> 82 | K672: 件 | L672: 件 | O672: 1 | P672: 海霸王 | Q672: 金博水产
A673: 餐饮半成品 | B673: 其他 | C673: 友发千叶豆腐 1*30袋 | E673: 85 | F673: 2 | G673: =RC[-2]+RC[-1] -> 87 | H673: 2 | I673: =RC[-2]+RC[-1] -> 89 | K673: 件 | L673: 件 | O673: 1 | P673: 海霸王 | Q673: 金博水产
A674: 餐饮半成品 | B674: 其他 | C674: 酥排 1*8袋 | E674: 63 | F674: 2 | G674: =RC[-2]+RC[-1] -> 65 | H674: 2 | I674: =RC[-2]+RC[-1] -> 67 | K674: 件 | L674: 件 | O674: 1 | P674: 海霸王 | Q674: 金博水产

Sheet: 供货商
A1: 产品 | B1: 批发市场 | C1: 供货商
A2: 冻品（猪副，鸭副，鸡副） | B2: 白家 | C2: 绿海食品 临街商铺1号楼17-18号 13730868926 谢小姐 15196695905
A3: 菌菇 | B3: 白家 | C3: 老潘靖平菌业 蔬菜批发市场7号 13541166390 15828265048
A4: 猪肉 | B4: 白家 | C4: 四海肉业
A5: 大米 | B5: 海霸王 | C5: 粮道王 4栋17-18号 18608150026 刘学剑
A6: 大米 | B6: 西南食品城 | C6: D-43 顺发批发部 13330982687 江绍东 66073238
A7: 油 | B7: 西南食品城 | C7: 广汉市油脂公司 东1幢5号 13551378262 吝超 13348974358 吝超
A8: 酒水 | C8: 成都尊瑞商贸酒水